{
  "reading": "Developing Listening and Speaking Skills in Language Learning\\n\\nIntroduction\\n\\nListening and speaking are fundamental skills in language acquisition and communication. For language learners, developing proficiency in these areas is crucial for effective interaction in real-world situations. This paper explores the key aspects of developing listening and speaking skills, examining strategies, challenges, and best practices for enhancing these vital language competencies.\\n\\nThe Importance of Listening Skills\\n\\nListening [BLANK_1] forms the foundation of language learning. It involves not just hearing words, but understanding their meaning within context. Effective listening skills enable learners to:\\n\\n1. Grasp the overall message ([BLANK_2]) of spoken language\\n2. Identify specific details and information\\n3. Recognize tone, emotion, and speaker intent\\n4. Improve pronunciation through exposure to native speech\\n\\nDeveloping listening skills requires consistent practice and exposure to a variety of authentic materials, such as conversations, broadcasts, and storytelling.\\n\\nStrategies for Enhancing Listening Comprehension\\n\\nSeveral strategies can help learners improve their listening skills:\\n\\n1. Pre-listening activities: Activating prior knowledge and making [BLANK_3]s based on context clues can prepare listeners for upcoming information.\\n\\n2. Active listening: Focusing on key words, main ideas, and contextual cues while listening helps maintain engagement and comprehension.\\n\\n3. Note-taking: Jotting down key points can aid in retention and post-listening review.\\n\\n4. Repeated listening: Multiple exposures to the same content can reveal previously missed details and reinforce understanding.\\n\\n5. Post-listening reflection: Discussing or summarizing what was heard helps consolidate learning and identify areas for improvement.\\n\\nThe Role of Speaking in Language Acquisition\\n\\nSpeaking skills allow learners to actively produce language, reinforcing vocabulary and grammatical structures learned through other means. Developing speaking proficiency involves:\\n\\n1. Building confidence in oral communication\\n2. Improving fluency and spontaneity\\n3. Expanding vocabulary and idiomatic expressions\\n4. Refining pronunciation and intonation\\n5. Adapting language use to different social contexts\\n\\nTechniques for Enhancing Speaking Skills\\n\\nSeveral techniques can be employed to improve speaking abilities:\\n\\n1. [BLANK_4]: Engaging in simulated [BLANK_5]s allows learners to practice language in context and develop conversational skills.\\n\\n2. Discussion groups: Participating in group discussions on various topics encourages spontaneous language use and opinion formation.\\n\\n3. Presentations: Preparing and delivering short talks helps learners organize thoughts and speak coherently on specific subjects.\\n\\n4. [BLANK_6]: Narrating stories, whether personal anecdotes or cultural tales, promotes creative language use and sequencing skills.\\n\\n5. Pronunciation drills: Focused practice on specific sounds and intonation patterns can improve overall clarity of speech.\\n\\nIntegrating Listening and Speaking\\n\\nWhile often taught separately, listening and speaking skills are inherently interconnected. Effective language learning approaches integrate these skills through activities such as:\\n\\n1. Listen and respond exercises: Learners listen to prompts and provide appropriate verbal responses.\\n\\n2. Dictation: Writing down spoken text verbatim improves both listening accuracy and speaking through read-back.\\n\\n3. Shadowing: Repeating spoken text in real-time enhances listening comprehension and speaking fluency simultaneously.\\n\\n4. Interactive multimedia: Using audio-visual materials with interactive components engages both receptive and productive language skills.\\n\\nChallenges in Developing Listening and Speaking Skills\\n\\nLearners often face several challenges when developing these skills:\\n\\n1. Anxiety: Fear of making mistakes can inhibit willingness to speak and actively engage in listening tasks.\\n\\n2. Limited exposure: Lack of authentic language input can slow progress, especially in foreign language contexts.\\n\\n3. Interference from native language: Pronunciation and listening difficulties may arise due to differences between the target and native languages.\\n\\n4. Speed of native speech: Keeping up with the natural pace of native speakers can be overwhelming for learners.\\n\\n5. Cultural nuances: Understanding cultural references and non-verbal cues can impact both listening comprehension and appropriate speaking.\\n\\nConclusion\\n\\nDeveloping strong listening and speaking skills is essential for effective language acquisition and use. By employing a variety of strategies and techniques, learners can enhance their ability to comprehend spoken language and communicate fluently. Integrating these skills in practice and recognizing the challenges involved allows for a more holistic approach to language learning. As learners progress, their improved listening and speaking abilities will enable them to engage more confidently and competently in real-world language situations, ultimately achieving their communication goals.",
  "vocabulary": {
    "[BLANK_1]": "Grasp the overall message ([BLANK_2]) of spoken language",
    "[BLANK_2]": "Identify specific details and information",
    "[BLANK_3]": "Recognize tone, emotion, and speaker intent",
    "[BLANK_4]": "Improve pronunciation through exposure to native speech",
    "[BLANK_5]": "Pre-listening activities: Activating prior knowledge and making [BLANK_3]s based on context clues can prepare listeners for upcoming information.",
    "[BLANK_6]": "Active listening: Focusing on key words, main ideas, and contextual cues while listening helps maintain engagement and comprehension.",
    "[BLANK_7]": "Note-taking: Jotting down key points can aid in retention and post-listening review.",
    "[BLANK_8]": "Repeated listening: Multiple exposures to the same content can reveal previously missed details and reinforce understanding.",
    "[BLANK_9]": "Post-listening reflection: Discussing or summarizing what was heard helps consolidate learning and identify areas for improvement.",
    "[BLANK_10]": "Building confidence in oral communication",
    "[BLANK_11]": "Improving fluency and spontaneity",
    "[BLANK_12]": "Expanding vocabulary and idiomatic expressions",
    "[BLANK_13]": "Refining pronunciation and intonation",
    "[BLANK_14]": "Adapting language use to different social contexts",
    "[BLANK_15]": "[BLANK_4]: Engaging in simulated [BLANK_5]s allows learners to practice language in context and develop conversational skills.",
    "[BLANK_16]": "Discussion groups: Participating in group discussions on various topics encourages spontaneous language use and opinion formation.",
    "[BLANK_17]": "Presentations: Preparing and delivering short talks helps learners organize thoughts and speak coherently on specific subjects.",
    "[BLANK_18]": "[BLANK_6]: Narrating stories, whether personal anecdotes or cultural tales, promotes creative language use and sequencing skills.",
    "[BLANK_19]": "Pronunciation drills: Focused practice on specific sounds and intonation patterns can improve overall clarity of speech.",
    "[BLANK_20]": "Listen and respond exercises: Learners listen to prompts and provide appropriate verbal responses.",
    "[BLANK_21]": "Dictation: Writing down spoken text verbatim improves both listening accuracy and speaking through read-back.",
    "[BLANK_22]": "Shadowing: Repeating spoken text in real-time enhances listening comprehension and speaking fluency simultaneously.",
    "[BLANK_23]": "Interactive multimedia: Using audio-visual materials with interactive components engages both receptive and productive language skills.",
    "[BLANK_24]": "Anxiety: Fear of making mistakes can inhibit willingness to speak and actively engage in listening tasks.",
    "[BLANK_25]": "Limited exposure: Lack of authentic language input can slow progress, especially in foreign language contexts.",
    "[BLANK_26]": "Interference from native language: Pronunciation and listening difficulties may arise due to differences between the target and native languages.",
    "[BLANK_27]": "Speed of native speech: Keeping up with the natural pace of native speakers can be overwhelming for learners.",
    "[BLANK_28]": "Cultural nuances: Understanding cultural references and non-verbal cues can impact both listening comprehension and appropriate speaking.",
    "[BLANK_29]": "comprehension",
    "[BLANK_30]": "gist",
    "[BLANK_31]": "prediction",
    "[BLANK_32]": "Role play",
    "[BLANK_33]": "scenario",
    "[BLANK_34]": "Folk tale",
    "[BLANK_35]": "Total Physical Response",
    "[BLANK_36]": "facilitate",
    "[BLANK_37]": "Comprehension",
    "[BLANK_38]": "Prediction"
  }
}