{
  "reading": "Teaching Vocabulary: A Fundamental Aspect of Language Learning\\n\\nIntroduction\\n\\nVocabulary forms the building blocks of language, serving as the foundation upon which effective communication is built. The ability to understand and use a wide range of words is crucial for language learners to express themselves accurately and comprehend others fluently. This article explores the importance of vocabulary in language acquisition and examines various techniques and strategies for effective vocabulary instruction and retention.\\n\\nThe Importance of Vocabulary\\n\\nVocabulary knowledge is intrinsically linked to language proficiency. A rich vocabulary enables learners to understand spoken and written language more easily, express complex ideas more precisely, and engage in more sophisticated communication. Research has consistently shown that vocabulary size correlates strongly with reading comprehension, academic success, and overall language proficiency.\\n\\nIn the context of second language acquisition, vocabulary learning is particularly critical. Unlike grammar rules, which are finite and can be mastered through systematic study, vocabulary is an open-ended system that requires ongoing attention and expansion throughout a learner's language journey.\\n\\nKey Principles of Vocabulary Instruction\\n\\nEffective vocabulary instruction is guided by several key principles:\\n\\n1. Context: Words are best learned in meaningful contexts rather than in isolation. Presenting vocabulary within sentences, stories, or real-life situations helps learners understand not just the definition, but also how the word is used naturally.\\n\\n2. Multiple exposures: Research indicates that learners need to encounter a new word multiple times in various contexts to fully acquire it. This principle underscores the importance of recycling vocabulary through different activities and over time.\\n\\n3. Active engagement: Passive exposure to words is not sufficient for deep learning. Learners must actively engage with new vocabulary through various tasks and exercises to internalize the words effectively.\\n\\n4. Multimodal learning: Engaging multiple senses in the learning process enhances retention. This can involve visual aids, auditory input, kinesthetic activities, and even taste or smell when relevant to the vocabulary being taught.\\n\\n5. Personalization: Encouraging learners to connect new vocabulary to their own experiences and knowledge promotes deeper understanding and better retention.\\n\\nEffective Vocabulary Teaching Techniques\\n\\nSeveral techniques have proven effective in vocabulary instruction:\\n\\n1. Visual representations: Using pictures, diagrams, or real objects to illustrate word meanings can be particularly helpful for concrete nouns and some verbs.\\n\\n2. Word mapping: Creating semantic maps or word webs helps learners understand relationships between words and reinforces meaning.\\n\\n3. Contextual guessing: Teaching strategies for inferring word meanings from context clues in reading passages develops important skills for independent vocabulary acquisition.\\n\\n4. Word parts analysis: Understanding common prefixes, suffixes, and root words enables learners to deduce meanings of unfamiliar words and remember them more easily.\\n\\n5. Mnemonic devices: Creating memorable associations or acronyms can aid in recalling word meanings.\\n\\n6. Vocabulary notebooks: Encouraging learners to keep personalized vocabulary logs promotes active engagement with new words and provides a useful reference for review.\\n\\n7. Games and interactive activities: Incorporating vocabulary into games and interactive tasks makes learning more engaging and memorable.\\n\\nTechnology in Vocabulary Learning\\n\\nThe digital age has brought new opportunities for vocabulary instruction and independent learning. Mobile apps, online flashcard systems, and adaptive learning platforms offer personalized vocabulary practice and spaced repetition to optimize retention. These tools can supplement traditional classroom instruction and provide learners with opportunities for additional exposure and practice.\\n\\nChallenges in Vocabulary Instruction\\n\\nDespite its importance, vocabulary instruction faces several challenges. The sheer number of words in a language can be overwhelming, necessitating careful selection of which words to teach explicitly. Additionally, the depth of word knowledge required (including multiple meanings, collocations, and connotations) goes beyond simple definitions, making thorough vocabulary instruction time-consuming.\\n\\nAnother challenge is the transfer of receptive vocabulary (words recognized when heard or read) to productive vocabulary (words used in speaking or writing). Effective instruction must bridge this gap through activities that require active use of new vocabulary.\\n\\nConclusion\\n\\nTeaching vocabulary is a complex but crucial aspect of language instruction. By employing a variety of techniques that engage learners actively, provide meaningful context, and offer multiple exposures to new words, educators can help learners build the robust vocabulary necessary for effective communication. As our understanding of vocabulary acquisition continues to evolve, so too will the strategies and technologies we use to facilitate this fundamental aspect of language learning. Ultimately, a strong vocabulary empowers learners to express themselves more precisely, understand more deeply, and engage more fully with the target language and its speakers.\\n\\nDaily Routine Exercise\\n\\nComplete the following sentences with the appropriate vocabulary words:\\n\\n1. Every morning, I [BLANK_1] at 7:00 AM when my alarm goes off.\\n2. After getting out of bed, I [BLANK_2] and put on my clothes for the day.\\n3. Before leaving the house, I always [BLANK_3] to start my day with energy.\\n4. At 8:30 AM, I [BLANK_4] to begin my workday.\\n5. Around noon, I take a break to [BLANK_5] with my colleagues.\\n6. After a long day at work, I [BLANK_6] around 6:00 PM.\\n7. In the evening, I [BLANK_7] for my family to enjoy together.\\n8. To relax, I often [BLANK_8] for an hour before bedtime.\\n9. Before going to sleep, I [BLANK_9] to freshen up.\\n10. Finally, I [BLANK_10] around 11:00 PM to get a good night's rest.",
  "vocabulary": {
    "[BLANK_1]": "Context: Words are best learned in meaningful contexts rather than in isolation. Presenting vocabulary within sentences, stories, or real-life situations helps learners understand not just the definition, but also how the word is used naturally.",
    "[BLANK_2]": "Multiple exposures: Research indicates that learners need to encounter a new word multiple times in various contexts to fully acquire it. This principle underscores the importance of recycling vocabulary through different activities and over time.",
    "[BLANK_3]": "Active engagement: Passive exposure to words is not sufficient for deep learning. Learners must actively engage with new vocabulary through various tasks and exercises to internalize the words effectively.",
    "[BLANK_4]": "Multimodal learning: Engaging multiple senses in the learning process enhances retention. This can involve visual aids, auditory input, kinesthetic activities, and even taste or smell when relevant to the vocabulary being taught.",
    "[BLANK_5]": "Personalization: Encouraging learners to connect new vocabulary to their own experiences and knowledge promotes deeper understanding and better retention.",
    "[BLANK_6]": "Visual representations: Using pictures, diagrams, or real objects to illustrate word meanings can be particularly helpful for concrete nouns and some verbs.",
    "[BLANK_7]": "Word mapping: Creating semantic maps or word webs helps learners understand relationships between words and reinforces meaning.",
    "[BLANK_8]": "Contextual guessing: Teaching strategies for inferring word meanings from context clues in reading passages develops important skills for independent vocabulary acquisition.",
    "[BLANK_9]": "Word parts analysis: Understanding common prefixes, suffixes, and root words enables learners to deduce meanings of unfamiliar words and remember them more easily.",
    "[BLANK_10]": "Mnemonic devices: Creating memorable associations or acronyms can aid in recalling word meanings.",
    "[BLANK_11]": "Vocabulary notebooks: Encouraging learners to keep personalized vocabulary logs promotes active engagement with new words and provides a useful reference for review.",
    "[BLANK_12]": "Games and interactive activities: Incorporating vocabulary into games and interactive tasks makes learning more engaging and memorable.",
    "[BLANK_13]": "Every morning, I [BLANK_1] at 7:00 AM when my alarm goes off.",
    "[BLANK_14]": "After getting out of bed, I [BLANK_2] and put on my clothes for the day.",
    "[BLANK_15]": "Before leaving the house, I always [BLANK_3] to start my day with energy.",
    "[BLANK_16]": "At 8:30 AM, I [BLANK_4] to begin my workday.",
    "[BLANK_17]": "Around noon, I take a break to [BLANK_5] with my colleagues.",
    "[BLANK_18]": "After a long day at work, I [BLANK_6] around 6:00 PM.",
    "[BLANK_19]": "In the evening, I [BLANK_7] for my family to enjoy together.",
    "[BLANK_20]": "To relax, I often [BLANK_8] for an hour before bedtime.",
    "[BLANK_21]": "Before going to sleep, I [BLANK_9] to freshen up.",
    "[BLANK_22]": "Finally, I [BLANK_10] around 11:00 PM to get a good night's rest.",
    "[BLANK_23]": "wake up",
    "[BLANK_24]": "get dressed",
    "[BLANK_25]": "eat breakfast",
    "[BLANK_26]": "go to work",
    "[BLANK_27]": "have lunch",
    "[BLANK_28]": "come home",
    "[BLANK_29]": "make dinner",
    "[BLANK_30]": "watch TV",
    "[BLANK_31]": "take a shower",
    "[BLANK_32]": "go to bed"
  }
}