{
  "reading": "Teaching Phonics and Early Literacy: Building Blocks for Reading Success\\n\\nIntroduction\\n\\nEarly literacy skills form the foundation for a child's educational journey and future academic success. Among these crucial skills, [BLANK_1] instruction plays a pivotal role in helping young learners decode written language and develop reading fluency. This article explores the importance of teaching phonics and early literacy, examining key concepts, methodologies, and their impact on children's reading development.\\n\\nUnderstanding Phonics and Early Literacy\\n\\n[BLANK_1] is an instructional method that focuses on the relationship between sounds in spoken language ([BLANK_2]s) and the letters that represent those sounds in written language ([BLANK_3]s). This approach helps children understand that there are systematic and predictable relationships between written letters and spoken sounds, a concept known as the alphabetic principle.\\n\\nEarly literacy encompasses a broader set of skills that include [BLANK_4], vocabulary development, comprehension, and writing. Phonics instruction is a critical component of early literacy education, providing children with the tools to decode unfamiliar words and build reading confidence.\\n\\nKey Components of Phonics Instruction\\n\\n1. [BLANK_4]: Before children can associate sounds with letters, they need to be able to hear and manipulate the individual sounds in spoken words. Activities that develop phonemic awareness include rhyming games, sound segmentation, and [BLANK_5] exercises.\\n\\n2. Letter-Sound Correspondences: Children learn to associate specific sounds with individual letters or letter combinations. For example, learning that the letter 'b' represents the /b/ sound as in \\\"ball\\\" or \\\"bat\\\".\\n\\n3. [BLANK_5]: This skill involves combining individual sounds to form words. For instance, blending the sounds /c/ /a/ /t/ to read the word \\\"cat\\\".\\n\\n4. [BLANK_6]: The opposite of blending, segmenting requires breaking words into their individual sounds. This skill is crucial for spelling and writing development.\\n\\n5. Sight Words: While many words can be decoded using phonics rules, some high-frequency words are taught as sight words to be recognized instantly, improving reading fluency.\\n\\nBenefits of Systematic Phonics Instruction\\n\\nResearch has consistently shown that systematic phonics instruction leads to significant benefits in reading development, particularly for beginning readers and children at risk for reading difficulties. Some key advantages include:\\n\\n1. Improved Word Recognition: Children taught with phonics can more easily decode unfamiliar words, expanding their reading vocabulary.\\n\\n2. Enhanced Reading Fluency: As decoding becomes automatic, children can focus more on comprehension, leading to smoother and more fluent reading.\\n\\n3. Better Spelling Skills: Understanding sound-letter relationships helps children spell words more accurately.\\n\\n4. Increased Confidence: The ability to tackle new words independently boosts children's confidence in their reading abilities.\\n\\nChallenges and Considerations\\n\\nWhile phonics instruction is highly effective, it's important to note that it should be part of a balanced literacy approach. Some challenges to consider include:\\n\\n1. English Irregularities: The English language has many exceptions to phonics rules, which can be confusing for learners.\\n\\n2. Overemphasis on Decoding: Care must be taken to ensure that comprehension and enjoyment of reading are not overshadowed by a focus on decoding skills.\\n\\n3. Individual Differences: Children learn at different paces and may require varied approaches to phonics instruction.\\n\\n4. Second Language Learners: For children learning English as a second language, phonics instruction may need to be adapted to account for differences in their native language phonology.\\n\\nImplementing Effective Phonics Instruction\\n\\nSuccessful phonics instruction typically involves:\\n\\n1. Systematic and Explicit Teaching: Introducing letter-sound relationships in a logical sequence and directly teaching phonics rules.\\n\\n2. Multisensory Approaches: Using visual, auditory, and kinesthetic methods to reinforce learning.\\n\\n3. Regular Practice: Providing ample opportunities for children to apply their phonics knowledge in reading and writing activities.\\n\\n4. Use of [BLANK_7] Texts: Employing texts that are composed primarily of words that can be sounded out using known letter-sound correspondences.\\n\\n5. Integration with Other Literacy Skills: Combining phonics instruction with vocabulary development, comprehension strategies, and writing activities.\\n\\nConclusion\\n\\nTeaching phonics and early literacy skills is a crucial endeavor that sets the stage for children's long-term reading success. By providing systematic instruction in [BLANK_4] and letter-sound relationships, educators equip young learners with the tools to decode written language, build vocabulary, and develop reading fluency. While phonics is not a panacea for all reading challenges, it remains a cornerstone of effective early literacy instruction. As part of a comprehensive approach to literacy education, phonics empowers children to become confident, skilled readers, opening doors to knowledge and imagination through the written word.",
  "vocabulary": {
    "[BLANK_1]": "[BLANK_4]: Before children can associate sounds with letters, they need to be able to hear and manipulate the individual sounds in spoken words. Activities that develop phonemic awareness include rhyming games, sound segmentation, and [BLANK_5] exercises.",
    "[BLANK_2]": "Letter-Sound Correspondences: Children learn to associate specific sounds with individual letters or letter combinations. For example, learning that the letter 'b' represents the /b/ sound as in \\\"ball\\\" or \\\"bat\\\".",
    "[BLANK_3]": "[BLANK_5]: This skill involves combining individual sounds to form words. For instance, blending the sounds /c/ /a/ /t/ to read the word \\\"cat\\\".",
    "[BLANK_4]": "[BLANK_6]: The opposite of blending, segmenting requires breaking words into their individual sounds. This skill is crucial for spelling and writing development.",
    "[BLANK_5]": "Sight Words: While many words can be decoded using phonics rules, some high-frequency words are taught as sight words to be recognized instantly, improving reading fluency.",
    "[BLANK_6]": "Improved Word Recognition: Children taught with phonics can more easily decode unfamiliar words, expanding their reading vocabulary.",
    "[BLANK_7]": "Enhanced Reading Fluency: As decoding becomes automatic, children can focus more on comprehension, leading to smoother and more fluent reading.",
    "[BLANK_8]": "Better Spelling Skills: Understanding sound-letter relationships helps children spell words more accurately.",
    "[BLANK_9]": "Increased Confidence: The ability to tackle new words independently boosts children's confidence in their reading abilities.",
    "[BLANK_10]": "English Irregularities: The English language has many exceptions to phonics rules, which can be confusing for learners.",
    "[BLANK_11]": "Overemphasis on Decoding: Care must be taken to ensure that comprehension and enjoyment of reading are not overshadowed by a focus on decoding skills.",
    "[BLANK_12]": "Individual Differences: Children learn at different paces and may require varied approaches to phonics instruction.",
    "[BLANK_13]": "Second Language Learners: For children learning English as a second language, phonics instruction may need to be adapted to account for differences in their native language phonology.",
    "[BLANK_14]": "Systematic and Explicit Teaching: Introducing letter-sound relationships in a logical sequence and directly teaching phonics rules.",
    "[BLANK_15]": "Multisensory Approaches: Using visual, auditory, and kinesthetic methods to reinforce learning.",
    "[BLANK_16]": "Regular Practice: Providing ample opportunities for children to apply their phonics knowledge in reading and writing activities.",
    "[BLANK_17]": "Use of [BLANK_7] Texts: Employing texts that are composed primarily of words that can be sounded out using known letter-sound correspondences.",
    "[BLANK_18]": "Integration with Other Literacy Skills: Combining phonics instruction with vocabulary development, comprehension strategies, and writing activities.",
    "[BLANK_19]": "phonics",
    "[BLANK_20]": "phoneme",
    "[BLANK_21]": "grapheme",
    "[BLANK_22]": "phonemic awareness",
    "[BLANK_23]": "blending",
    "[BLANK_24]": "segmenting",
    "[BLANK_25]": "decodable",
    "[BLANK_26]": "phonics",
    "[BLANK_27]": "phonemic awareness",
    "[BLANK_28]": "phonemic awareness"
  }
}