{
  "reading": "Reflective Teaching Practice: A Key to Professional Growth in Education\\n\\nIntroduction\\n\\n[BLANK_1] teaching practice is a powerful approach that enables educators to critically examine and improve their teaching methods. This process involves thoughtful consideration of one's classroom experiences, instructional strategies, and student outcomes. By engaging in reflective practice, teachers can identify areas for improvement, enhance their effectiveness, and ultimately provide better learning experiences for their students. This article explores the concept of reflective teaching practice, its benefits, and strategies for implementation.\\n\\nUnderstanding Reflective Teaching Practice\\n\\nAt its core, reflective teaching practice is a systematic method of self-evaluation and professional development. It encourages teachers to step back from their daily routines and critically analyze their teaching methods, classroom management techniques, and student interactions. This process goes beyond simple introspection; it requires educators to question their assumptions, challenge their beliefs, and seek evidence-based solutions to improve their practice.\\n\\nKey Components of Reflective Teaching Practice\\n\\n1. [BLANK_2]: Teachers engage in honest self-assessment of their teaching performance, considering both strengths and areas for improvement.\\n\\n2. [BLANK_3]: Colleagues observe and provide [BLANK_4] on [BLANK_5], offering fresh perspectives and insights.\\n\\n3. Student feedback: Gathering input from students helps teachers understand the impact of their teaching from the learners' point of view.\\n\\n4. Video analysis: Recording and reviewing lessons allows teachers to observe their teaching objectively and identify areas for refinement.\\n\\n5. Action planning: Based on reflections and feedback, teachers develop specific strategies to enhance their teaching practice.\\n\\nBenefits of Reflective Teaching Practice\\n\\nImplementing reflective teaching practice offers numerous advantages for educators and students alike:\\n\\n1. Improved teaching quality: By continuously evaluating and refining their methods, teachers can enhance the effectiveness of their instruction.\\n\\n2. Increased [BLANK_6]: Reflective practice helps teachers identify and implement strategies that better engage and motivate students.\\n\\n3. Professional growth: Regular reflection fosters ongoing learning and development for teachers throughout their careers.\\n\\n4. Enhanced problem-solving skills: The reflective process hones teachers' ability to identify and address challenges in the classroom.\\n\\n5. Greater job satisfaction: As teachers see improvements in their practice and student outcomes, they often experience increased job satisfaction and motivation.\\n\\nStrategies for Implementing Reflective Teaching Practice\\n\\n1. Keep a teaching journal: Regularly document thoughts, observations, and ideas about teaching experiences.\\n\\n2. Seek peer observations: Invite colleagues to observe lessons and provide constructive feedback.\\n\\n3. Use video recordings: Record lessons for self-analysis and peer review.\\n\\n4. Participate in professional learning communities: Engage in collaborative reflection with other educators.\\n\\n5. Collect student feedback: Regularly gather input from students about their learning experiences.\\n\\n6. Set specific goals: Identify areas for improvement and create actionable plans to address them.\\n\\n7. Engage in action research: Conduct small-scale research projects to investigate and improve specific aspects of teaching practice.\\n\\nChallenges and Considerations\\n\\nWhile reflective teaching practice offers significant benefits, it also presents challenges. Time constraints, resistance to change, and fear of criticism can hinder the reflective process. Additionally, creating a supportive environment that encourages honest reflection and constructive feedback is crucial for success.\\n\\nConclusion\\n\\nReflective teaching practice is a powerful tool for professional growth in education. By systematically examining their teaching methods, seeking feedback, and implementing improvements, educators can enhance their effectiveness and provide better learning experiences for their students. As the education landscape continues to evolve, reflective practice equips teachers with the skills and mindset needed to adapt and thrive in their roles. By embracing reflective teaching practice, educators not only improve their own performance but also contribute to the overall advancement of the teaching profession.",
  "vocabulary": {
    "[BLANK_1]": "[BLANK_2]: Teachers engage in honest self-assessment of their teaching performance, considering both strengths and areas for improvement.",
    "[BLANK_2]": "[BLANK_3]: Colleagues observe and provide [BLANK_4] on [BLANK_5], offering fresh perspectives and insights.",
    "[BLANK_3]": "Student feedback: Gathering input from students helps teachers understand the impact of their teaching from the learners' point of view.",
    "[BLANK_4]": "Video analysis: Recording and reviewing lessons allows teachers to observe their teaching objectively and identify areas for refinement.",
    "[BLANK_5]": "Action planning: Based on reflections and feedback, teachers develop specific strategies to enhance their teaching practice.",
    "[BLANK_6]": "Improved teaching quality: By continuously evaluating and refining their methods, teachers can enhance the effectiveness of their instruction.",
    "[BLANK_7]": "Increased [BLANK_6]: Reflective practice helps teachers identify and implement strategies that better engage and motivate students.",
    "[BLANK_8]": "Professional growth: Regular reflection fosters ongoing learning and development for teachers throughout their careers.",
    "[BLANK_9]": "Enhanced problem-solving skills: The reflective process hones teachers' ability to identify and address challenges in the classroom.",
    "[BLANK_10]": "Greater job satisfaction: As teachers see improvements in their practice and student outcomes, they often experience increased job satisfaction and motivation.",
    "[BLANK_11]": "Keep a teaching journal: Regularly document thoughts, observations, and ideas about teaching experiences.",
    "[BLANK_12]": "Seek peer observations: Invite colleagues to observe lessons and provide constructive feedback.",
    "[BLANK_13]": "Use video recordings: Record lessons for self-analysis and peer review.",
    "[BLANK_14]": "Participate in professional learning communities: Engage in collaborative reflection with other educators.",
    "[BLANK_15]": "Collect student feedback: Regularly gather input from students about their learning experiences.",
    "[BLANK_16]": "Set specific goals: Identify areas for improvement and create actionable plans to address them.",
    "[BLANK_17]": "Engage in action research: Conduct small-scale research projects to investigate and improve specific aspects of teaching practice.",
    "[BLANK_18]": "Reflective",
    "[BLANK_19]": "Self-reflection",
    "[BLANK_20]": "Peer feedback",
    "[BLANK_21]": "constructive feedback",
    "[BLANK_22]": "lesson delivery",
    "[BLANK_23]": "student engagement",
    "[BLANK_24]": "classroom management",
    "[BLANK_25]": "lesson objectives",
    "[BLANK_26]": "self-reflection",
    "[BLANK_27]": "peer feedback"
  }
}