{
  "reading": "Title: File Handling and Exception Handling in Python: Essential Tools for Robust Programming\\n\\nIntroduction:\\nIn the realm of programming, particularly with Python, two crucial concepts stand out for their importance in creating reliable and efficient software: [BLANK_1] and [BLANK_2]. These techniques are fundamental to developing programs that can interact with external data sources and gracefully manage unexpected errors. This paper will explore the significance of file handling and exception handling in Python, their implementation, and their practical applications.\\n\\nFile Handling:\\n[BLANK_1] is the process of working with files for reading or writing data. In Python, this capability allows programs to interact with the file system, enabling the storage and retrieval of information from external sources. This functionality is essential for various applications, from simple data storage to complex data analysis tasks.\\n\\nPython provides a straightforward approach to file operations. Files can be opened in different [BLANK_3], such as read ('r'), write ('w'), or append ('a'), depending on the intended operation. The '[BLANK_4]' statement is commonly used in Python for file handling, as it ensures proper resource management by automatically closing the file after operations are complete.\\n\\nFor example, to read from a file:\\n\\n```python\\nwith open('data.txt', 'r') as file:\\n    content = file.read()\\n    print(content)\\n```\\n\\nSimilarly, writing to a file can be accomplished as follows:\\n\\n```python\\nwith open('output.txt', 'w') as file:\\n    file.write(\\\"Hello, World!\\\")\\n```\\n\\nFile handling extends beyond simple text files. Python's csv module, for instance, provides functionality for working with [BLANK_5] (Comma-Separated Values) files, a common format for storing tabular data. This capability is particularly useful for data analysis tasks, allowing programs to process large datasets efficiently.\\n\\nException Handling:\\n[BLANK_2] is the process of responding to and managing errors in a program. In Python, exceptions are raised when runtime errors occur, and if not handled properly, they can cause a program to terminate abruptly. Exception handling allows developers to anticipate potential errors and provide appropriate responses, enhancing the robustness and reliability of their software.\\n\\nThe primary mechanism for exception handling in Python is the [BLANK_6] block. Code that might raise an exception is placed in the try block, and the except block specifies how to handle the exception if it occurs. For example:\\n\\n```python\\ntry:\\n    result = 10 / 0\\nexcept ZeroDivisionError:\\n    print(\\\"Error: Division by zero!\\\")\\n```\\n\\nIn this case, the program catches the ZeroDivisionError and prints an error message instead of crashing. Python provides a variety of built-in exception types, such as [BLANK_7], [BLANK_8], and TypeError, allowing for specific error handling based on the nature of the potential exception.\\n\\nException handling can be further refined with the use of multiple except blocks, the else clause (executed if no exception occurs), and the finally clause (executed regardless of whether an exception occurred).\\n\\nPractical Applications:\\nThe combination of file handling and exception handling is particularly powerful in real-world applications. For instance, when working with external data sources, programs can use file handling to read input data and exception handling to manage potential errors such as missing files or corrupt data.\\n\\nConsider a program that reads agricultural production data from a CSV file:\\n\\n```python\\nimport csv\\n\\ntry:\\n    with open('agricultural_data.csv', 'r') as file:\\n        csv_reader = csv.reader(file)\\n        for row in csv_reader:\\n            # Process each row of data\\n            print(row)\\nexcept FileNotFoundError:\\n    print(\\\"Error: The specified file was not found.\\\")\\nexcept csv.Error as e:\\n    print(f\\\"Error reading CSV file: {e}\\\")\\n```\\n\\nThis code demonstrates how file handling and exception handling work together to create a more robust program. It attempts to open and read a CSV file, handling potential errors such as a missing file or issues with the CSV format.\\n\\nConclusion:\\n[BLANK_1] and [BLANK_2] are essential components of effective Python programming. File handling provides the means to interact with external data sources, expanding the capabilities and applications of Python programs. Exception handling, on the other hand, enhances program reliability by providing mechanisms to gracefully manage unexpected errors. Together, these techniques enable developers to create more robust, efficient, and user-friendly software. As Python continues to grow in popularity for various applications, from data analysis to web development, mastery of file handling and exception handling remains crucial for programmers aiming to develop high-quality, resilient software solutions.",
  "vocabulary": {
    "[BLANK_1]": "file handling",
    "[BLANK_2]": "exception handling",
    "[BLANK_3]": "file modes",
    "[BLANK_4]": "with",
    "[BLANK_5]": "CSV",
    "[BLANK_6]": "try-except",
    "[BLANK_7]": "ValueError",
    "[BLANK_8]": "FileNotFoundError",
    "[BLANK_9]": "Exception handling",
    "[BLANK_10]": "File handling"
  }
}