{
  "reading": "Functions and Modules in Python: Building Blocks of Efficient Programming\\n\\nIntroduction\\n\\nIn the world of programming, efficiency and organization are paramount. As programs grow in complexity, developers need tools to manage code effectively, promote reusability, and maintain clarity. Two fundamental concepts in Python that address these needs are [BLANK_1] and [BLANK_2]. These powerful features allow programmers to structure their code logically, reduce redundancy, and create scalable applications. This paper explores the nature and importance of functions and modules in Python, demonstrating how they serve as essential building blocks for efficient and organized programming.\\n\\nFunctions: Reusable Code Packages\\n\\nFunctions are self-contained blocks of code designed to perform specific tasks. They act as mini-programs within a larger program, encapsulating a set of instructions that can be executed repeatedly with different inputs. The primary purpose of functions is to break down complex problems into smaller, manageable pieces, promoting code reusability and readability.\\n\\nIn Python, a function is defined using the '[BLANK_3]' keyword, followed by the function name and a set of parentheses that may contain [BLANK_4]. For example:\\n\\n```python\\ndef greet(name):\\n    return f\\\"Hello, {name}!\\\"\\n```\\n\\nThis simple function, when called with an [BLANK_5], returns a greeting message. Functions can accept multiple parameters and perform complex operations before returning a result. The '[BLANK_6]' statement specifies the output of the function, which can be used in other parts of the program.\\n\\nOne of the key advantages of functions is their ability to abstract complex operations. For instance, a function to calculate the area of a circle might look like this:\\n\\n```python\\nimport math\\n\\ndef circle_area(radius):\\n    return math.pi * radius ** 2\\n```\\n\\nBy encapsulating this calculation in a function, programmers can compute circle areas throughout their code without repeatedly writing the formula, reducing the chance of errors and improving code maintainability.\\n\\nModules: Organizing Related Functions\\n\\nWhile functions help in organizing code at a micro level, modules provide organization at a macro level. A module in Python is essentially a file containing Python definitions and statements. It allows programmers to group related functions, classes, and variables together, creating a logical structure for larger programs.\\n\\nModules can be [BLANK_7] into other Python scripts, allowing access to their contents. This feature promotes code reusability across different programs and helps in managing large codebases. Python comes with a rich standard library of modules, covering a wide range of functionalities from mathematical operations to web development.\\n\\nTo use a module, it must be imported into the Python script. For example:\\n\\n```python\\nimport math\\n\\nradius = 5\\narea = math.pi * radius ** 2\\n```\\n\\nHere, the 'math' module is imported, giving access to mathematical constants and functions. Modules can also be created by developers to organize their own code. For instance, a module for geographic calculations might include functions for distance calculation, coordinate conversion, and more.\\n\\nThe Power of Combining Functions and Modules\\n\\nThe true power of functions and modules becomes evident when they are used together. Modules can contain multiple related functions, creating a toolkit for specific types of operations. For example, a custom module for financial calculations might look like this:\\n\\n```python\\n# finance_module.py\\n\\ndef calculate_interest(principal, rate, time):\\n    return principal * rate * time\\n\\ndef compound_interest(principal, rate, time, compounds_per_year):\\n    return principal * (1 + rate/compounds_per_year) ** (compounds_per_year * time)\\n\\ndef loan_payment(principal, rate, time):\\n    monthly_rate = rate / 12\\n    months = time * 12\\n    return (principal * monthly_rate * (1 + monthly_rate) ** months) / ((1 + monthly_rate) ** months - 1)\\n```\\n\\nThis module can then be imported and used in various financial applications, promoting code reuse and maintaining a clean, organized structure.\\n\\nConclusion\\n\\nFunctions and modules are fundamental concepts in Python that significantly enhance code organization, reusability, and maintainability. Functions allow programmers to encapsulate specific tasks into reusable units, while modules provide a way to organize related functions and variables into larger, coherent structures. Together, they form the building blocks of efficient, scalable, and well-structured Python programs. As programmers develop more complex applications, mastering the use of functions and modules becomes crucial for writing clean, efficient, and maintainable code. By leveraging these powerful features, developers can create robust, flexible, and organized Python applications capable of solving a wide range of real-world problems.",
  "vocabulary": {
    "[BLANK_1]": "functions",
    "[BLANK_2]": "modules",
    "[BLANK_3]": "def",
    "[BLANK_4]": "parameters",
    "[BLANK_5]": "argument",
    "[BLANK_6]": "return",
    "[BLANK_7]": "imported",
    "[BLANK_8]": "built-in function",
    "[BLANK_9]": "user-defined function",
    "[BLANK_10]": "module"
  }
}