{
  "reading": "Data Structures in Python: A Comprehensive Overview\\n\\nIntroduction\\n\\nPython, a versatile and powerful programming language, offers a rich set of data structures that enable efficient organization and manipulation of data. These structures are fundamental to writing effective and optimized code. This paper explores three primary data structures in Python: lists, tuples, and dictionaries. We will delve into their characteristics, use cases, and the advantages they offer in various programming scenarios.\\n\\nLists: Dynamic and [BLANK_1] Collections\\n\\nLists are one of the most commonly used data structures in Python. They are ordered, [BLANK_1] collections that can contain elements of different data types. Lists are defined using square brackets and can be modified after creation, making them highly flexible for a wide range of applications.\\n\\nFor example, a list of Timorese cities might be represented as:\\n\\n```python\\ntimorese_cities = [\\\"Dili\\\", \\\"Baucau\\\", \\\"Maliana\\\", \\\"Suai\\\"]\\n```\\n\\nLists support various operations and methods. Elements can be added using the [BLANK_2]() method or inserted at specific positions using insert(). The extend() method allows concatenation of lists. Removal of elements is possible through methods like remove() or pop(). Lists also support [BLANK_3] and slicing, enabling easy access and manipulation of elements.\\n\\nOne powerful feature of lists is list comprehension, which provides a concise way to create new lists based on existing ones. For instance:\\n\\n```python\\nsquares = [x**2 for x in range(10)]\\n```\\n\\nThis creates a list of squares of numbers from 0 to 9 in a single line of code.\\n\\nTuples: [BLANK_4] Sequences\\n\\nTuples are similar to lists but with one crucial difference: they are [BLANK_4]. Once created, tuples cannot be modified. They are defined using parentheses:\\n\\n```python\\ncoordinates = (125.5741, -8.5568)  # Coordinates of Dili\\n```\\n\\nThe [BLANK_4] of tuples makes them ideal for representing fixed collections of items, such as coordinates or RGB color values. Tuples are often used when you want to ensure that data remains constant throughout the program's execution.\\n\\nTuples support indexing and can be unpacked, allowing multiple variable assignments in a single line:\\n\\n```python\\nlongitude, latitude = coordinates\\n```\\n\\nWhile less flexible than lists, tuples offer performance benefits in certain scenarios and can be used as dictionary keys, which is not possible with [BLANK_1] lists.\\n\\nDictionaries: [BLANK_5] Pairs\\n\\nDictionaries are unordered collections of [BLANK_5] pairs. They provide an efficient way to store and retrieve data based on unique keys. Dictionaries are defined using curly braces:\\n\\n```python\\ntetum_english = {\\n    \\\"bondia\\\": \\\"good morning\\\",\\n    \\\"obrigadu\\\": \\\"thank you\\\",\\n    \\\"hau\\\": \\\"I\\\"\\n}\\n```\\n\\nDictionaries offer fast lookups and are ideal for scenarios where you need to associate values with unique identifiers. They support various methods for adding, removing, and accessing elements. For example:\\n\\n```python\\ntetum_english[\\\"diak\\\"] = \\\"good\\\"  # Adding a new key-value pair\\nprint(tetum_english.get(\\\"bondia\\\"))  # Retrieving a value\\n```\\n\\nDictionaries are widely used in Python for tasks such as caching, counting occurrences, and representing complex data structures.\\n\\nConclusion\\n\\nPython's data structures - lists, tuples, and dictionaries - provide powerful tools for organizing and manipulating data efficiently. Lists offer flexibility and [BLANK_1], tuples ensure data integrity through [BLANK_4], and dictionaries enable fast lookups with [BLANK_5] associations. Understanding these structures and their appropriate use cases is crucial for writing efficient and effective Python code. As programmers continue to tackle complex problems, these data structures serve as fundamental building blocks, enabling the development of robust and optimized solutions across various domains.",
  "vocabulary": {
    "[BLANK_1]": "5741, -8.5568)  # Coordinates of Dili",
    "[BLANK_2]": "mutable",
    "[BLANK_3]": "append",
    "[BLANK_4]": "indexing",
    "[BLANK_5]": "immutable",
    "[BLANK_6]": "key-value",
    "[BLANK_7]": "list",
    "[BLANK_8]": "tuple",
    "[BLANK_9]": "dictionary",
    "[BLANK_10]": "sort",
    "[BLANK_11]": "comprehension"
  }
}