{
  "reading": "Community Engagement and Outreach for Permagardens: Cultivating Sustainable Change\\n\\nIntroduction\\n\\nPermagardens, a fusion of permaculture principles and bio-intensive gardening techniques, offer a sustainable solution to food security challenges in regions like Timor-Leste. However, the success of these innovative gardening systems hinges not only on their design and implementation but also on effective [BLANK_1] and outreach. This article explores the crucial role of community involvement in permagarden projects, highlighting key strategies for fostering local participation, adapting techniques to cultural contexts, and promoting long-term adoption of sustainable gardening practices.\\n\\nThe Importance of Community Engagement\\n\\nAt the heart of successful permagarden initiatives lies meaningful community engagement. By involving local [BLANK_2] from the outset, projects can ensure that garden designs and practices align with community needs, preferences, and cultural norms. This collaborative approach builds trust, fosters a sense of ownership, and increases the likelihood of long-term [BLANK_3].\\n\\nEffective community engagement begins with identifying and involving key stakeholders, including local leaders, farmers, and community organizations. Through [BLANK_4] methods such as [BLANK_5] and community mapping exercises, project facilitators can gain valuable insights into local agricultural practices, challenges, and aspirations. This information forms the foundation for tailoring permagarden designs to the specific context of each community.\\n\\n[BLANK_6] Approaches\\n\\nParticipatory learning techniques play a vital role in community engagement for permagarden projects. These approaches move beyond traditional top-down education models, instead empowering community members to actively contribute their knowledge and experiences. Methods such as farmer field schools, demonstration plots, and peer-to-peer learning networks have proven effective in promoting the adoption of new agricultural practices.\\n\\nFor example, in Timor-Leste, participatory learning approaches have been used to introduce water conservation techniques like swales and berms. By involving farmers in the design and construction of these features, projects not only transfer technical skills but also demonstrate the immediate benefits of water management in a tangible way.\\n\\nOrganizing Community Garden Projects\\n\\nCommunity gardens serve as powerful catalysts for broader adoption of permagarden principles. These shared spaces provide opportunities for hands-on learning, resource sharing, and community building. Successful community garden projects typically follow a structured planning process that includes:\\n\\n1. Assessing community interest and needs\\n2. Identifying suitable land and securing necessary permissions\\n3. Forming a core group of committed volunteers\\n4. Establishing clear roles, responsibilities, and decision-making processes\\n5. Developing a garden design that incorporates permagarden principles\\n6. Implementing the garden in phases, celebrating milestones along the way\\n\\nThroughout this process, addressing common challenges such as water access, tool sharing, and conflict resolution is crucial for long-term success.\\n\\nAdapting Permagarden Techniques to Local Contexts\\n\\n[BLANK_7] is paramount when introducing new agricultural practices. Successful permagarden projects strike a balance between innovative techniques and traditional practices, respecting local customs and preferences. This might involve incorporating traditional crops into polyculture designs, adapting planting calendars to align with cultural events, or integrating local pest management techniques with permaculture principles.\\n\\nIn Timor-Leste, for instance, some projects have successfully integrated the traditional practice of \\\"tara bandu\\\" – a customary law that regulates natural resource use – into permagarden management strategies. This approach not only ensures cultural relevance but also leverages existing social structures to support sustainable gardening practices.\\n\\n[BLANK_8] and Knowledge Sharing\\n\\nEffective outreach is essential for scaling up the impact of permagarden initiatives. This involves developing clear, culturally appropriate messages about the benefits of permagardens and disseminating this information through various channels. Successful outreach strategies often include:\\n\\n1. Organizing community workshops and field days\\n2. Producing visual aids such as posters and instructional videos in local languages\\n3. Collaborating with schools to establish educational gardens\\n4. Leveraging local media, including radio programs and community newsletters\\n5. Facilitating farmer-to-farmer exchange visits\\n\\nBy employing a diverse range of outreach methods, projects can reach different segments of the community and address varying learning preferences.\\n\\nConclusion\\n\\nCommunity engagement and outreach are integral to the success and [BLANK_9] of permagarden initiatives. By prioritizing local participation, adapting techniques to cultural contexts, and implementing effective knowledge-sharing strategies, these projects can cultivate not just sustainable gardens, but also lasting change in agricultural practices and food security. As communities around the world face increasing challenges related to climate change and food production, the principles of community engagement in permagarden projects offer valuable lessons for fostering resilience and [BLANK_10].",
  "vocabulary": {
    "[BLANK_1]": "Assessing community interest and needs",
    "[BLANK_2]": "Identifying suitable land and securing necessary permissions",
    "[BLANK_3]": "Forming a core group of committed volunteers",
    "[BLANK_4]": "Establishing clear roles, responsibilities, and decision-making processes",
    "[BLANK_5]": "Developing a garden design that incorporates permagarden principles",
    "[BLANK_6]": "Implementing the garden in phases, celebrating milestones along the way",
    "[BLANK_7]": "Organizing community workshops and field days",
    "[BLANK_8]": "Producing visual aids such as posters and instructional videos in local languages",
    "[BLANK_9]": "Collaborating with schools to establish educational gardens",
    "[BLANK_10]": "Leveraging local media, including radio programs and community newsletters",
    "[BLANK_11]": "Facilitating farmer-to-farmer exchange visits",
    "[BLANK_12]": "community engagement",
    "[BLANK_13]": "stakeholders",
    "[BLANK_14]": "sustainability",
    "[BLANK_15]": "participatory",
    "[BLANK_16]": "focus groups",
    "[BLANK_17]": "Participatory learning",
    "[BLANK_18]": "Cultural sensitivity",
    "[BLANK_19]": "Outreach",
    "[BLANK_20]": "sustainability",
    "[BLANK_21]": "self-sufficiency"
  }
}