{
  "reading": "Site Assessment and Design: The Foundation of Successful Permagardens\\n\\nIntroduction\\n\\n[BLANK_1] and design are crucial steps in creating successful permagardens, particularly in regions like Timor-Leste where environmental challenges and resource constraints are prevalent. This process involves carefully evaluating the characteristics of a given location and using that information to create a garden design that maximizes productivity, sustainability, and resilience. By understanding the principles of site assessment and design, gardeners can make informed decisions that lead to thriving, efficient, and ecologically sound permagardens.\\n\\nThe Importance of Site Assessment\\n\\nA thorough site assessment is the cornerstone of any successful permagarden project. This process involves systematically evaluating and documenting various aspects of the proposed garden location. Key elements of site assessment include:\\n\\n1. Topography and [BLANK_2]: Understanding the lay of the land is crucial for managing water flow and erosion. Gentle slopes can be advantageous for natural drainage, while steeper areas may require terracing or other erosion control measures.\\n\\n2. Sun Exposure and Shade Patterns: Mapping the movement of sunlight throughout the day and across seasons helps determine optimal placement for sun-loving and shade-tolerant plants.\\n\\n3. Water Sources and [BLANK_3]: Identifying existing water sources, such as wells or streams, and understanding natural drainage patterns is essential for efficient water management.\\n\\n4. Soil Composition and Quality: Analyzing soil type, pH, and nutrient content provides valuable information for soil improvement strategies and crop selection.\\n\\n5. Existing Vegetation and Structures: Documenting current plants and built elements helps in planning integration or removal decisions.\\n\\n6. Local Climate and [BLANK_4]: Understanding broader climate patterns and site-specific microclimates informs plant selection and placement strategies.\\n\\nDesign Principles for Permagardens\\n\\nOnce a comprehensive site assessment is complete, the design phase begins. Effective permagarden design incorporates several key principles:\\n\\n1. [BLANK_5]: This concept involves organizing the garden into areas based on frequency of use and maintenance needs. For example, frequently harvested herbs might be placed near the kitchen, while fruit trees that require less frequent attention can be situated farther away.\\n\\n2. [BLANK_6]: This process identifies and maps external influences on the site, such as prevailing winds, water flow, and fire risks. Understanding these factors helps in planning protective measures and optimizing resource use.\\n\\n3. Water Management: Incorporating features like swales, berms, and rainwater harvesting systems helps maximize water efficiency, particularly crucial in water-scarce regions like Timor-Leste.\\n\\n4. Soil Improvement: Based on soil assessment results, the design should include strategies for enhancing soil fertility, such as composting areas and planned crop rotations.\\n\\n5. Biodiversity: A well-designed permagarden incorporates a diverse range of plant species, promoting ecological balance and resilience against pests and diseases.\\n\\n6. Access and Ergonomics: Thoughtful placement of paths and work areas ensures efficient movement and reduces unnecessary labor.\\n\\nAdapting to Local Conditions\\n\\nIn Timor-Leste, as in any specific region, site assessment and design must take into account unique local conditions. For instance:\\n\\n- Steep terrain in many areas necessitates careful consideration of erosion control measures.\\n- The tropical climate with distinct wet and dry seasons requires robust water management strategies.\\n- Limited access to external inputs means designs should focus on utilizing locally available materials and resources.\\n\\nConclusion\\n\\nSite assessment and design are fundamental processes in creating successful [BLANK_7]. By carefully evaluating site conditions and applying permaculture design principles, gardeners can create productive, sustainable, and resilient growing spaces. This approach is particularly valuable in challenging environments like Timor-Leste, where thoughtful design can significantly enhance food security and environmental sustainability. As the practice of permagardening continues to spread, the skills of site assessment and design will become increasingly valuable tools for communities seeking to improve their local food systems and ecological resilience.",
  "vocabulary": {
    "[BLANK_1]": "Topography and [BLANK_2]: Understanding the lay of the land is crucial for managing water flow and erosion. Gentle slopes can be advantageous for natural drainage, while steeper areas may require terracing or other erosion control measures.",
    "[BLANK_2]": "Sun Exposure and Shade Patterns: Mapping the movement of sunlight throughout the day and across seasons helps determine optimal placement for sun-loving and shade-tolerant plants.",
    "[BLANK_3]": "Water Sources and [BLANK_3]: Identifying existing water sources, such as wells or streams, and understanding natural drainage patterns is essential for efficient water management.",
    "[BLANK_4]": "Soil Composition and Quality: Analyzing soil type, pH, and nutrient content provides valuable information for soil improvement strategies and crop selection.",
    "[BLANK_5]": "Existing Vegetation and Structures: Documenting current plants and built elements helps in planning integration or removal decisions.",
    "[BLANK_6]": "Local Climate and [BLANK_4]: Understanding broader climate patterns and site-specific microclimates informs plant selection and placement strategies.",
    "[BLANK_7]": "[BLANK_5]: This concept involves organizing the garden into areas based on frequency of use and maintenance needs. For example, frequently harvested herbs might be placed near the kitchen, while fruit trees that require less frequent attention can be situated farther away.",
    "[BLANK_8]": "[BLANK_6]: This process identifies and maps external influences on the site, such as prevailing winds, water flow, and fire risks. Understanding these factors helps in planning protective measures and optimizing resource use.",
    "[BLANK_9]": "Water Management: Incorporating features like swales, berms, and rainwater harvesting systems helps maximize water efficiency, particularly crucial in water-scarce regions like Timor-Leste.",
    "[BLANK_10]": "Soil Improvement: Based on soil assessment results, the design should include strategies for enhancing soil fertility, such as composting areas and planned crop rotations.",
    "[BLANK_11]": "Biodiversity: A well-designed permagarden incorporates a diverse range of plant species, promoting ecological balance and resilience against pests and diseases.",
    "[BLANK_12]": "Access and Ergonomics: Thoughtful placement of paths and work areas ensures efficient movement and reduces unnecessary labor.",
    "[BLANK_13]": "Site assessment",
    "[BLANK_14]": "Slope",
    "[BLANK_15]": "Drainage",
    "[BLANK_16]": "Microclimates",
    "[BLANK_17]": "Zoning",
    "[BLANK_18]": "Sector analysis",
    "[BLANK_19]": "Permagardens",
    "[BLANK_20]": "Contour lines",
    "[BLANK_21]": "Soil profile",
    "[BLANK_22]": "Sun exposure"
  }
}