{
  "reading": "Pest and Disease Management in Beekeeping: Safeguarding Hive Health\\n\\nIntroduction\\n\\nBeekeeping is a vital agricultural practice that supports both ecosystem health and food production. However, like any form of animal husbandry, it comes with challenges, particularly in the realm of pest and disease management. This paper explores the critical aspects of maintaining healthy bee colonies through effective pest and disease control strategies, with a focus on sustainable and natural methods.\\n\\nCommon Pests and Diseases\\n\\nBeekeepers worldwide face a variety of threats to their colonies, but some pests and diseases are particularly prevalent and damaging. The [BLANK_1] (Varroa destructor) is perhaps the most notorious, feeding on both adult bees and developing brood. These tiny parasites not only weaken individual bees but also serve as vectors for various viruses, potentially leading to colony collapse if left unchecked.\\n\\n[BLANK_2] (Aethina tumida) pose another significant threat. These pests lay eggs in beehives, and their larvae feed on honey, pollen, and brood, often causing fermentation of honey and destruction of combs. [BLANK_3], particularly the greater wax moth (Galleria mellonella), can also wreak havoc in weak colonies, with their larvae tunneling through and destroying combs.\\n\\nDiseases such as American foulbrood, European foulbrood, and Nosema are bacterial and fungal infections that can devastate bee populations if not properly managed.\\n\\nImpact on Bee Colonies\\n\\nThe effects of these pests and diseases can be severe. [BLANK_4] can lead to reduced honey production, weakened colonies unable to survive harsh weather conditions, and in extreme cases, total colony loss. Moreover, the stress caused by these invaders can make bees more susceptible to other environmental pressures, creating a compounding effect on colony health.\\n\\nPrevention and Management Strategies\\n\\n[BLANK_5] is a holistic approach that combines various strategies to control pests and diseases while minimizing the use of chemical treatments. Key components of IPM in beekeeping include:\\n\\n1. Hive [BLANK_6]: Regular cleaning and proper hive maintenance can significantly reduce the risk of infestations and disease spread.\\n\\n2. Strong Colony Management: Ensuring colonies remain strong and well-nourished helps them naturally resist pests and diseases.\\n\\n3. [BLANK_7]: Some bee populations have developed natural resistance to certain pests. Breeding or acquiring such strains can be an effective long-term strategy.\\n\\n4. Regular [BLANK_8]: Frequent hive inspections allow beekeepers to catch problems early when they are easier to manage.\\n\\n5. [BLANK_9]: Practices such as proper hive placement, using screened bottom boards, and maintaining appropriate hive ventilation can create less favorable conditions for pests.\\n\\nNatural and Herbal Treatments\\n\\nMany beekeepers are turning to natural and [BLANK_10] as alternatives to synthetic chemicals. For instance, powdered sugar dusting can be used to control Varroa mites by increasing bee grooming behavior. Essential oils like thymol have shown promise in managing various pests and diseases.\\n\\nIn some regions, traditional remedies using local plants have proven effective. For example, tobacco infusions can be used as a natural pesticide, while neem oil has both antifungal and insecticidal properties.",
  "vocabulary": {
    "[BLANK_1]": "Hive [BLANK_6]: Regular cleaning and proper hive maintenance can significantly reduce the risk of infestations and disease spread.",
    "[BLANK_2]": "Strong Colony Management: Ensuring colonies remain strong and well-nourished helps them naturally resist pests and diseases.",
    "[BLANK_3]": "[BLANK_7]: Some bee populations have developed natural resistance to certain pests. Breeding or acquiring such strains can be an effective long-term strategy.",
    "[BLANK_4]": "Regular [BLANK_8]: Frequent hive inspections allow beekeepers to catch problems early when they are easier to manage.",
    "[BLANK_5]": "[BLANK_9]: Practices such as proper hive placement, using screened bottom boards, and maintaining appropriate hive ventilation can create less favorable conditions for pests.",
    "[BLANK_6]": "Varroa mite",
    "[BLANK_7]": "Small hive beetle",
    "[BLANK_8]": "Wax moth",
    "[BLANK_9]": "Infestation",
    "[BLANK_10]": "Integrated Pest Management (IPM)",
    "[BLANK_11]": "Hygiene",
    "[BLANK_12]": "Resistant strain",
    "[BLANK_13]": "Monitoring",
    "[BLANK_14]": "Cultural control",
    "[BLANK_15]": "Herbal treatment"
  }
}