{
  "reading": "Hive Design and Construction: Balancing Tradition and Innovation in Beekeeping\\n\\nIntroduction\\n\\nBeekeeping has been an integral part of human agriculture and culture for thousands of years, with hive designs evolving to meet the needs of both bees and beekeepers in diverse environments. This article explores the art and science of hive design and construction, with a particular focus on the intersection of traditional practices and modern innovations in tropical climates like Timor-Leste.\\n\\nTraditional Hive Designs\\n\\nThroughout history, beekeepers have utilized a variety of materials and designs to house honey bee colonies. In many tropical regions, including Timor-Leste, traditional hives often take the form of hollow logs, clay pots, or woven baskets. These designs leverage locally available materials and have been refined over generations to suit the local climate and bee species.\\n\\nLog hives, for instance, mimic the natural habitat of bees, providing excellent insulation and protection from the elements. Clay pot hives offer similar benefits while being easier to manipulate for honey harvesting. However, these traditional designs often present challenges in terms of hive management and honey extraction, as they typically do not allow for easy inspection of the colony or removal of individual [BLANK_1].\\n\\nModern Hive Innovations\\n\\nIn response to the limitations of traditional hives, modern beekeeping has seen the development of more versatile designs. Two of the most significant innovations are the [BLANK_2] hive and the [BLANK_3] hive.\\n\\nThe Langstroth hive, invented in the mid-19th century, revolutionized beekeeping with its use of removable frames within a standardized box structure. This design allows for easy inspection, management, and honey harvesting. However, the Langstroth hive is often less suitable for small-scale beekeepers in tropical climates due to its complexity and the materials required for construction.\\n\\nThe top-bar hive represents a middle ground between traditional and modern designs. It consists of a horizontal box with removable bars from which bees build their combs. This design offers many of the management benefits of the Langstroth hive while being simpler to construct and maintain using local materials.\\n\\nAdapting Hives for Tropical Climates\\n\\nIn tropical regions like Timor-Leste, hive design must account for high temperatures, humidity, and seasonal variations. Key considerations include:\\n\\n1. [BLANK_4]: Adequate airflow is crucial to prevent overheating and moisture buildup. This can be achieved through strategically placed openings and the use of breathable materials.\\n\\n2. Sun protection: Hives should be shaded to prevent overheating. This can be accomplished through site selection, hive orientation, or the addition of a protective roof.\\n\\n3. Pest resistance: Designs should incorporate features to deter pests common in tropical environments, such as ants and small hive beetles.\\n\\n4. Water resistance: In areas with heavy rainfall, hives must be constructed to prevent water ingress while still allowing for proper ventilation.\\n\\nUsing [BLANK_5] Local Materials\\n\\nOne of the key advantages of adapted top-bar hives is the ability to construct them using locally available, sustainable materials. In Timor-Leste and similar regions, this often includes:\\n\\n1. [BLANK_6]: An excellent material for hive bodies due to its strength, availability, and natural resistance to pests and decay.\\n\\n2. Palm leaves: Used for roofing to provide additional protection from sun and rain.\\n\\n3. Natural fibers: Local plant fibers can be used for binding and sealing hive components.\\n\\n4. Clay: In some designs, clay can be used as a natural insulator and moisture regulator.\\n\\nBy utilizing these materials, beekeepers can create hives that are not only effective but also economically and environmentally sustainable.\\n\\nConclusion\\n\\nHive design and construction represent a fascinating blend of traditional wisdom and modern innovation. As beekeeping continues to evolve, particularly in tropical regions, the focus remains on creating habitats that support healthy bee colonies while meeting the needs of beekeepers. By adapting designs to local climates and utilizing sustainable materials, beekeepers can develop hives that are both effective and appropriate for their specific contexts. This approach not only benefits the bees and beekeepers but also contributes to broader goals of sustainable agriculture and [BLANK_7] conservation.",
  "vocabulary": {
    "[BLANK_1]": "[BLANK_4]: Adequate airflow is crucial to prevent overheating and moisture buildup. This can be achieved through strategically placed openings and the use of breathable materials.",
    "[BLANK_2]": "Sun protection: Hives should be shaded to prevent overheating. This can be accomplished through site selection, hive orientation, or the addition of a protective roof.",
    "[BLANK_3]": "Pest resistance: Designs should incorporate features to deter pests common in tropical environments, such as ants and small hive beetles.",
    "[BLANK_4]": "Water resistance: In areas with heavy rainfall, hives must be constructed to prevent water ingress while still allowing for proper ventilation.",
    "[BLANK_5]": "[BLANK_6]: An excellent material for hive bodies due to its strength, availability, and natural resistance to pests and decay.",
    "[BLANK_6]": "Palm leaves: Used for roofing to provide additional protection from sun and rain.",
    "[BLANK_7]": "Natural fibers: Local plant fibers can be used for binding and sealing hive components.",
    "[BLANK_8]": "Clay: In some designs, clay can be used as a natural insulator and moisture regulator.",
    "[BLANK_9]": "combs",
    "[BLANK_10]": "Langstroth",
    "[BLANK_11]": "top-bar",
    "[BLANK_12]": "Ventilation",
    "[BLANK_13]": "Sustainable",
    "[BLANK_14]": "Bamboo",
    "[BLANK_15]": "biodiversity"
  }
}