{
  "reading": "Creating Bee-Friendly Landscapes: Nurturing Pollinators for a Sustainable Future\\n\\nIntroduction\\n\\nBees play a crucial role in our ecosystems and agricultural systems, serving as essential pollinators for a wide variety of plants. However, bee populations worldwide are facing numerous threats, including habitat loss, pesticide use, and climate change. Creating bee-friendly landscapes is a proactive approach to support and nurture these vital insects. This article explores the importance of bee-friendly landscapes and provides insights into how individuals and communities can contribute to bee conservation through thoughtful landscape design and plant selection.\\n\\nUnderstanding Bee-Friendly Landscapes\\n\\nA bee-friendly landscape is an environment that provides the necessary resources for bees to thrive. These landscapes incorporate a diverse range of plants that offer food sources, water, and safe habitats for bees throughout their life cycle. The key components of a bee-friendly landscape include:\\n\\n1. [BLANK_1] Plants\\n\\n[BLANK_1] plants are those that produce substances, primarily nectar and pollen, which bees collect to make honey and feed their colonies. These plants are the cornerstone of any bee-friendly landscape. When selecting plants, it's essential to focus on [BLANK_2] species that have co-evolved with local bee populations. [BLANK_2] plants are typically better adapted to the local climate and provide the most suitable nutrition for native bee species.\\n\\n2. Year-Round Forage\\n\\nTo support bee populations effectively, landscapes should offer a continuous supply of food throughout the year. This can be achieved by carefully planning and planting a variety of species that bloom at different times. Creating a planting calendar that ensures year-round bee [BLANK_3] is an essential step in developing a truly bee-friendly landscape.\\n\\n3. Water Sources\\n\\nBees require access to clean water for drinking and to regulate hive temperatures. Incorporating safe water sources into the landscape is crucial. These can range from shallow, pebble-filled dishes to more elaborate water features with landing spots for bees.\\n\\n4. Safe Habitats\\n\\nIn addition to food and water, bees need safe places to nest and shelter. Natural and artificial bee habitats can be integrated into the landscape. These may include areas of bare soil for ground-nesting bees, hollow plant stems, and purpose-built \\\"bee hotels\\\" for solitary bees.\\n\\nIntegrating Beekeeping with [BLANK_4]\\n\\nAn innovative approach to creating bee-friendly landscapes on a larger scale is the integration of beekeeping with [BLANK_4] systems. [BLANK_4], a land use management system that combines trees or shrubs with crops or livestock, can provide an ideal environment for bees while also enhancing agricultural productivity.\\n\\nThis integrated approach offers multiple benefits:\\n- Diverse forage for bees throughout the year\\n- Natural windbreaks and shade for crops\\n- Improved soil fertility and water retention\\n- Enhanced [BLANK_5] and ecosystem resilience\\n\\n[BLANK_6] Principles in Bee-Friendly Design\\n\\n[BLANK_6], a system of agricultural and social design principles based on natural ecosystems, offers valuable insights for creating bee-friendly landscapes. Key [BLANK_6] principles that can be applied include:\\n\\n1. Use and value diversity: Incorporate a wide range of plant species to provide varied nutrition and habitats for bees.\\n\\n2. Catch and store energy: Design landscapes to maximize sunlight exposure for plants and create microclimates that benefit both plants and bees.\\n\\n3. Obtain a yield: Select plants that not only support bees but also provide yields for human use, such as fruits, herbs, or cut flowers.\\n\\n4. Apply self-regulation and accept feedback: Observe how bees interact with the landscape and adjust designs accordingly.\\n\\nPractical Steps for Creating Bee-Friendly Landscapes\\n\\n1. Choose a diverse range of [BLANK_2], [BLANK_1] plants that bloom at different times of the year.\\n2. Avoid the use of pesticides and opt for natural pest control methods.\\n3. Provide clean water sources with safe access for bees.\\n4. Create areas of undisturbed habitat for nesting and overwintering.\\n5. Incorporate flowering trees and shrubs to provide abundant [BLANK_3] and shelter.\\n6. Leave some areas of the garden \\\"wild\\\" to encourage natural [BLANK_5].\\n\\nConclusion\\n\\nCreating bee-friendly landscapes is a powerful way to support [BLANK_7] populations and enhance overall ecosystem health. By thoughtfully selecting plants, providing essential resources, and applying principles of [BLANK_6] and [BLANK_4], we can create environments that nurture bees and other beneficial insects. These efforts not only contribute to bee conservation but also result in more productive, resilient, and beautiful landscapes that benefit both humans and wildlife. As we face growing environmental challenges, the creation of [BLANK_8] landscapes represents a tangible and impactful step towards a more sustainable future.",
  "vocabulary": {
    "[BLANK_1]": "[BLANK_1] Plants",
    "[BLANK_2]": "Year-Round Forage",
    "[BLANK_3]": "Water Sources",
    "[BLANK_4]": "Safe Habitats",
    "[BLANK_5]": "Use and value diversity: Incorporate a wide range of plant species to provide varied nutrition and habitats for bees.",
    "[BLANK_6]": "Catch and store energy: Design landscapes to maximize sunlight exposure for plants and create microclimates that benefit both plants and bees.",
    "[BLANK_7]": "Obtain a yield: Select plants that not only support bees but also provide yields for human use, such as fruits, herbs, or cut flowers.",
    "[BLANK_8]": "Apply self-regulation and accept feedback: Observe how bees interact with the landscape and adjust designs accordingly.",
    "[BLANK_9]": "Choose a diverse range of [BLANK_2], [BLANK_1] plants that bloom at different times of the year.",
    "[BLANK_10]": "Avoid the use of pesticides and opt for natural pest control methods.",
    "[BLANK_11]": "Provide clean water sources with safe access for bees.",
    "[BLANK_12]": "Create areas of undisturbed habitat for nesting and overwintering.",
    "[BLANK_13]": "Incorporate flowering trees and shrubs to provide abundant [BLANK_3] and shelter.",
    "[BLANK_14]": "Leave some areas of the garden \\\"wild\\\" to encourage natural [BLANK_5].",
    "[BLANK_15]": "Melliferous",
    "[BLANK_16]": "Native",
    "[BLANK_17]": "forage",
    "[BLANK_18]": "Agroforestry",
    "[BLANK_19]": "biodiversity",
    "[BLANK_20]": "Permaculture",
    "[BLANK_21]": "pollinator",
    "[BLANK_22]": "pollinator-friendly",
    "[BLANK_23]": "nectar flow",
    "[BLANK_24]": "bee-friendly"
  }
}