{
  "reading": "Bamboo Cultivation and Harvesting: A Sustainable Resource\\n\\nIntroduction\\n\\nBamboo, a versatile and rapidly renewable resource, has been gaining attention worldwide for its numerous applications in construction, crafts, and even as a food source. This article explores the cultivation and harvesting of bamboo, focusing on sustainable practices that ensure the longevity of this remarkable plant while maximizing its economic and ecological benefits.\\n\\nBamboo Growth Cycle and Cultivation Methods\\n\\nBamboo's growth cycle is unique among plants, characterized by its rapid development and ability to reach maturity in a relatively short time. The plant begins its life as a [BLANK_1], an underground stem from which new shoots emerge. These shoots, known as [BLANK_2], can grow at an astonishing rate, with some species capable of growing up to 91 cm (36 inches) in a single day under ideal conditions.\\n\\nThere are two main types of bamboo: [BLANK_3] and [BLANK_4]. [BLANK_3] bamboo grows in tight clusters, expanding slowly over time. This type is often preferred for controlled cultivation as it is less likely to spread aggressively. [BLANK_4] bamboo, on the other hand, spreads rapidly through underground rhizomes and can quickly colonize large areas if not properly managed.\\n\\nCultivation of bamboo requires careful consideration of soil conditions, climate, and species selection. Most bamboo species thrive in well-drained, fertile soil with adequate moisture. Proper spacing is crucial, especially for running bamboo, which may require root barriers to prevent unwanted spread.\\n\\nSustainable Harvesting Practices\\n\\n[BLANK_5] is key to maintaining healthy bamboo stands and ensuring a continuous supply of this valuable resource. The concept revolves around selectively harvesting mature culms while leaving younger shoots to continue growing. This practice allows the bamboo grove to regenerate naturally and maintain its productivity over time.\\n\\nIdentifying mature culms ready for harvest is a crucial skill. Generally, bamboo culms reach maturity between 3-5 years, depending on the species. Mature culms can be recognized by their darker color, presence of lichens or mosses, and the absence of sheaths on the lower portions of the stem.\\n\\nProper cutting techniques are essential for sustainable harvesting. Culms should be cut close to the ground, just above the first or second [BLANK_6], using sharp tools such as machetes or specialized bamboo cutting saws. This method encourages new growth and prevents water accumulation in the remaining stub, which could lead to rot and disease.\\n\\nPost-harvest Handling and Storage\\n\\nAfter harvesting, proper handling and storage of bamboo are crucial to maintain its quality and durability. Freshly cut bamboo contains high levels of moisture and sugars, making it susceptible to fungal and insect attacks. [BLANK_7] typically involves several steps:\\n\\n1. Cleaning: Remove branches, leaves, and any dirt from the culms.\\n\\n2. Curing: This process reduces the bamboo's moisture content and starch levels. Methods include air-drying, smoking, or soaking in water.\\n\\n3. Treatment: Application of preservatives to increase the bamboo's resistance to decay and insect infestation. Natural methods like lime washing or more modern techniques using borax and boric acid are commonly employed.\\n\\n4. Storage: Treated bamboo should be stored in a dry, well-ventilated area, protected from direct sunlight and rain.\\n\\nBamboo Cultivation in Timor-Leste\\n\\nIn Timor-Leste, bamboo plays a significant role in traditional architecture and daily life. The country's tropical climate is well-suited for bamboo cultivation, with several native species thriving in its diverse landscapes. Local farmers often integrate bamboo into [BLANK_8] systems, providing both economic opportunities and environmental benefits such as erosion control and carbon sequestration.\\n\\nConclusion\\n\\nBamboo cultivation and harvesting, when done sustainably, offer a wealth of opportunities for communities and the environment. By understanding the bamboo growth cycle, implementing proper cultivation methods, and adhering to sustainable harvesting practices, we can harness the full potential of this remarkable plant. As global demand for sustainable materials continues to grow, bamboo stands poised to play an increasingly important role in our future, offering a renewable resource that combines rapid growth with versatility and strength.",
  "vocabulary": {
    "[BLANK_1]": "Cleaning: Remove branches, leaves, and any dirt from the culms.",
    "[BLANK_2]": "Curing: This process reduces the bamboo's moisture content and starch levels. Methods include air-drying, smoking, or soaking in water.",
    "[BLANK_3]": "Treatment: Application of preservatives to increase the bamboo's resistance to decay and insect infestation. Natural methods like lime washing or more modern techniques using borax and boric acid are commonly employed.",
    "[BLANK_4]": "Storage: Treated bamboo should be stored in a dry, well-ventilated area, protected from direct sunlight and rain.",
    "[BLANK_5]": "rhizome",
    "[BLANK_6]": "culms",
    "[BLANK_7]": "clumping",
    "[BLANK_8]": "running",
    "[BLANK_9]": "Sustainable harvesting",
    "[BLANK_10]": "node",
    "[BLANK_11]": "Post-harvest treatment",
    "[BLANK_12]": "agroforestry",
    "[BLANK_13]": "internode",
    "[BLANK_14]": "shoot"
  }
}