{
  "reading": "The Judiciary in Timor-Leste: Upholding Constitutional Democracy\\n\\nIntroduction\\n\\nThe judiciary plays a crucial role in Timor-Leste's young democracy, serving as a pillar of the nation's constitutional framework. Established after the country gained independence in 2002, Timor-Leste's judicial system is designed to uphold the rule of law, protect citizens' rights, and ensure the proper functioning of government institutions. This article explores the structure, powers, and significance of the judiciary in Timor-Leste, highlighting its vital role in maintaining the country's constitutional order.\\n\\nStructure of the Court System\\n\\nTimor-Leste's court system is hierarchical, comprising several levels of courts with distinct [BLANK_1]. At the base are the [BLANK_2], which handle most criminal and civil cases at the local level. These courts are spread across the country to ensure access to justice for all citizens.\\n\\nAbove the District Courts is the [BLANK_3], an intermediate court that hears appeals from lower court decisions. This court plays a crucial role in reviewing judgments and ensuring consistency in the application of law across the country.\\n\\nAt the apex of the judicial system is the [BLANK_4]. As the highest court in Timor-Leste, it has final authority on legal matters and serves as the constitutional court. The Supreme Court's decisions are binding on all lower courts and government institutions.\\n\\nPowers and Responsibilities of the Supreme Court of Justice\\n\\nThe Supreme Court of Justice holds significant powers that are essential for maintaining the constitutional order in Timor-Leste. Its primary responsibilities include:\\n\\n1. [BLANK_5]: The court has the authority to examine whether laws and government actions comply with the constitution. This power is crucial for preventing unconstitutional legislation and protecting citizens' rights.\\n\\n2. Final Appeals: As the highest court, it hears final appeals on cases from lower courts, ensuring uniform interpretation and application of laws across the country.\\n\\n3. Electoral Disputes: The Supreme Court has jurisdiction over disputes related to elections and referendums, playing a vital role in maintaining the integrity of the democratic process.\\n\\n4. Impeachment Proceedings: It has the power to try cases involving the impeachment of high-ranking officials, including the President of the Republic.\\n\\nConstitutional Review Process\\n\\nOne of the most important functions of the Supreme Court is constitutional review. This process allows the court to examine the constitutionality of laws, decrees, and government actions. The review can be initiated in several ways:\\n\\n1. Abstract Review: The President, Parliament, or other designated authorities can request the court to review the constitutionality of a law before it comes into effect.\\n\\n2. Concrete Review: Lower courts can refer constitutional questions to the Supreme Court when they arise in specific cases.\\n\\n3. Individual Complaints: Citizens can petition the court directly if they believe their constitutional rights have been violated.\\n\\nThrough this process, the Supreme Court ensures that all laws and government actions align with the principles and provisions of the Constitution, safeguarding the rights and freedoms of Timor-Leste's citizens.\\n\\n[BLANK_6]\\n\\nA cornerstone of Timor-Leste's judicial system is the principle of judicial independence. This concept is enshrined in the Constitution and is crucial for ensuring fair and impartial administration of justice. Judicial independence means that judges are free from influence or pressure from other branches of government, political parties, or private interests when making their decisions.\\n\\nTo maintain this independence, Timor-Leste has implemented several measures:\\n\\n1. Secure Tenure: Judges are appointed for life terms, protecting them from political pressures.\\n\\n2. Financial Autonomy: The judiciary has its own budget, reducing potential for financial leverage by other branches of government.\\n\\n3. Judicial Council: An independent body oversees judicial appointments and disciplinary matters, further insulating the judiciary from external influences.\\n\\nChallenges and Future Prospects\\n\\nDespite its well-designed structure, Timor-Leste's judiciary faces several challenges. These include a shortage of qualified judges and lawyers, limited resources, and the need to balance formal legal systems with traditional customary law practices that are deeply rooted in many communities.\\n\\nHowever, ongoing efforts to strengthen the judiciary, including capacity-building programs and international cooperation, are gradually addressing these issues. As the system continues to develop, it is expected to play an increasingly important role in consolidating Timor-Leste's democracy and rule of law.\\n\\nConclusion\\n\\nThe judiciary in Timor-Leste stands as a vital institution in the country's constitutional democracy. Through its structure, powers, and commitment to independence, it serves as a guardian of the constitution, protector of citizens' rights, and arbiter of legal disputes. As Timor-Leste continues to develop as a nation, the role of its judiciary in upholding the rule of law and ensuring justice for all citizens remains paramount. The ongoing strengthening of this institution will be crucial for the country's long-term stability and democratic progress.",
  "vocabulary": {
    "[BLANK_1]": "[BLANK_5]: The court has the authority to examine whether laws and government actions comply with the constitution. This power is crucial for preventing unconstitutional legislation and protecting citizens' rights.",
    "[BLANK_2]": "Final Appeals: As the highest court, it hears final appeals on cases from lower courts, ensuring uniform interpretation and application of laws across the country.",
    "[BLANK_3]": "Electoral Disputes: The Supreme Court has jurisdiction over disputes related to elections and referendums, playing a vital role in maintaining the integrity of the democratic process.",
    "[BLANK_4]": "Impeachment Proceedings: It has the power to try cases involving the impeachment of high-ranking officials, including the President of the Republic.",
    "[BLANK_5]": "Abstract Review: The President, Parliament, or other designated authorities can request the court to review the constitutionality of a law before it comes into effect.",
    "[BLANK_6]": "Concrete Review: Lower courts can refer constitutional questions to the Supreme Court when they arise in specific cases.",
    "[BLANK_7]": "Individual Complaints: Citizens can petition the court directly if they believe their constitutional rights have been violated.",
    "[BLANK_8]": "Secure Tenure: Judges are appointed for life terms, protecting them from political pressures.",
    "[BLANK_9]": "Financial Autonomy: The judiciary has its own budget, reducing potential for financial leverage by other branches of government.",
    "[BLANK_10]": "Judicial Council: An independent body oversees judicial appointments and disciplinary matters, further insulating the judiciary from external influences.",
    "[BLANK_11]": "jurisdictions",
    "[BLANK_12]": "District Courts",
    "[BLANK_13]": "Court of Appeal",
    "[BLANK_14]": "Supreme Court of Justice",
    "[BLANK_15]": "Constitutional review",
    "[BLANK_16]": "Judicial independence"
  }
}