{
  "reading": "The National Parliament of Timor-Leste: A Cornerstone of Democracy\\n\\nIntroduction\\n\\nThe National Parliament of Timor-Leste stands as a vital institution in the young democracy of Southeast Asia's newest nation. Established following the country's independence in 2002, this legislative body plays a crucial role in shaping the laws, policies, and future of Timor-Leste. This article explores the structure, functions, and significance of the National Parliament in Timor-Leste's democratic system.\\n\\nStructure and Composition\\n\\nTimor-Leste's parliament is [BLANK_1], meaning it consists of a single legislative chamber. This structure is common in smaller nations and newly established democracies, as it can streamline the legislative process. The parliament comprises 65 members, elected to serve five-year terms through a system of proportional representation. This electoral system aims to ensure that the diverse voices of Timor-Leste's population are represented in the national legislature.\\n\\nAt the helm of the parliament is the President of Parliament, who oversees proceedings and plays a key role in managing the institution's affairs. Additionally, the parliament is organized into various [BLANK_2], each focusing on specific policy areas such as economics, foreign affairs, or education. These committees allow for more in-depth scrutiny of proposed legislation and government actions.\\n\\nThe Legislative Process\\n\\nOne of the primary functions of the National Parliament is to create and pass laws. The legislative process in Timor-Leste follows several key stages:\\n\\n1. [BLANK_3] Introduction: A bill can be proposed by members of parliament, parliamentary groups, or the government.\\n\\n2. Committee Review: The relevant parliamentary committee examines the bill, potentially suggesting [BLANK_4].\\n\\n3. [BLANK_5] Debate: The full parliament discusses the bill in a plenary session.\\n\\n4. Voting: Members of parliament vote on the bill and any proposed amendments.\\n\\n5. Presidential Review: If passed, the bill is sent to the President of Timor-Leste for consideration.\\n\\n6. [BLANK_6]: If approved by the President, the bill is officially published as law.\\n\\nThis process ensures that proposed laws undergo thorough scrutiny and debate before becoming part of Timor-Leste's legal framework.\\n\\nParliamentary Oversight\\n\\nBeyond lawmaking, the National Parliament plays a crucial role in overseeing the actions of the government. This function is essential for maintaining the balance of power in Timor-Leste's democratic system. Parliamentary [BLANK_7] takes several forms:\\n\\n1. Questions to the Government: Members of parliament can pose questions to government ministers, holding them accountable for their actions and decisions.\\n\\n2. Hearings: Parliamentary committees can conduct hearings on specific issues, calling upon experts and government officials to provide testimony.\\n\\n3. Investigations: The parliament has the power to investigate matters of public interest or alleged misconduct by government officials.\\n\\n4. [BLANK_8]: In extreme cases, the parliament can initiate a vote of no confidence against the government, potentially leading to its dismissal.\\n\\nThese oversight mechanisms help ensure transparency and accountability in Timor-Leste's governance.\\n\\nChallenges and Developments\\n\\nAs a relatively young institution, the National Parliament of Timor-Leste faces several challenges. These include building institutional capacity, enhancing the technical expertise of members and staff, and fostering a culture of robust democratic debate. Despite these challenges, the parliament has made significant strides in recent years, becoming increasingly effective in its legislative and oversight roles.\\n\\nConclusion\\n\\nThe National Parliament of Timor-Leste plays a pivotal role in the country's democratic system. As the primary legislative body, it serves as a forum for national debate, a check on executive power, and the main avenue for creating [BLANK_9] that shape the nation's future. While challenges remain, the continued development and strengthening of this institution are crucial for the consolidation of democracy in Timor-Leste. As the country moves forward, the National Parliament will undoubtedly remain at the heart of its political landscape, embodying the principles of representative governance and democratic participation.",
  "vocabulary": {
    "[BLANK_1]": "[BLANK_3] Introduction: A bill can be proposed by members of parliament, parliamentary groups, or the government.",
    "[BLANK_2]": "Committee Review: The relevant parliamentary committee examines the bill, potentially suggesting [BLANK_4].",
    "[BLANK_3]": "[BLANK_5] Debate: The full parliament discusses the bill in a plenary session.",
    "[BLANK_4]": "Voting: Members of parliament vote on the bill and any proposed amendments.",
    "[BLANK_5]": "Presidential Review: If passed, the bill is sent to the President of Timor-Leste for consideration.",
    "[BLANK_6]": "[BLANK_6]: If approved by the President, the bill is officially published as law.",
    "[BLANK_7]": "Questions to the Government: Members of parliament can pose questions to government ministers, holding them accountable for their actions and decisions.",
    "[BLANK_8]": "Hearings: Parliamentary committees can conduct hearings on specific issues, calling upon experts and government officials to provide testimony.",
    "[BLANK_9]": "Investigations: The parliament has the power to investigate matters of public interest or alleged misconduct by government officials.",
    "[BLANK_10]": "[BLANK_8]: In extreme cases, the parliament can initiate a vote of no confidence against the government, potentially leading to its dismissal.",
    "[BLANK_11]": "unicameral",
    "[BLANK_12]": "parliamentary committees",
    "[BLANK_13]": "Bill",
    "[BLANK_14]": "amendments",
    "[BLANK_15]": "Plenary",
    "[BLANK_16]": "Promulgation",
    "[BLANK_17]": "oversight",
    "[BLANK_18]": "Vote of no confidence",
    "[BLANK_19]": "legislation",
    "[BLANK_20]": "Quorum"
  }
}