{
  "reading": "The Government of Timor-Leste: A Study in Parliamentary Democracy\\n\\nIntroduction\\n\\nTimor-Leste, also known as East Timor, is a young nation in Southeast Asia that gained independence in 2002 after a long struggle for self-determination. The country's government structure is a unique blend of [BLANK_1] democracy and semi-presidential system, designed to ensure stability and representation in a post-conflict society. This paper examines the key features of Timor-Leste's government, focusing on its structure, functions, and the interplay between its main institutions.\\n\\nGovernment Structure and Functions\\n\\nAt the heart of Timor-Leste's government is the parliamentary system, where the [BLANK_2] branch is accountable to the [BLANK_3]. The government is led by the [BLANK_4], who heads the [BLANK_5]. This council forms the executive branch and is responsible for the day-to-day governance of the country.\\n\\nThe Prime Minister of Timor-Leste holds significant power within the government structure. They are typically the leader of the majority party or [BLANK_6] in the National Parliament and are appointed by the [BLANK_7] after elections. The Prime Minister's responsibilities include setting the government's policy agenda, coordinating the work of [BLANK_8], and representing the country in international affairs.\\n\\nThe Council of Ministers, comprising various ministry heads, plays a crucial role in policy formulation and implementation. Each minister oversees a specific portfolio, such as finance, education, or foreign affairs, and is responsible for the operations of their respective ministries.\\n\\nRelationship Between Prime Minister and President\\n\\nTimor-Leste's system is characterized by a division of power between the Prime Minister and the President. While the Prime Minister leads the government, the President serves as the head of state and commander-in-chief of the armed forces. This arrangement creates a system of checks and balances, with the President having the power to veto legislation and dissolve parliament under certain circumstances.\\n\\nThe relationship between these two offices requires careful navigation and cooperation. The President, while not involved in day-to-day governance, plays a crucial role in maintaining constitutional order and representing national unity. This dual executive system aims to prevent the concentration of power in a single office, a consideration particularly important in a young democracy with a history of conflict.\\n\\nFormation of Government\\n\\nThe process of forming a government in Timor-Leste begins after parliamentary elections. The party or coalition that secures a majority in the National Parliament typically forms the government. If no single party achieves a majority, coalition negotiations may take place to form a government.\\n\\nOnce a potential government is formed, the President appoints the Prime Minister, who then selects ministers for the Council of Ministers. This process underscores the parliamentary nature of the system, where the executive's legitimacy stems from its ability to command the confidence of the legislature.\\n\\nNo-Confidence Votes and Government Stability\\n\\nAn important feature of Timor-Leste's parliamentary system is the mechanism of [BLANK_9]. This allows the National Parliament to remove a government from power if it loses the support of the majority. While this ensures accountability, it can also lead to political instability if used frequently.\\n\\nThe threat of no-confidence votes encourages the government to maintain the support of parliament and can lead to coalition governments or political compromises to ensure stability. This aspect of the system reflects the delicate balance between accountability and governmental stability that Timor-Leste seeks to maintain.\\n\\nConclusion\\n\\nThe government of Timor-Leste represents a carefully crafted system designed to meet the unique needs of a young, post-conflict nation. Its parliamentary structure, coupled with a semi-presidential system, aims to ensure democratic representation, prevent the concentration of power, and maintain political stability. As Timor-Leste continues to develop its democratic institutions, the effectiveness of this governmental structure in addressing the nation's challenges and aspirations will be crucial to its future success. The ongoing evolution of Timor-Leste's political system offers valuable insights into the challenges and opportunities of building democratic governance in post-conflict societies.",
  "vocabulary": {
    "[BLANK_1]": "parliamentary",
    "[BLANK_2]": "executive",
    "[BLANK_3]": "legislature",
    "[BLANK_4]": "Prime Minister",
    "[BLANK_5]": "Council of Ministers",
    "[BLANK_6]": "coalition",
    "[BLANK_7]": "President",
    "[BLANK_8]": "ministers",
    "[BLANK_9]": "no-confidence votes",
    "[BLANK_10]": "government"
  }
}