{
  "reading": "Still life and [BLANK_1] are fundamental elements in the world of visual arts, particularly in drawing and painting. These concepts allow artists to capture the essence of inanimate objects and their surfaces, creating compelling [BLANK_2] that engage viewers and showcase the artist's observational skills. This article explores the intricacies of still life art and the importance of texture in creating realistic and visually appealing artwork.\\n\\nThe Art of Still Life:\\n[BLANK_3] art involves the depiction of inanimate objects, typically arranged in a deliberate composition. This genre has a rich history dating back to ancient civilizations, but it gained particular prominence during the Renaissance and Dutch Golden Age. Still life compositions often include everyday items such as fruits, flowers, pottery, and textiles, allowing artists to explore [BLANK_4], color, and texture in a controlled setting.\\n\\nOne of the key aspects of still life art is composition. Artists carefully arrange objects to create balance, harmony, and visual interest. They consider factors such as the placement of objects, the use of [BLANK_5], and the overall flow of the composition. This thoughtful arrangement allows artists to guide the viewer's eye through the artwork and create a sense of depth and dimension.\\n\\nThe Importance of Texture in Art:\\nTexture refers to the surface quality of an object, both in terms of how it feels and how it appears visually. In art, texture plays a crucial role in creating realism and depth. By accurately representing the textures of various objects, artists can make their work more engaging and lifelike.\\n\\nThere are two main types of texture in art: actual texture and visual texture. Actual texture refers to the physical surface quality of the artwork itself, such as the roughness of canvas or the smoothness of polished marble. Visual texture, on the other hand, is the illusion of texture created through various drawing or painting techniques.\\n\\nTechniques for Depicting Texture:\\nArtists employ a variety of techniques to represent different textures in their work. Some common methods include:\\n\\n1. [BLANK_6]: Using intersecting lines to create the appearance of texture and shading.\\n2. [BLANK_7]: Creating texture through a series of small dots or marks.\\n3. [BLANK_8]: Smoothing and softening edges to create a seamless transition between areas.\\n4. Scumbling: Applying light layers of color over existing layers to create a textured effect.\\n5. Impasto: Using thick layers of paint to create a three-dimensional, textured surface.\\n\\nThese techniques allow artists to depict a wide range of textures, from the smooth surface of a polished vase to the rough bark of a tree.\\n\\nTexture in Still Life Compositions:\\nIn still life art, texture plays a particularly important role in creating [BLANK_9] and visual interest. By including objects with varying textures in a single composition, artists can create a dynamic interplay of surfaces that engages the viewer's eye and adds depth to the artwork.\\n\\nFor example, a still life composition might include a smooth, reflective metal vase alongside a rough-textured woven basket and soft, velvety flower petals. The contrast between these textures creates visual interest and allows the artist to showcase their skill in representing different surface qualities.\\n\\nConclusion:\\nStill life and texture are essential elements in the world of visual arts, allowing artists to create compelling compositions that capture the essence of everyday objects. By mastering techniques for depicting various textures and carefully arranging objects in still life compositions, artists can create works that are both visually appealing and rich in detail. Whether working with traditional media or exploring digital art forms, understanding the principles of still life and texture is crucial for any artist seeking to create realistic and engaging artwork.",
  "vocabulary": {
    "[BLANK_1]": "[BLANK_6]: Using intersecting lines to create the appearance of texture and shading.",
    "[BLANK_2]": "[BLANK_7]: Creating texture through a series of small dots or marks.",
    "[BLANK_3]": "[BLANK_8]: Smoothing and softening edges to create a seamless transition between areas.",
    "[BLANK_4]": "Scumbling: Applying light layers of color over existing layers to create a textured effect.",
    "[BLANK_5]": "Impasto: Using thick layers of paint to create a three-dimensional, textured surface.",
    "[BLANK_6]": "texture",
    "[BLANK_7]": "composition",
    "[BLANK_8]": "Still life",
    "[BLANK_9]": "form",
    "[BLANK_10]": "negative space",
    "[BLANK_11]": "Cross-hatching",
    "[BLANK_12]": "Stippling",
    "[BLANK_13]": "Blending",
    "[BLANK_14]": "contrast",
    "[BLANK_15]": "value"
  }
}