{
  "reading": "Foundations of Drawing: The Building Blocks of Visual Art\\n\\nIntroduction\\n\\nDrawing is often considered the cornerstone of visual arts, serving as a fundamental skill that underpins various artistic disciplines. The foundations of drawing encompass a set of basic principles and techniques that enable artists to translate three-dimensional reality onto a two-dimensional surface. This article explores the essential elements of drawing, focusing on the use of materials, [BLANK_1] techniques, and the representation of light and shadow.\\n\\nThe Essentials of Drawing Materials\\n\\nAt the heart of drawing lies the relationship between the artist and their tools. The most basic drawing implements include pencils, charcoal, and erasers. Pencils come in various hardnesses, ranging from soft (B) to hard (H), allowing artists to create a wide spectrum of tones and lines. Charcoal, often sourced from natural materials, offers a more expressive medium, capable of producing rich, dark tones and bold strokes. Erasers, far from being mere correction tools, can be used creatively to lift and manipulate marks, adding another dimension to the drawing process.\\n\\nThe Art of Shading\\n\\n[BLANK_1] is a crucial technique in drawing that brings depth, volume, and realism to an image. It is the process of applying darker or lighter values to areas of a drawing to create the illusion of three-dimensionality. There are several shading methods that artists employ:\\n\\n1. [BLANK_2]: This involves drawing parallel lines close together. The closer and denser the lines, the darker the area appears.\\n\\n2. [BLANK_3]: An extension of hatching, this technique uses intersecting sets of parallel lines to create more complex tones and textures.\\n\\n3. [BLANK_4]: This method involves smoothing out marks to create gradual transitions between tones, often achieved using tools like blending stumps or even one's fingers.\\n\\n4. Stippling: This technique uses a series of dots to create tones, with denser clusters of dots appearing darker.\\n\\nUnderstanding Light and Shadow\\n\\nThe interplay of light and shadow is fundamental to creating convincing three-dimensional forms in drawing. Artists must observe and understand how light behaves when it falls on objects to accurately represent them. Key concepts include:\\n\\n1. [BLANK_5]: The brightest area on an object where light directly hits the surface.\\n\\n2. [BLANK_6]: The darkest areas where light is blocked or minimal.\\n\\n3. Cast shadow: The shadow that an object creates on surrounding surfaces.\\n\\n4. Core shadow: The area of deepest shadow on the object itself, typically found at the point where the form turns away from the light source.\\n\\n5. Reflected light: Subtle illumination in shadow areas caused by light bouncing off nearby surfaces.\\n\\nMastering Spherical Forms\\n\\nThe sphere is often considered the perfect subject for practicing shading and understanding light behavior. Its curved surface demonstrates a full range of tonal values, from the brightest highlight to the darkest shadow. By studying and drawing spheres, artists can grasp the fundamental principles of creating volume and depth in their work.\\n\\nConclusion\\n\\nThe foundations of drawing provide artists with the essential skills to observe, interpret, and represent the world around them. By mastering the use of basic materials, understanding shading techniques, and learning to accurately depict light and shadow, artists lay the groundwork for more advanced artistic endeavors. These fundamental skills not only enhance one's ability to create realistic representations but also form the basis for more expressive and abstract forms of art. As with any skill, proficiency in drawing comes with practice, patience, and a keen eye for observation. Whether pursuing art professionally or as a hobby, a solid grounding in the foundations of drawing opens up a world of creative possibilities.",
  "vocabulary": {
    "[BLANK_1]": "[BLANK_2]: This involves drawing parallel lines close together. The closer and denser the lines, the darker the area appears.",
    "[BLANK_2]": "[BLANK_3]: An extension of hatching, this technique uses intersecting sets of parallel lines to create more complex tones and textures.",
    "[BLANK_3]": "[BLANK_4]: This method involves smoothing out marks to create gradual transitions between tones, often achieved using tools like blending stumps or even one's fingers.",
    "[BLANK_4]": "Stippling: This technique uses a series of dots to create tones, with denser clusters of dots appearing darker.",
    "[BLANK_5]": "[BLANK_5]: The brightest area on an object where light directly hits the surface.",
    "[BLANK_6]": "[BLANK_6]: The darkest areas where light is blocked or minimal.",
    "[BLANK_7]": "Cast shadow: The shadow that an object creates on surrounding surfaces.",
    "[BLANK_8]": "Core shadow: The area of deepest shadow on the object itself, typically found at the point where the form turns away from the light source.",
    "[BLANK_9]": "Reflected light: Subtle illumination in shadow areas caused by light bouncing off nearby surfaces.",
    "[BLANK_10]": "shading",
    "[BLANK_11]": "hatching",
    "[BLANK_12]": "cross-hatching",
    "[BLANK_13]": "blending",
    "[BLANK_14]": "highlight",
    "[BLANK_15]": "shadow",
    "[BLANK_16]": "texture",
    "[BLANK_17]": "contour",
    "[BLANK_18]": "mid-tones",
    "[BLANK_19]": "cast shadow"
  }
}