{
  "reading": "In the rapidly evolving world of technology, programming languages and game development have become increasingly accessible to enthusiasts and professionals alike. [BLANK_1], a versatile and user-friendly programming language, has emerged as a popular choice for various applications, including game development. This paper explores the fundamental concepts of Python programming and its application in creating interactive games.\\n\\nAt the core of Python programming are [BLANK_2] and [BLANK_3]. Variables act as containers for storing data values, allowing programmers to manipulate and reference information throughout their code. Python supports various data types, including [BLANK_4] for whole numbers, [BLANK_5] for decimal numbers, [BLANK_6] for text, and [BLANK_7] for true/false values. For instance, a game might use an integer variable to keep track of a player's score or a string variable to store the player's name.\\n\\n[BLANK_8] in Python provide the means to perform operations on these variables and data types. Arithmetic operators (+, -, *, /, //, %) allow for mathematical calculations, while comparison operators (==, !=, <, >, <=, >=) enable logical comparisons. These operators are crucial in game development for tasks such as updating scores, checking conditions, and controlling game flow.\\n\\nWhen it comes to game development, Python offers a powerful library called [BLANK_9]. Pygame extends Python's capabilities by providing a set of modules specifically designed for creating video games. It simplifies complex tasks such as handling graphics, sound, and user input, allowing developers to focus on game logic and creativity.\\n\\nOne of the fundamental concepts in game development is the [BLANK_10]. This programming pattern continuously processes user input, updates the game state, and renders the game on screen. The game loop ensures that the game remains responsive to player actions and maintains a smooth, interactive experience. In Python and Pygame, this loop typically consists of three main phases: event handling (processing user input), game state update (modifying game objects and variables), and rendering (drawing the updated game state on screen).",
  "vocabulary": {
    "[BLANK_1]": "Python",
    "[BLANK_2]": "variables",
    "[BLANK_3]": "data type",
    "[BLANK_4]": "Integer",
    "[BLANK_5]": "Float",
    "[BLANK_6]": "String",
    "[BLANK_7]": "Boolean",
    "[BLANK_8]": "Operator",
    "[BLANK_9]": "Pygame",
    "[BLANK_10]": "game loop"
  }
}