{
  "reading": "Collision Detection and Game Logic: Essential Elements of Interactive Gaming\\n\\nIntroduction\\n\\nIn the realm of video game development, two fundamental concepts play a crucial role in creating engaging and responsive gameplay experiences: [BLANK_1] and game logic. These elements form the backbone of interactive gaming, allowing players to interact with virtual environments and providing the framework for game rules and mechanics. This paper explores the significance of collision detection and game logic, their implementation, and their impact on modern video game design.\\n\\nCollision Detection: The Foundation of Interaction\\n\\n[BLANK_1] is the process by which a game determines when two or more objects in a virtual space come into contact or overlap. This seemingly simple concept is essential for creating believable and interactive game worlds. Without collision detection, characters would pass through walls, projectiles would have no impact, and the game environment would lack any sense of physicality.\\n\\nAt its core, collision detection involves constantly checking the positions and boundaries of game objects to determine if they intersect. One common method is rectangular collision detection, where each object is surrounded by an invisible rectangle called a [BLANK_2]. By comparing the coordinates of these bounding boxes, the game can quickly determine if objects are colliding.\\n\\nMore advanced collision detection techniques include:\\n\\n1. Circular collision detection: Using circular boundaries for more accurate detection of round objects.\\n2. Pixel-perfect collision: Checking individual pixels for the most precise collision detection, often used in 2D games.\\n3. 3D collision detection: Employing complex algorithms to detect collisions in three-dimensional space.\\n\\nImplementing effective collision detection is crucial for various aspects of gameplay, such as:\\n\\n- Character movement and environmental interaction\\n- Combat mechanics (e.g., detecting hits in fighting games)\\n- Item collection and power-up activation\\n- Triggering in-game events or cutscenes\\n\\nGame Logic: The Rules of the Virtual World\\n\\nGame logic encompasses the rules, systems, and mechanics that govern how a game functions. It defines the objectives, challenges, and overall structure of the gameplay experience. Effective game logic creates a coherent and engaging virtual world that players can understand and interact with meaningfully.\\n\\nKey components of game logic include:\\n\\n1. [BLANK_3]: Methods for tracking and rewarding player progress or achievements.\\n2. [BLANK_4]: Different modes or conditions of the game (e.g., playing, paused, game over).\\n3. Win/loss conditions: Criteria for determining when a player has succeeded or failed.\\n4. Difficulty progression: Mechanisms for increasing challenge as the player advances.\\n5. Resource management: Systems for handling in-game currencies, health, ammunition, etc.\\n\\nGame logic often interacts closely with collision detection. For example, in a collection-based game, collision detection determines when a player touches an item, while game logic decides how many points to award and updates the score accordingly.\\n\\nImplementing Game Logic and Collision Detection\\n\\nModern game development frameworks and engines, such as Unity, Unreal Engine, and Pygame, provide built-in tools and functions for handling collision detection and implementing game logic. However, understanding the underlying principles is crucial for game developers to create unique and optimized gameplay experiences.\\n\\nFor instance, in a simple collection game using Pygame, collision detection might be implemented as follows:\\n\\n```python\\nif player_[BLANK_5].colliderect(fruit_[BLANK_5]):\\n    score += 10\\n    remove_fruit()\\n```\\n\\nThis code checks if the player's bounding box intersects with a fruit's bounding box. If true, the game logic increases the score and removes the collected fruit from the game.\\n\\nConclusion\\n\\nCollision detection and game logic are fundamental elements that breathe life into video games, transforming static visual elements into dynamic, interactive experiences. As game development continues to evolve, these concepts remain at the heart of creating engaging and immersive virtual worlds. By mastering collision detection and game logic, developers can craft games that not only look impressive but also provide satisfying and responsive gameplay. As players, understanding these concepts can deepen our appreciation for the intricate systems that make our favorite games possible.",
  "vocabulary": {
    "[BLANK_1]": "Circular collision detection: Using circular boundaries for more accurate detection of round objects.",
    "[BLANK_2]": "Pixel-perfect collision: Checking individual pixels for the most precise collision detection, often used in 2D games.",
    "[BLANK_3]": "3D collision detection: Employing complex algorithms to detect collisions in three-dimensional space.",
    "[BLANK_4]": "[BLANK_3]: Methods for tracking and rewarding player progress or achievements.",
    "[BLANK_5]": "[BLANK_4]: Different modes or conditions of the game (e.g., playing, paused, game over).",
    "[BLANK_6]": "Win/loss conditions: Criteria for determining when a player has succeeded or failed.",
    "[BLANK_7]": "Difficulty progression: Mechanisms for increasing challenge as the player advances.",
    "[BLANK_8]": "Resource management: Systems for handling in-game currencies, health, ammunition, etc.",
    "[BLANK_9]": "collision detection",
    "[BLANK_10]": "bounding box",
    "[BLANK_11]": "Scoring systems",
    "[BLANK_12]": "Game states",
    "[BLANK_13]": "rect",
    "[BLANK_14]": "Game loop",
    "[BLANK_15]": "Sprite",
    "[BLANK_16]": "game state",
    "[BLANK_17]": "Rect",
    "[BLANK_18]": "scoring system"
  }
}