{
  "reading": "Final Project Development in Playwriting\\n\\nThe culmination of a playwright's creative journey often manifests in the form of a final projectâ€”typically an original [BLANK_1] that encapsulates the skills and knowledge acquired throughout their studies. This critical phase of development requires a multifaceted approach, combining artistic vision with technical proficiency to produce a stage-worthy piece of dramatic literature.\\n\\nAt the heart of final project development lies the art of [BLANK_2]. Unlike other forms of writing, plays are inherently meant to be performed, necessitating a unique approach to refinement. Playwrights must learn to hear their work as much as they see it on the page. Reading dialogue aloud becomes an essential tool, allowing writers to fine-tune the rhythm and flow of conversations, ensuring they sound natural and authentic when spoken by actors.\\n\\nCharacter development takes center stage during this process. Each character's [BLANK_3] and conflicts must be clearly defined and consistently portrayed throughout the script. This attention to detail helps create multi-dimensional personalities that resonate with audiences and provide actors with rich material to interpret. In the context of plays set in specific cultural milieus, such as Timor-Leste, ensuring [BLANK_4] becomes paramount. Playwrights must research and accurately represent the nuances of local customs, language, and social dynamics to create a genuine and respectful portrayal of the setting.\\n\\nThe revision process also involves a critical examination of the play's structure and pacing. Unnecessary dialogue and stage directions are trimmed to maintain narrative momentum and avoid overwhelming directors and actors with extraneous information. This streamlining process helps to distill the essence of the story, allowing the core themes and conflicts to shine through more clearly.\\n\\nAs the play nears its final form, attention shifts to preparing the script for potential production. This involves adhering to industry-standard formatting conventions, which ensure that the script is easily readable by directors, actors, and other theatre professionals. Proper formatting includes consistent font usage, clear delineation between dialogue and stage directions, and appropriate spacing and margins.\\n\\nStage directions play a crucial role in bridging the gap between the written word and its physical realization on stage. While it's important to provide necessary guidance for blocking and character actions, playwrights must strike a balance, avoiding overly prescriptive directions that might limit a director's creative interpretation. Clear, concise stage directions that focus on essential actions and mood-setting details are most effective.\\n\\nCharacter descriptions and setting details are another vital component of a [BLANK_5]. These elements provide valuable context for directors and designers, helping them visualize the world of the play and make informed decisions about casting, set design, and costuming. However, as with stage directions, these descriptions should be carefully crafted to provide necessary information without being overly restrictive.\\n\\nAn integral part of the development process is the [BLANK_6]. This form of presentation, where actors read the script aloud without full staging or costumes, serves multiple purposes. It allows the playwright to hear their work performed, often revealing areas that require further refinement. Additionally, it provides an opportunity for feedback from peers, mentors, and potential audience members. The insights gained from a staged reading can be invaluable in making final adjustments to the script.\\n\\nPreparing for a staged reading involves selecting key excerpts that showcase the play's strengths and central conflicts. Playwrights must consider how to present their work effectively within a limited timeframe, often choosing scenes that highlight character dynamics, pivotal plot points, or thematic elements. This process of selection and preparation can also help writers identify areas of their script that may need additional work.\\n\\nThe development of a final playwriting project is a complex and iterative process. It demands not only creativity and storytelling skill but also a keen eye for detail, an ear for dialogue, and the ability to envision how words on a page will translate to live performance. Through careful revision, attention to production elements, and the valuable feedback gained from staged readings, playwrights can refine their work into polished, production-ready scripts that are primed to captivate audiences and bring new stories to life on stage.\\n\\nIn conclusion, final project development in playwriting is a comprehensive process that bridges the gap between initial creative inspiration and a fully realized theatrical work. It encompasses revision techniques, production preparation, and collaborative feedback, all aimed at creating a script that is not only artistically compelling but also practically viable for stage production. This phase of a playwright's journey is where craft meets creativity, resulting in original works that have the potential to contribute meaningfully to the world of theatre.",
  "vocabulary": {
    "[BLANK_1]": "one-act play",
    "[BLANK_2]": "revision",
    "[BLANK_3]": "objective",
    "[BLANK_4]": "cultural authenticity",
    "[BLANK_5]": "production-ready script",
    "[BLANK_6]": "staged reading",
    "[BLANK_7]": "dramaturgy",
    "[BLANK_8]": "conflict",
    "[BLANK_9]": "character",
    "[BLANK_10]": "dialogue"
  }
}