{
  "reading": "Basic Weave Structures: The Foundation of Textile Design\\n\\nIntroduction\\n\\nWeaving, one of the oldest and most fundamental textile production techniques, has been an integral part of human civilization for thousands of years. At the heart of this craft lie basic weave structures, which form the foundation for all woven fabrics. This paper explores three primary weave structures: plain weave, twill weave, and satin weave. Understanding these structures is crucial for anyone interested in textiles, fashion, or cultural heritage, as they influence the appearance, texture, and properties of fabrics used in everyday life and traditional crafts alike.\\n\\nPlain Weave: The Simplest Structure\\n\\nPlain weave, also known as tabby weave, is the most basic and common of all weave structures. In this pattern, each [BLANK_1] yarn passes alternately over and under each [BLANK_2] yarn, creating a simple interlacing pattern. This over-under sequence is repeated throughout the fabric, resulting in a stable and balanced structure.\\n\\nCharacteristics of plain weave fabrics include:\\n1. Durability and strength due to the frequent interlacing of yarns\\n2. Even appearance on both sides of the fabric\\n3. Good breathability and absorbency\\n4. Limited stretch or elasticity\\n\\nPlain weave is widely used in everyday fabrics such as cotton shirting, canvas, and muslin. Its simplicity makes it an ideal starting point for novice weavers and a versatile base for more complex designs.\\n\\nTwill Weave: Diagonal Distinction\\n\\n[BLANK_3] weave is characterized by its distinctive diagonal lines or ribs on the fabric surface. This structure is created when weft yarns pass over two or more warp yarns before going under the next set, with each row offset to create the diagonal pattern.\\n\\nKey features of twill weave include:\\n1. Increased fabric strength compared to plain weave\\n2. Better drape and wrinkle resistance\\n3. Ability to hide soiling due to the textured surface\\n4. Variations such as 2/2 twill, herringbone, and diamond twill\\n\\nTwill weave is commonly found in denim, gabardine, and many types of suiting fabrics. Its diagonal structure allows for interesting color effects and patterns, making it popular in both fashion and home textiles.\\n\\nSatin Weave: Smooth Sophistication\\n\\n[BLANK_4] weave is distinguished by its smooth, lustrous surface created by long \\\"[BLANK_5]\\\" of yarn. In this structure, weft yarns pass over several warp yarns before interlacing, resulting in fewer visible interlacings on the fabric surface.\\n\\nCharacteristics of satin weave fabrics include:\\n1. A smooth, shiny face and duller back\\n2. Excellent drape and fluidity\\n3. Susceptibility to snagging due to long floats\\n4. Variations in luster depending on the fiber used\\n\\nSatin weave is often associated with luxury fabrics like silk satin and high-end bedding. However, it's also used in more practical applications such as athletic wear and umbrella fabric, where its smooth surface offers specific performance benefits.\\n\\nCultural Significance and Traditional Applications\\n\\nIn many cultures, including Timor-Leste, these basic weave structures form the foundation of traditional textile arts. For example, tais, the traditional cloth of Timor-Leste, often incorporates complex patterns built upon these basic structures. Understanding these fundamental weaves allows artisans to create intricate designs that carry cultural significance and tell stories through fabric.\\n\\nConclusion\\n\\nBasic weave structures – plain, twill, and satin – are the building blocks of woven textiles. Each structure imparts unique characteristics to the fabric, influencing its appearance, texture, and performance. From the simplicity of plain weave to the sophistication of satin, these structures have been used for millennia to create fabrics that serve both functional and aesthetic purposes. As we continue to innovate in textile production, these fundamental weave structures remain at the core of fabric design, bridging ancient traditions with modern applications.",
  "vocabulary": {
    "[BLANK_1]": "Durability and strength due to the frequent interlacing of yarns",
    "[BLANK_2]": "Even appearance on both sides of the fabric",
    "[BLANK_3]": "Good breathability and absorbency",
    "[BLANK_4]": "Limited stretch or elasticity",
    "[BLANK_5]": "Increased fabric strength compared to plain weave",
    "[BLANK_6]": "Better drape and wrinkle resistance",
    "[BLANK_7]": "Ability to hide soiling due to the textured surface",
    "[BLANK_8]": "Variations such as 2/2 twill, herringbone, and diamond twill",
    "[BLANK_9]": "A smooth, shiny face and duller back",
    "[BLANK_10]": "Excellent drape and fluidity",
    "[BLANK_11]": "Susceptibility to snagging due to long floats",
    "[BLANK_12]": "Variations in luster depending on the fiber used",
    "[BLANK_13]": "weft",
    "[BLANK_14]": "warp",
    "[BLANK_15]": "Twill",
    "[BLANK_16]": "Satin",
    "[BLANK_17]": "floats",
    "[BLANK_18]": "shed",
    "[BLANK_19]": "pick-up stick",
    "[BLANK_20]": "shuttle",
    "[BLANK_21]": "plain weave",
    "[BLANK_22]": "loom"
  }
}