{
  "reading": "Yarn and Fiber Properties: The Building Blocks of Textiles\\n\\nIntroduction:\\n\\nYarn and fiber properties form the foundation of textile production, influencing everything from the feel of a fabric to its durability and appearance. Understanding these properties is crucial for anyone involved in textile design, manufacturing, or even consumers who want to make informed choices about their clothing and home textiles. This article will explore the key aspects of yarn and fiber properties, including the differences between natural and synthetic fibers, yarn characteristics, and how these elements impact the final textile product.\\n\\nNatural and Synthetic Fibers:\\n\\nFibers are the basic units from which yarns and fabrics are made. They can be broadly categorized into natural and synthetic fibers, each with its own unique properties.\\n\\nNatural fibers are derived from plants or animals. Common examples include:\\n\\n1. Cotton: Known for its softness, breathability, and moisture-absorbing properties.\\n2. Wool: Prized for its warmth, elasticity, and natural water-resistance.\\n3. Silk: Valued for its luxurious feel, strength, and lustrous appearance.\\n4. Linen: Appreciated for its coolness, durability, and tendency to become softer with use.\\n\\nSynthetic fibers, on the other hand, are man-made and often designed to mimic or improve upon natural fiber properties. Popular synthetic fibers include:\\n\\n1. Polyester: Known for its strength, wrinkle-resistance, and quick-drying properties.\\n2. Nylon: Valued for its elasticity, durability, and resistance to abrasion.\\n\\nFiber Structure:\\n\\nFibers can be further classified based on their structure:\\n\\n1. [BLANK_1]: Short fibers that must be spun together to form yarn. Most natural fibers (except silk) and some synthetic fibers are [BLANK_1].\\n2. [BLANK_2]: Long, continuous fibers that can be used directly to make yarn. Silk is a natural [BLANK_2], while most synthetic fibers are produced as [BLANK_2].\\n\\nYarn Properties:\\n\\nYarn is created by spinning fibers together. The properties of yarn significantly influence the characteristics of the final fabric. Key yarn properties include:\\n\\n1. [BLANK_3]: This is a numerical expression of yarn linear density, indicating the thickness of the yarn. Different systems are used to measure [BLANK_3], such as the Ne (cotton count) system or the [BLANK_4] system.\\n\\n2. Twist: The spiral arrangement of fibers in a yarn. [BLANK_5] is described as S-twist (counterclockwise) or Z-twist (clockwise). The amount and direction of twist affect the yarn's strength, appearance, and feel.\\n\\n3. Ply: The number of single yarns twisted together to form a plied yarn. Multi-ply yarns are often stronger and more balanced than single yarns.\\n\\nImpact on Fabric Properties:\\n\\nThe properties of fibers and yarns directly influence the characteristics of the finished fabric:\\n\\n1. Strength and durability: Longer fibers and higher twist yarns generally produce stronger fabrics.\\n\\n2. Texture and hand: The type of fiber and yarn structure affect how a fabric feels to the touch.\\n\\n3. [BLANK_6]: The way a fabric hangs is influenced by fiber type, yarn count, and fabric construction.\\n\\n4. Absorbency: Natural fibers like cotton and linen are generally more absorbent than synthetic fibers.\\n\\n5. Wrinkle resistance: Some synthetic fibers and specially treated natural fibers offer better wrinkle resistance.\\n\\n6. Thermal properties: Wool and certain synthetic fibers provide better insulation, while cotton and linen are known for their coolness.\\n\\nConclusion:\\n\\nUnderstanding yarn and fiber properties is essential for creating textiles that meet specific performance and aesthetic requirements. From the softness of cotton to the durability of nylon, each fiber and yarn type brings unique characteristics to the final product. As textile technology advances, new fibers and yarn structures continue to be developed, expanding the possibilities for innovative and functional fabrics. Whether you're a textile professional or a curious consumer, appreciating these fundamental properties can enhance your understanding and appreciation of the diverse world of textiles.",
  "vocabulary": {
    "[BLANK_1]": "Cotton: Known for its softness, breathability, and moisture-absorbing properties.",
    "[BLANK_2]": "Wool: Prized for its warmth, elasticity, and natural water-resistance.",
    "[BLANK_3]": "Silk: Valued for its luxurious feel, strength, and lustrous appearance.",
    "[BLANK_4]": "Linen: Appreciated for its coolness, durability, and tendency to become softer with use.",
    "[BLANK_5]": "Polyester: Known for its strength, wrinkle-resistance, and quick-drying properties.",
    "[BLANK_6]": "Nylon: Valued for its elasticity, durability, and resistance to abrasion.",
    "[BLANK_7]": "[BLANK_1]: Short fibers that must be spun together to form yarn. Most natural fibers (except silk) and some synthetic fibers are [BLANK_1].",
    "[BLANK_8]": "[BLANK_2]: Long, continuous fibers that can be used directly to make yarn. Silk is a natural [BLANK_2], while most synthetic fibers are produced as [BLANK_2].",
    "[BLANK_9]": "[BLANK_3]: This is a numerical expression of yarn linear density, indicating the thickness of the yarn. Different systems are used to measure [BLANK_3], such as the Ne (cotton count) system or the [BLANK_4] system.",
    "[BLANK_10]": "Twist: The spiral arrangement of fibers in a yarn. [BLANK_5] is described as S-twist (counterclockwise) or Z-twist (clockwise). The amount and direction of twist affect the yarn's strength, appearance, and feel.",
    "[BLANK_11]": "Ply: The number of single yarns twisted together to form a plied yarn. Multi-ply yarns are often stronger and more balanced than single yarns.",
    "[BLANK_12]": "Strength and durability: Longer fibers and higher twist yarns generally produce stronger fabrics.",
    "[BLANK_13]": "Texture and hand: The type of fiber and yarn structure affect how a fabric feels to the touch.",
    "[BLANK_14]": "[BLANK_6]: The way a fabric hangs is influenced by fiber type, yarn count, and fabric construction.",
    "[BLANK_15]": "Absorbency: Natural fibers like cotton and linen are generally more absorbent than synthetic fibers.",
    "[BLANK_16]": "Wrinkle resistance: Some synthetic fibers and specially treated natural fibers offer better wrinkle resistance.",
    "[BLANK_17]": "Thermal properties: Wool and certain synthetic fibers provide better insulation, while cotton and linen are known for their coolness.",
    "[BLANK_18]": "Staple fiber",
    "[BLANK_19]": "Filament fiber",
    "[BLANK_20]": "Yarn count",
    "[BLANK_21]": "Tex",
    "[BLANK_22]": "Twist direction",
    "[BLANK_23]": "Drape",
    "[BLANK_24]": "Warp",
    "[BLANK_25]": "Weft",
    "[BLANK_26]": "Bobbin",
    "[BLANK_27]": "Crimp"
  }
}