{
  "reading": "Salt-Tolerant Crops: A Promising Solution for Timor-Leste's Agricultural Challenges\\n\\nIntroduction\\n\\nTimor-Leste, a small Southeast Asian nation, faces significant agricultural challenges due to its coastal geography and increasing soil salinity. As climate change exacerbates these issues, the adoption of [BLANK_1] crops presents a promising solution to enhance food security and economic opportunities in the country. This paper explores the potential of salt-tolerant crops for Timor-Leste, discussing their characteristics, [BLANK_2] to the local climate, and their nutritional and economic value.\\n\\nSalt-Tolerant Crops Suitable for Timor-Leste\\n\\nSeveral salt-tolerant crops have shown potential for cultivation in Timor-Leste's saline conditions. These include:\\n\\n1. Quinoa: Originally from South America, quinoa is highly nutritious and can thrive in saline soils. Its adaptability to various climates makes it a promising option for Timor-Leste.\\n\\n2. Barley: Known for its salt tolerance, barley can be used for both human consumption and animal feed. It has been successfully cultivated in other saline environments worldwide.\\n\\n3. Date Palms: These trees are well-adapted to arid and saline conditions. They could provide both food and economic opportunities through date production.\\n\\n4. Saltbush: A hardy shrub that can be used for animal fodder and land rehabilitation in saline areas.\\n\\n5. Sea Asparagus (Salicornia): This [BLANK_3] can be cultivated in highly saline conditions and has potential as a food crop and biofuel source.\\n\\n6. Salt-Tolerant Rice Varieties: Researchers have developed rice varieties that can withstand higher levels of salinity, which could be crucial for Timor-Leste's rice production.\\n\\nAdaptation to Timor-Leste's Climate\\n\\nTimor-Leste's tropical climate, characterized by distinct wet and dry seasons, presents both challenges and opportunities for salt-tolerant crop cultivation. Successful adaptation strategies include:\\n\\n1. Selecting varieties that can withstand both high salinity and tropical heat.\\n2. Implementing appropriate planting schedules to align with rainfall patterns.\\n3. Utilizing water management techniques to mitigate salt accumulation during the dry season.\\n4. Incorporating traditional Timorese agricultural practices that have proven effective in local conditions.\\n\\nNutritional and Economic Value\\n\\nSalt-tolerant crops offer significant nutritional and economic benefits for Timor-Leste:\\n\\n1. Nutritional Value: Many salt-tolerant crops, such as quinoa and barley, are rich in proteins, vitamins, and minerals, contributing to improved nutrition for the local population.\\n\\n2. Crop Diversification: Introducing these crops allows farmers to diversify their production, reducing reliance on a single crop and improving food security.\\n\\n3. Economic Opportunities: Salt-tolerant crops can open new market opportunities, both domestically and for export. For example, quinoa and sea asparagus are in demand in international markets as health foods.\\n\\n4. Land Utilization: These crops enable the productive use of saline-affected lands that were previously considered unsuitable for agriculture, increasing overall agricultural output.\\n\\nImplementing Salt-Tolerant Crop Production\\n\\nSuccessfully introducing salt-tolerant crops in Timor-Leste requires:\\n\\n1. Farmer Education: Training programs to familiarize farmers with new crop varieties and cultivation techniques.\\n\\n2. Research and Development: Ongoing studies to identify and develop crop varieties best suited to Timor-Leste's specific conditions.\\n\\n3. Infrastructure Development: Investments in irrigation systems and post-harvest processing facilities to support production and value addition.\\n\\n4. Market Development: Creating local and export markets for these new crops to ensure economic viability for farmers.\\n\\nConclusion\\n\\nSalt-tolerant crops offer a promising solution to the agricultural challenges faced by Timor-Leste. By adopting these crops, the country can improve its food security, enhance nutrition, and create new economic opportunities. However, successful implementation will require a concerted effort from farmers, researchers, and policymakers. With proper planning and support, salt-tolerant crops could play a crucial role in transforming Timor-Leste's agricultural sector, making it more resilient and productive in the face of increasing soil salinity and climate change.",
  "vocabulary": {
    "[BLANK_1]": "Quinoa: Originally from South America, quinoa is highly nutritious and can thrive in saline soils. Its adaptability to various climates makes it a promising option for Timor-Leste.",
    "[BLANK_2]": "Barley: Known for its salt tolerance, barley can be used for both human consumption and animal feed. It has been successfully cultivated in other saline environments worldwide.",
    "[BLANK_3]": "Date Palms: These trees are well-adapted to arid and saline conditions. They could provide both food and economic opportunities through date production.",
    "[BLANK_4]": "Saltbush: A hardy shrub that can be used for animal fodder and land rehabilitation in saline areas.",
    "[BLANK_5]": "Sea Asparagus (Salicornia): This [BLANK_3] can be cultivated in highly saline conditions and has potential as a food crop and biofuel source.",
    "[BLANK_6]": "Salt-Tolerant Rice Varieties: Researchers have developed rice varieties that can withstand higher levels of salinity, which could be crucial for Timor-Leste's rice production.",
    "[BLANK_7]": "Selecting varieties that can withstand both high salinity and tropical heat.",
    "[BLANK_8]": "Implementing appropriate planting schedules to align with rainfall patterns.",
    "[BLANK_9]": "Utilizing water management techniques to mitigate salt accumulation during the dry season.",
    "[BLANK_10]": "Incorporating traditional Timorese agricultural practices that have proven effective in local conditions.",
    "[BLANK_11]": "Nutritional Value: Many salt-tolerant crops, such as quinoa and barley, are rich in proteins, vitamins, and minerals, contributing to improved nutrition for the local population.",
    "[BLANK_12]": "Crop Diversification: Introducing these crops allows farmers to diversify their production, reducing reliance on a single crop and improving food security.",
    "[BLANK_13]": "Economic Opportunities: Salt-tolerant crops can open new market opportunities, both domestically and for export. For example, quinoa and sea asparagus are in demand in international markets as health foods.",
    "[BLANK_14]": "Land Utilization: These crops enable the productive use of saline-affected lands that were previously considered unsuitable for agriculture, increasing overall agricultural output.",
    "[BLANK_15]": "Farmer Education: Training programs to familiarize farmers with new crop varieties and cultivation techniques.",
    "[BLANK_16]": "Research and Development: Ongoing studies to identify and develop crop varieties best suited to Timor-Leste's specific conditions.",
    "[BLANK_17]": "Infrastructure Development: Investments in irrigation systems and post-harvest processing facilities to support production and value addition.",
    "[BLANK_18]": "Market Development: Creating local and export markets for these new crops to ensure economic viability for farmers.",
    "[BLANK_19]": "salt-tolerant",
    "[BLANK_20]": "adaptability",
    "[BLANK_21]": "halophyte",
    "[BLANK_22]": "biomass",
    "[BLANK_23]": "yield potential",
    "[BLANK_24]": "crop rotation",
    "[BLANK_25]": "salinity threshold",
    "[BLANK_26]": "adaptation",
    "[BLANK_27]": "salt tolerance",
    "[BLANK_28]": "halophyte"
  }
}