{
  "reading": "Irrigation Management in Saline Agriculture: Cultivating Success in Challenging Conditions\\n\\nIntroduction\\n\\nSaline agriculture presents unique challenges to farmers worldwide, particularly in coastal areas and regions affected by soil salinity. As global food demand increases and arable land becomes scarcer, the need to effectively manage irrigation in saline conditions has become paramount. This paper explores the critical aspects of irrigation management in saline agriculture, focusing on techniques and strategies that enable successful crop production in salt-affected environments.\\n\\nThe Challenge of Salinity\\n\\nSoil salinity poses significant obstacles to plant growth and crop yield. Excess salt in the soil can impede water uptake by plants, disrupt nutrient balance, and cause physiological stress. In saline agriculture, effective irrigation management is crucial not only for providing water to crops but also for managing salt levels in the root zone.\\n\\n[BLANK_1]: A Game-Changer for Saline Agriculture\\n\\nOne of the most effective irrigation methods for saline conditions is [BLANK_1]. This system delivers water directly to the plant's root zone through a network of pipes, tubing, and [BLANK_2]. By precisely controlling water application, [BLANK_1] offers several advantages in saline environments:\\n\\n1. Minimized salt accumulation: Water is applied locally, reducing salt build-up in the broader soil area.\\n2. Improved water use efficiency: Less water is lost to [BLANK_3], ensuring more efficient use of often scarce water resources.\\n3. Enhanced nutrient management: Fertilizers can be applied directly with irrigation water, improving nutrient uptake in challenging soil conditions.\\n\\nWater Quality Management\\n\\nIn saline agriculture, the quality of irrigation water is as important as the quantity. Farmers must regularly test their water sources to monitor salinity levels and adjust their irrigation strategies accordingly. When dealing with poor quality water, several management strategies can be employed:\\n\\n1. Blending: Mixing saline water with fresher water sources to reduce overall salinity.\\n2. Crop selection: Choosing salt-tolerant crops that can thrive in higher salinity conditions.\\n3. [BLANK_4]: Applying excess water to flush salts below the root zone, a technique known as [BLANK_4].\\n\\nIrrigation Scheduling in Saline Conditions\\n\\nProper timing of irrigation is critical in saline agriculture. The goal is to maintain adequate soil moisture while preventing salt accumulation. Key factors in irrigation scheduling include:\\n\\n1. [BLANK_5] rates: Understanding water loss through evaporation and plant transpiration helps determine water needs.\\n2. Soil moisture monitoring: Regular checks of soil moisture levels guide irrigation decisions.\\n3. Crop growth stage: Water requirements vary throughout a crop's life cycle, necessitating adjustments in irrigation scheduling.\\n\\nCalculating Crop Water Requirements\\n\\nAccurate calculation of crop water needs is essential for effective irrigation management. In saline conditions, these calculations must account for:\\n\\n1. Crop type and salt tolerance: Different crops have varying water needs and [BLANK_6] levels.\\n2. Climate factors: Temperature, humidity, and wind affect [BLANK_5] rates.\\n3. Soil characteristics: Soil texture and structure influence water retention and movement.\\n4. [BLANK_4] requirements: Additional water may be needed to leach excess salts from the root zone.\\n\\nInnovative Techniques in Saline Irrigation\\n\\nAs challenges in saline agriculture grow, innovative irrigation techniques are emerging:\\n\\n1. Subsurface drip irrigation: Placing drip lines below the soil surface can further reduce evaporation and salt accumulation.\\n2. Precision irrigation: Using [BLANK_7] and data analytics to optimize water application based on real-time soil and plant conditions.\\n3. Deficit irrigation: Strategically reducing water application during less sensitive growth stages to improve [BLANK_8].\\n\\nConclusion\\n\\nEffective irrigation management is the cornerstone of successful saline agriculture. By employing techniques such as [BLANK_1], careful water quality management, and precise irrigation scheduling, farmers can overcome the challenges posed by soil salinity. As climate change and population growth continue to impact agricultural lands, the importance of mastering irrigation in saline conditions will only grow. Through continued research, innovation, and application of best practices, saline agriculture can play a crucial role in global food security and sustainable land use.",
  "vocabulary": {
    "[BLANK_1]": "Minimized salt accumulation: Water is applied locally, reducing salt build-up in the broader soil area.",
    "[BLANK_2]": "Improved water use efficiency: Less water is lost to [BLANK_3], ensuring more efficient use of often scarce water resources.",
    "[BLANK_3]": "Enhanced nutrient management: Fertilizers can be applied directly with irrigation water, improving nutrient uptake in challenging soil conditions.",
    "[BLANK_4]": "Blending: Mixing saline water with fresher water sources to reduce overall salinity.",
    "[BLANK_5]": "Crop selection: Choosing salt-tolerant crops that can thrive in higher salinity conditions.",
    "[BLANK_6]": "[BLANK_4]: Applying excess water to flush salts below the root zone, a technique known as [BLANK_4].",
    "[BLANK_7]": "[BLANK_5] rates: Understanding water loss through evaporation and plant transpiration helps determine water needs.",
    "[BLANK_8]": "Soil moisture monitoring: Regular checks of soil moisture levels guide irrigation decisions.",
    "[BLANK_9]": "Crop growth stage: Water requirements vary throughout a crop's life cycle, necessitating adjustments in irrigation scheduling.",
    "[BLANK_10]": "Crop type and salt tolerance: Different crops have varying water needs and [BLANK_6] levels.",
    "[BLANK_11]": "Climate factors: Temperature, humidity, and wind affect [BLANK_5] rates.",
    "[BLANK_12]": "Soil characteristics: Soil texture and structure influence water retention and movement.",
    "[BLANK_13]": "[BLANK_4] requirements: Additional water may be needed to leach excess salts from the root zone.",
    "[BLANK_14]": "Subsurface drip irrigation: Placing drip lines below the soil surface can further reduce evaporation and salt accumulation.",
    "[BLANK_15]": "Precision irrigation: Using [BLANK_7] and data analytics to optimize water application based on real-time soil and plant conditions.",
    "[BLANK_16]": "Deficit irrigation: Strategically reducing water application during less sensitive growth stages to improve [BLANK_8].",
    "[BLANK_17]": "Drip irrigation",
    "[BLANK_18]": "Emitters",
    "[BLANK_19]": "Evapotranspiration",
    "[BLANK_20]": "Leaching",
    "[BLANK_21]": "Evapotranspiration",
    "[BLANK_22]": "Salinity threshold",
    "[BLANK_23]": "Soil moisture sensor",
    "[BLANK_24]": "Water use efficiency",
    "[BLANK_25]": "Fertigation",
    "[BLANK_26]": "Clogging"
  }
}