{
  "reading": "Introduction to Sustainable Aquaculture\\n\\n[BLANK_1], the farming of aquatic organisms, has emerged as a crucial sector in addressing global food security challenges and promoting economic development. As the world's population continues to grow and wild fish stocks face increasing pressure, sustainable aquaculture practices have become essential for meeting the rising demand for seafood while preserving marine ecosystems. This article explores the concept of sustainable aquaculture, its importance, and the key principles that guide its implementation.\\n\\nAquaculture has experienced rapid growth in recent decades, now accounting for over half of the world's fish consumption. This expansion has brought both opportunities and challenges. While aquaculture has the potential to provide a sustainable source of protein and support livelihoods, unsustainable practices can lead to environmental degradation, disease outbreaks, and conflicts with other coastal activities.\\n\\nSustainable aquaculture is built upon three fundamental pillars: environmental responsibility, economic viability, and social equity. Environmental [BLANK_2] focuses on minimizing the ecological footprint of aquaculture operations, including reducing pollution, preserving [BLANK_3], and using resources efficiently. Economic sustainability ensures that aquaculture enterprises remain profitable over the long term, contributing to local and national economies. Social sustainability addresses the well-being of workers, local communities, and consumers, ensuring fair labor practices, [BLANK_4], and equitable access to resources.\\n\\nTo achieve these goals, the Food and Agriculture Organization (FAO) of the United Nations has promoted the [BLANK_5] to Aquaculture (EAA). This holistic strategy integrates aquaculture within the broader ecosystem, considering ecological processes, stakeholder interests, and socio-economic factors. The EAA emphasizes the importance of spatial planning, [BLANK_6] assessment, and adaptive management in aquaculture development.\\n\\nKey principles of the EAA include:\\n\\n1. Comprehensive planning: Considering all ecosystem components and their interactions when developing aquaculture projects.\\n\\n2. Stakeholder participation: Involving local communities, government agencies, and other relevant parties in decision-making processes.\\n\\n3. Precautionary approach: Taking preventive measures to avoid potential environmental harm, even in the absence of full scientific certainty.\\n\\n4. Adaptive management: Continuously monitoring and adjusting practices based on new information and changing conditions.\\n\\nImplementing sustainable aquaculture practices requires careful consideration of various factors. Site selection is crucial, as it impacts both the success of the operation and its environmental footprint. Proper water quality management is essential for maintaining healthy aquatic organisms and minimizing pollution. Disease prevention and control measures, including biosecurity protocols, are vital for protecting both farmed species and surrounding ecosystems.\\n\\nIn developing countries like Timor-Leste, sustainable aquaculture presents both opportunities and challenges. While it offers potential for food security and [BLANK_7], limited infrastructure, technical expertise, and regulatory frameworks can hinder sustainable development. Successful implementation of sustainable aquaculture in such contexts often requires capacity building, technology transfer, and policy support.\\n\\nCase studies from around the world demonstrate the potential of sustainable aquaculture. For instance, integrated multi-trophic aquaculture systems in Canada combine fish farming with seaweed and shellfish cultivation, creating a more balanced and efficient ecosystem. In Vietnam, mangrove-shrimp farming models have shown success in preserving coastal habitats while providing economic benefits to local communities.\\n\\nAs the aquaculture industry continues to evolve, new technologies and practices are emerging to enhance sustainability. These include recirculating aquaculture systems that minimize water use and waste discharge, alternative feed sources to reduce reliance on wild fish stocks, and genetic improvement programs focused on disease resistance and resource efficiency.\\n\\nIn conclusion, sustainable aquaculture represents a critical approach to meeting global food security challenges while preserving marine ecosystems. By adhering to the principles of environmental responsibility, economic viability, and social equity, and implementing the Ecosystem Approach to Aquaculture, the sector can contribute significantly to sustainable development goals. As research advances and best practices are refined, sustainable aquaculture will play an increasingly important role in feeding the world's growing population while safeguarding our planet's aquatic resources for future generations.",
  "vocabulary": {
    "[BLANK_1]": "Comprehensive planning: Considering all ecosystem components and their interactions when developing aquaculture projects.",
    "[BLANK_2]": "Stakeholder participation: Involving local communities, government agencies, and other relevant parties in decision-making processes.",
    "[BLANK_3]": "Precautionary approach: Taking preventive measures to avoid potential environmental harm, even in the absence of full scientific certainty.",
    "[BLANK_4]": "Adaptive management: Continuously monitoring and adjusting practices based on new information and changing conditions.",
    "[BLANK_5]": "Aquaculture",
    "[BLANK_6]": "sustainability",
    "[BLANK_7]": "biodiversity",
    "[BLANK_8]": "food security",
    "[BLANK_9]": "ecosystem approach",
    "[BLANK_10]": "carrying capacity",
    "[BLANK_11]": "economic development",
    "[BLANK_12]": "Sustainability",
    "[BLANK_13]": "Ecosystem approach",
    "[BLANK_14]": "Food security"
  }
}