{
  "reading": "Spatial Planning for Aquaculture: A Key to Sustainable Development\\n\\nIntroduction\\n\\n[BLANK_1], the farming of aquatic organisms, has become an increasingly important source of food production worldwide. As the global population continues to grow and wild fish stocks face increasing pressure, the role of aquaculture in ensuring food security and economic development cannot be overstated. However, the expansion of aquaculture activities must be carefully managed to ensure sustainability and minimize conflicts with other coastal and marine activities. This is where spatial planning for aquaculture comes into play, offering a systematic approach to organizing and optimizing aquaculture development.\\n\\nThe Importance of Spatial Planning in Aquaculture\\n\\n[BLANK_2] for aquaculture is a comprehensive process that involves organizing the use of spaces and managing interactions between aquaculture activities and the surrounding environment. This approach is crucial for several reasons:\\n\\n1. Sustainable Resource Use: By carefully planning the location and scale of aquaculture operations, spatial planning helps ensure that natural resources are used efficiently and sustainably. This includes considerations of water quality, land use, and the [BLANK_3] of ecosystems.\\n\\n2. Conflict Prevention: Aquaculture often competes for space with other coastal and marine activities such as fishing, tourism, and shipping. Spatial planning helps identify and mitigate potential conflicts between these different uses, promoting harmonious coexistence.\\n\\n3. Optimizing Production: Through strategic placement of aquaculture facilities, spatial planning can maximize production efficiency while minimizing environmental impacts. This may involve identifying areas with optimal water quality, temperature, and nutrient conditions for specific aquaculture species.\\n\\nKey Components of Spatial Planning for Aquaculture\\n\\nNational-level Scoping and Feasibility Assessments\\n\\nThe first step in spatial planning for aquaculture often involves a national-level assessment. This process typically includes:\\n\\n1. Resource Mapping: Identifying and mapping potential areas for aquaculture development based on factors such as water resources, land availability, and environmental conditions.\\n\\n2. Conflict Identification: Assessing potential conflicts with existing coastal and marine activities, protected areas, and other land uses.\\n\\n3. Infrastructure Assessment: Evaluating the availability and needs for supporting infrastructure such as roads, electricity, and processing facilities.\\n\\nRegional-level [BLANK_4] of Activities\\n\\nOnce the national-level assessment is complete, the focus shifts to regional-level zoning. This involves:\\n\\n1. Multi-use Zoning: Developing plans that integrate aquaculture with other coastal and marine activities, promoting synergies where possible.\\n\\n2. Environmental Considerations: Identifying areas where aquaculture can be developed with minimal environmental impact, taking into account factors such as sensitive habitats and water quality.\\n\\n3. [BLANK_5] Mapping: Utilizing [BLANK_6] to create detailed maps that visualize different zones and their designated uses.\\n\\nSite Selection Criteria for Aquaculture Farms\\n\\nAt the most granular level, spatial planning involves selecting specific sites for aquaculture farms. Key criteria include:\\n\\n1. Water Quality Parameters: Assessing factors such as temperature, salinity, dissolved oxygen, and nutrient levels to ensure they are suitable for the intended aquaculture species.\\n\\n2. Environmental Considerations: Evaluating potential impacts on local ecosystems, including effects on wild species and habitats.\\n\\n3. Socio-economic Factors: Considering the proximity to markets, availability of labor, and potential benefits to local communities.\\n\\n4. Infrastructure and Logistics: Assessing access to transportation, electricity, and other necessary facilities.\\n\\nThe Role of Technology in Spatial Planning\\n\\nAdvancements in technology, particularly GIS, have revolutionized spatial planning for aquaculture. GIS allows planners to integrate multiple layers of information, including environmental data, infrastructure maps, and land use patterns. This enables more informed decision-making and helps visualize complex spatial relationships.\\n\\nConclusion\\n\\nSpatial planning is a critical tool for ensuring the sustainable development of aquaculture. By taking a systematic approach to organizing aquaculture activities, it helps balance the need for increased food production with environmental protection and social considerations. As aquaculture continues to grow in importance globally, effective spatial planning will be key to maximizing its benefits while minimizing potential negative impacts. Through careful planning and the use of advanced technologies, we can create a future where aquaculture contributes significantly to food security and economic development in a sustainable and responsible manner.",
  "vocabulary": {
    "[BLANK_1]": "Sustainable Resource Use: By carefully planning the location and scale of aquaculture operations, spatial planning helps ensure that natural resources are used efficiently and sustainably. This includes considerations of water quality, land use, and the [BLANK_3] of ecosystems.",
    "[BLANK_2]": "Conflict Prevention: Aquaculture often competes for space with other coastal and marine activities such as fishing, tourism, and shipping. Spatial planning helps identify and mitigate potential conflicts between these different uses, promoting harmonious coexistence.",
    "[BLANK_3]": "Optimizing Production: Through strategic placement of aquaculture facilities, spatial planning can maximize production efficiency while minimizing environmental impacts. This may involve identifying areas with optimal water quality, temperature, and nutrient conditions for specific aquaculture species.",
    "[BLANK_4]": "Resource Mapping: Identifying and mapping potential areas for aquaculture development based on factors such as water resources, land availability, and environmental conditions.",
    "[BLANK_5]": "Conflict Identification: Assessing potential conflicts with existing coastal and marine activities, protected areas, and other land uses.",
    "[BLANK_6]": "Infrastructure Assessment: Evaluating the availability and needs for supporting infrastructure such as roads, electricity, and processing facilities.",
    "[BLANK_7]": "Multi-use Zoning: Developing plans that integrate aquaculture with other coastal and marine activities, promoting synergies where possible.",
    "[BLANK_8]": "Environmental Considerations: Identifying areas where aquaculture can be developed with minimal environmental impact, taking into account factors such as sensitive habitats and water quality.",
    "[BLANK_9]": "[BLANK_5] Mapping: Utilizing [BLANK_6] to create detailed maps that visualize different zones and their designated uses.",
    "[BLANK_10]": "Water Quality Parameters: Assessing factors such as temperature, salinity, dissolved oxygen, and nutrient levels to ensure they are suitable for the intended aquaculture species.",
    "[BLANK_11]": "Environmental Considerations: Evaluating potential impacts on local ecosystems, including effects on wild species and habitats.",
    "[BLANK_12]": "Socio-economic Factors: Considering the proximity to markets, availability of labor, and potential benefits to local communities.",
    "[BLANK_13]": "Infrastructure and Logistics: Assessing access to transportation, electricity, and other necessary facilities.",
    "[BLANK_14]": "Aquaculture",
    "[BLANK_15]": "Spatial planning",
    "[BLANK_16]": "carrying capacity",
    "[BLANK_17]": "Zoning",
    "[BLANK_18]": "GIS",
    "[BLANK_19]": "Geographic Information System",
    "[BLANK_20]": "Stakeholder engagement",
    "[BLANK_21]": "Environmental impact assessment",
    "[BLANK_22]": "Ecosystem approach to aquaculture",
    "[BLANK_23]": "Carrying capacity"
  }
}