{
  "reading": "Water Quality Management in Aquaculture\\n\\nIntroduction\\n\\nAquaculture, the farming of aquatic organisms, has become an increasingly important source of food production worldwide. As the industry grows, so does the need for effective water quality management. Proper water quality is crucial for the health and growth of aquatic species, the sustainability of aquaculture operations, and the protection of surrounding ecosystems. This paper will explore the key aspects of water quality management in aquaculture, including important parameters, concepts, and management techniques.\\n\\nKey Water Quality Parameters\\n\\nSeveral water quality parameters are critical for successful aquaculture operations. [BLANK_1] is perhaps the most important, as it is essential for the respiration of aquatic organisms. Insufficient [BLANK_1] levels can lead to stress, reduced growth, and even mortality in cultured species. The [BLANK_2] level of water is another crucial factor, affecting the toxicity of various compounds and the overall health of aquatic life. Most aquaculture species thrive in a [BLANK_2] range of 6.5 to 8.5.\\n\\nNitrogen compounds, including [BLANK_3], [BLANK_4], and [BLANK_5], play a significant role in water quality. [BLANK_3], produced by fish waste and decomposing organic matter, is highly toxic to aquatic life. It is converted to [BLANK_4] and then to [BLANK_5] through biological processes. While [BLANK_5] is less toxic, high levels can lead to eutrophication, causing algal blooms and oxygen depletion in water bodies.\\n\\nConcepts in Water Quality Management\\n\\nTwo important concepts in aquaculture water quality management are [BLANK_6] and [BLANK_7]. [BLANK_6] refers to the maximum population of a species that an environment can sustain indefinitely. In aquaculture, this concept helps determine the optimal stocking density for a given system without compromising water quality or animal welfare.\\n\\n[BLANK_7] is the ability of a water body to purify itself by removing pollutants. Understanding this concept is crucial for managing [BLANK_8] discharge from aquaculture operations and preventing environmental degradation of surrounding ecosystems.\\n\\nEffluent Management and Treatment\\n\\nProper management of aquaculture [BLANK_8] is essential for maintaining water quality both within the farm and in receiving water bodies. Various methods can be employed to treat [BLANK_8], including:\\n\\n1. Sedimentation ponds: These allow suspended solids to settle out of the water before discharge.\\n2. Biological filtration: Using beneficial bacteria to convert [BLANK_3] to less toxic forms.\\n3. Constructed wetlands: Natural systems that filter and purify water through plant uptake and microbial processes.\\n4. [BLANK_9]: These minimize water discharge by treating and reusing water within the system.\\n\\nEnvironmental Impacts and Sustainable Practices\\n\\nPoor water quality management in aquaculture can lead to significant environmental impacts. Excessive nutrient discharge can cause [BLANK_10] in receiving water bodies, leading to algal blooms, oxygen depletion, and ecosystem disruption. Additionally, the release of chemicals and antibiotics used in aquaculture can have detrimental effects on local flora and fauna.\\n\\nTo mitigate these impacts, sustainable aquaculture practices focus on:\\n\\n1. Optimizing feed management to reduce waste production\\n2. Implementing integrated multi-trophic aquaculture systems, where different species are farmed together to utilize waste products\\n3. Regular monitoring and maintenance of water quality parameters\\n4. Adopting water-efficient technologies and practices\\n\\nConclusion\\n\\nWater quality management is a cornerstone of successful and sustainable aquaculture. By understanding and monitoring key water quality parameters, implementing effective treatment methods, and adopting sustainable practices, aquaculture operations can maintain optimal conditions for cultured species while minimizing environmental impacts. As the aquaculture industry continues to grow, ongoing research and innovation in water quality management will be crucial to ensure its long-term sustainability and contribution to global food security.",
  "vocabulary": {
    "[BLANK_1]": "5 to 8.5.",
    "[BLANK_2]": "Sedimentation ponds: These allow suspended solids to settle out of the water before discharge.",
    "[BLANK_3]": "Biological filtration: Using beneficial bacteria to convert [BLANK_3] to less toxic forms.",
    "[BLANK_4]": "Constructed wetlands: Natural systems that filter and purify water through plant uptake and microbial processes.",
    "[BLANK_5]": "[BLANK_9]: These minimize water discharge by treating and reusing water within the system.",
    "[BLANK_6]": "Optimizing feed management to reduce waste production",
    "[BLANK_7]": "Implementing integrated multi-trophic aquaculture systems, where different species are farmed together to utilize waste products",
    "[BLANK_8]": "Regular monitoring and maintenance of water quality parameters",
    "[BLANK_9]": "Adopting water-efficient technologies and practices",
    "[BLANK_10]": "Dissolved oxygen",
    "[BLANK_11]": "pH",
    "[BLANK_12]": "Ammonia",
    "[BLANK_13]": "Nitrite",
    "[BLANK_14]": "Nitrate",
    "[BLANK_15]": "Carrying capacity",
    "[BLANK_16]": "Assimilative capacity",
    "[BLANK_17]": "Effluent",
    "[BLANK_18]": "Recirculating Aquaculture System (RAS)",
    "[BLANK_19]": "Eutrophication"
  }
}