{
  "reading": "Large Language Models (LLMs) have revolutionized the field of natural language processing and artificial intelligence, offering unprecedented capabilities in understanding and generating human-like text. This paper provides an introduction to LLMs, exploring their evolution, architecture, capabilities, and potential applications.\\n\\nThe Evolution of Language Models\\n\\nLanguage models have come a long way since their inception. Early models, such as n-grams, relied on statistical probabilities of word sequences. These were followed by neural network-based models, which improved performance but still struggled with long-range dependencies and contextual understanding. The limitations of these earlier models paved the way for the development of more sophisticated architectures.\\n\\nThe [BLANK_1] Architecture\\n\\nThe breakthrough came with the introduction of the [BLANK_1] architecture in 2017. [BLANK_1]s use a mechanism called [BLANK_2], which allows the model to weigh the importance of different parts of the input when processing each element. This innovation enabled models to capture long-range dependencies and contextual information more effectively than previous architectures.\\n\\nKey components of the [BLANK_1] include:\\n\\n1. [BLANK_2] layers\\n2. Multi-head attention\\n3. Feed-forward neural networks\\n4. Positional encoding\\n\\nThese components work together to process input sequences in parallel, making [BLANK_1]s highly efficient and scalable.\\n\\n[BLANK_3] Models and Their Capabilities\\n\\nBuilding upon the [BLANK_1] architecture, OpenAI introduced the [BLANK_3] (Generative Pre-trained Transformer) series of models. These LLMs, with GPT-3 being one of the most prominent examples, have demonstrated remarkable capabilities in various language tasks, including:\\n\\n1. Text generation: Producing coherent and contextually relevant text across various styles and formats.\\n2. [BLANK_4]: Condensing long texts into concise summaries while retaining key information.\\n3. Translation: Converting text between different languages with high accuracy.\\n4. Question-answering: Providing relevant and accurate responses to queries based on given information.\\n\\nThe power of [BLANK_3] models lies in their massive scale and the vast amount of data they are trained on. GPT-3, for instance, has 175 billion parameters and was trained on a diverse corpus of internet text.\\n\\nCapabilities and Limitations\\n\\nLLMs have demonstrated remarkable abilities in understanding context, generating human-like text, and performing a wide range of language tasks with minimal task-specific training. They excel at [BLANK_5] learning, where they can adapt to new tasks with just a few examples.\\n\\nHowever, these models also have limitations. They can sometimes produce biased or factually incorrect information, as they are trained on internet data which may contain biases and inaccuracies. They also lack true understanding of the world and can struggle with tasks requiring common sense reasoning or up-to-date information.\\n\\nApplications and Implications\\n\\nThe potential applications of LLMs are vast and span numerous fields. In education, they can serve as personalized tutors, generate educational content, and assist in language learning. In government, they could aid in document analysis, policy drafting, and citizen engagement through chatbots.\\n\\nFor a country like Timor-Leste, LLMs could play a crucial role in preserving and promoting local languages, supporting translation services, and enhancing educational resources. They could also assist in government operations, improving efficiency and accessibility of public services.\\n\\nConclusion\\n\\nLarge Language Models represent a significant leap forward in artificial intelligence and natural language processing. Their ability to understand and generate human-like text opens up a world of possibilities across various domains. As these technologies continue to evolve, it is crucial to consider both their potential benefits and the ethical implications of their widespread adoption. For developing nations like Timor-Leste, LLMs offer exciting opportunities for advancement in education, governance, and cultural preservation, while also presenting challenges that need to be carefully navigated.",
  "vocabulary": {
    "[BLANK_1]": "[BLANK_1]s use a mechanism called [BLANK_2], which allows the model to weigh the importance of different parts of the input when processing each element. This innovation enabled models to capture long-range dependencies and contextual information more effectively than previous architectures.",
    "[BLANK_2]": "[BLANK_2] layers",
    "[BLANK_3]": "Multi-head attention",
    "[BLANK_4]": "Feed-forward neural networks",
    "[BLANK_5]": "Positional encoding",
    "[BLANK_6]": "Text generation: Producing coherent and contextually relevant text across various styles and formats.",
    "[BLANK_7]": "[BLANK_4]: Condensing long texts into concise summaries while retaining key information.",
    "[BLANK_8]": "Translation: Converting text between different languages with high accuracy.",
    "[BLANK_9]": "Question-answering: Providing relevant and accurate responses to queries based on given information.",
    "[BLANK_10]": "Transformer",
    "[BLANK_11]": "self-attention",
    "[BLANK_12]": "GPT",
    "[BLANK_13]": "Summarization",
    "[BLANK_14]": "few-shot"
  }
}