{
  "reading": "Foundations of Machine Learning and Artificial Intelligence\\n\\nIntroduction\\n\\nIn recent years, the fields of [BLANK_1] and [BLANK_2] have made remarkable strides, transforming various aspects of our daily lives and revolutionizing industries across the globe. This paper aims to provide an overview of the fundamental concepts underlying ML and AI, exploring their basic principles, types, and key components.\\n\\nUnderstanding Machine Learning and Artificial Intelligence\\n\\nArtificial Intelligence refers to the simulation of human intelligence in machines programmed to think and learn like humans. Machine Learning, a subset of AI, focuses on creating systems that can learn from and make decisions based on data. The core principle of machine learning is that instead of being explicitly programmed for every possible scenario, these systems can improve their performance on a specific task through experience.\\n\\nTypes of Machine Learning\\n\\nMachine learning can be broadly categorized into three main types:\\n\\n1. [BLANK_3]: In this approach, the model is trained on labeled data. The algorithm learns to map input data to known output labels, allowing it to make predictions on new, unseen data. Examples include image classification and spam email detection.\\n\\n2. [BLANK_4]: Here, the model works with unlabeled data, attempting to find inherent patterns or structures. Clustering algorithms, which group similar data points together, are a common application of unsupervised learning.\\n\\n3. [BLANK_5]: This type involves an agent learning to make decisions by interacting with an environment. The agent receives rewards or penalties based on its actions, gradually improving its decision-making process. This approach is often used in game playing AI and robotics.\\n\\nKey Components of Machine Learning Systems\\n\\nSeveral crucial elements form the foundation of any machine learning system:\\n\\n1. [BLANK_6]: This is the information used to teach the model. The quality and quantity of training data significantly impact the model's performance.\\n\\n2. [BLANK_7]: These are the input variables or attributes that the model uses to make predictions. For instance, in a house price prediction model, features might include square footage, number of bedrooms, and location.\\n\\n3. [BLANK_8]: In supervised learning, labels are the output or target variables that the model is trying to predict. Using the house price example, the label would be the actual price of the house.\\n\\n4. [BLANK_9]: These are mathematical representations of real-world processes, learned from data. Common types include linear regression, decision trees, and neural networks.\\n\\nApplications and Implications\\n\\nThe applications of ML and AI are vast and growing. From recommendation systems on streaming platforms to autonomous vehicles, these technologies are reshaping our world. In healthcare, ML algorithms are assisting in disease diagnosis and drug discovery. In finance, they're used for fraud detection and algorithmic trading.\\n\\nHowever, the widespread adoption of these technologies also raises important ethical considerations. Issues such as AI bias, data privacy, and the potential impact on employment are subjects of ongoing debate and research.\\n\\nConclusion\\n\\nMachine Learning and Artificial Intelligence represent a significant leap in our ability to process and learn from data, offering solutions to complex problems across various domains. As these technologies continue to evolve, understanding their foundations becomes increasingly important. While challenges remain, particularly in ethics and responsible implementation, the potential of ML and AI to drive innovation and improve lives is undeniable. As we move forward, it will be crucial to harness these technologies thoughtfully, ensuring their benefits are realized while mitigating potential risks.",
  "vocabulary": {
    "[BLANK_1]": "[BLANK_3]: In this approach, the model is trained on labeled data. The algorithm learns to map input data to known output labels, allowing it to make predictions on new, unseen data. Examples include image classification and spam email detection.",
    "[BLANK_2]": "[BLANK_4]: Here, the model works with unlabeled data, attempting to find inherent patterns or structures. Clustering algorithms, which group similar data points together, are a common application of unsupervised learning.",
    "[BLANK_3]": "[BLANK_5]: This type involves an agent learning to make decisions by interacting with an environment. The agent receives rewards or penalties based on its actions, gradually improving its decision-making process. This approach is often used in game playing AI and robotics.",
    "[BLANK_4]": "[BLANK_6]: This is the information used to teach the model. The quality and quantity of training data significantly impact the model's performance.",
    "[BLANK_5]": "[BLANK_7]: These are the input variables or attributes that the model uses to make predictions. For instance, in a house price prediction model, features might include square footage, number of bedrooms, and location.",
    "[BLANK_6]": "[BLANK_8]: In supervised learning, labels are the output or target variables that the model is trying to predict. Using the house price example, the label would be the actual price of the house.",
    "[BLANK_7]": "[BLANK_9]: These are mathematical representations of real-world processes, learned from data. Common types include linear regression, decision trees, and neural networks.",
    "[BLANK_8]": "Machine Learning",
    "[BLANK_9]": "Artificial Intelligence",
    "[BLANK_10]": "Supervised Learning",
    "[BLANK_11]": "Unsupervised Learning",
    "[BLANK_12]": "Reinforcement Learning",
    "[BLANK_13]": "Training Data",
    "[BLANK_14]": "Features",
    "[BLANK_15]": "Labels",
    "[BLANK_16]": "Models",
    "[BLANK_17]": "AI"
  }
}