{
  "reading": "In the rapidly evolving field of artificial intelligence, large language models (LLMs) have emerged as powerful tools capable of generating human-like text, answering questions, and performing a wide range of language-related tasks. However, the effectiveness of these models largely depends on how they are instructed or \\\"prompted.\\\" This is where [BLANK_1] comes into play. [BLANK_1] is the art and science of crafting input prompts to effectively communicate with LLMs and elicit desired outputs. This paper explores the principles of [BLANK_1] and strategies for the effective use of large language models.\\n\\nUnderstanding [BLANK_1]:\\n\\n[BLANK_1] is a critical skill in the era of advanced language models. It involves designing and refining input prompts to maximize the quality and relevance of the model's output. Effective prompts can guide the model to produce more accurate, coherent, and contextually appropriate responses.\\n\\nKey components of a well-engineered prompt typically include:\\n\\n1. Clear instructions: Explicitly stating what the model should do.\\n2. Context: Providing relevant background information.\\n3. Input data: The specific information or question to be processed.\\n4. [BLANK_2]: Specifying the desired structure of the response.\\n\\nPrinciples of Effective [BLANK_1]:\\n\\n1. Clarity and Specificity: Prompts should be unambiguous and precise. Vague instructions can lead to irrelevant or unfocused outputs.\\n\\n2. Contextual Information: Providing relevant context helps the model understand the task better. This can include background information, constraints, or examples.\\n\\n3. Structured Formatting: Organizing prompts with clear sections for instructions, context, and input can improve the model's comprehension and response.\\n\\n4. [BLANK_3]: Prompt engineering often requires multiple iterations to achieve optimal results. Analyzing the model's outputs and adjusting the prompt accordingly is a crucial part of the process.\\n\\nLeveraging [BLANK_4] and [BLANK_5]:\\n\\nTwo powerful techniques in prompt engineering are [BLANK_4] and [BLANK_5]:\\n\\n1. [BLANK_4]: This refers to the model's ability to adapt its behavior based on examples or instructions provided within the prompt itself. By including relevant examples in the prompt, users can guide the model's performance without fine-tuning.\\n\\n2. [BLANK_5]: This technique involves providing the model with a few examples of the desired task within the prompt. It's particularly useful for specialized or domain-specific tasks where the model might not have extensive pre-training.\\n\\nBest Practices for Interacting with LLMs:\\n\\n1. Start with [BLANK_6] Prompts: Begin with a simple, direct prompt without examples. This can serve as a baseline for further refinement.\\n\\n2. Use [BLANK_5] for Complex Tasks: When dealing with specialized or nuanced tasks, provide a few examples to guide the model's understanding.\\n\\n3. Be Mindful of Biases: LLMs can reflect biases present in their training data. Craft prompts carefully to minimize unwanted biases in the output.\\n\\n4. Experiment with Different Phrasings: Sometimes, slight changes in wording can significantly impact the model's response. Don't hesitate to try various formulations.\\n\\n5. Leverage [BLANK_7]: For complex reasoning tasks, guide the model through a step-by-step thought process in the prompt.\\n\\n6. Consider Ethical Implications: Be aware of potential misuse or unintended consequences when crafting prompts, especially for sensitive topics.\\n\\nApplications and Impact:\\n\\nEffective [BLANK_1] can significantly enhance the utility of LLMs across various domains. For instance, in education, well-crafted prompts can generate tailored learning materials or provide personalized tutoring. In business, [BLANK_1] can improve customer service chatbots or assist in content creation. In research and development, it can aid in literature review, hypothesis generation, or even code writing.\\n\\nConclusion:\\n\\n[BLANK_1] is a crucial skill in harnessing the full potential of large language models. By understanding and applying effective [BLANK_1] techniques, users can significantly improve the quality, relevance, and usefulness of LLM outputs. As these models continue to advance, the ability to communicate effectively with them through well-crafted prompts will become increasingly valuable across various fields and applications. Mastering [BLANK_1] opens up new possibilities for leveraging AI in creative problem-solving and innovation.",
  "vocabulary": {
    "[BLANK_1]": "Clear instructions: Explicitly stating what the model should do.",
    "[BLANK_2]": "Context: Providing relevant background information.",
    "[BLANK_3]": "Input data: The specific information or question to be processed.",
    "[BLANK_4]": "[BLANK_2]: Specifying the desired structure of the response.",
    "[BLANK_5]": "Clarity and Specificity: Prompts should be unambiguous and precise. Vague instructions can lead to irrelevant or unfocused outputs.",
    "[BLANK_6]": "Contextual Information: Providing relevant context helps the model understand the task better. This can include background information, constraints, or examples.",
    "[BLANK_7]": "Structured Formatting: Organizing prompts with clear sections for instructions, context, and input can improve the model's comprehension and response.",
    "[BLANK_8]": "[BLANK_3]: Prompt engineering often requires multiple iterations to achieve optimal results. Analyzing the model's outputs and adjusting the prompt accordingly is a crucial part of the process.",
    "[BLANK_9]": "[BLANK_4]: This refers to the model's ability to adapt its behavior based on examples or instructions provided within the prompt itself. By including relevant examples in the prompt, users can guide the model's performance without fine-tuning.",
    "[BLANK_10]": "[BLANK_5]: This technique involves providing the model with a few examples of the desired task within the prompt. It's particularly useful for specialized or domain-specific tasks where the model might not have extensive pre-training.",
    "[BLANK_11]": "Start with [BLANK_6] Prompts: Begin with a simple, direct prompt without examples. This can serve as a baseline for further refinement.",
    "[BLANK_12]": "Use [BLANK_5] for Complex Tasks: When dealing with specialized or nuanced tasks, provide a few examples to guide the model's understanding.",
    "[BLANK_13]": "Be Mindful of Biases: LLMs can reflect biases present in their training data. Craft prompts carefully to minimize unwanted biases in the output.",
    "[BLANK_14]": "Experiment with Different Phrasings: Sometimes, slight changes in wording can significantly impact the model's response. Don't hesitate to try various formulations.",
    "[BLANK_15]": "Leverage [BLANK_7]: For complex reasoning tasks, guide the model through a step-by-step thought process in the prompt.",
    "[BLANK_16]": "Consider Ethical Implications: Be aware of potential misuse or unintended consequences when crafting prompts, especially for sensitive topics.",
    "[BLANK_17]": "prompt engineering",
    "[BLANK_18]": "output format",
    "[BLANK_19]": "iterative refinement",
    "[BLANK_20]": "in-context learning",
    "[BLANK_21]": "few-shot learning",
    "[BLANK_22]": "zero-shot",
    "[BLANK_23]": "chain-of-thought prompting",
    "[BLANK_24]": "prompt components",
    "[BLANK_25]": "task-specific prompting",
    "[BLANK_26]": "prompt templating"
  }
}