{
  "reading": "Natural Language Processing and Word Embeddings: Bridging the Gap Between Human and Machine Language\\n\\nIntroduction\\n\\n[BLANK_1] has emerged as a pivotal field in artificial intelligence, focusing on the interaction between computers and human language. As our digital world becomes increasingly language-driven, the ability of machines to understand, interpret, and generate human language has become crucial. At the heart of many modern NLP techniques lies the concept of [BLANK_2], a powerful method for representing words in a way that captures their meaning and relationships. This paper explores the fundamentals of NLP and word embeddings, their significance in AI applications, and their potential impact on language processing tasks.\\n\\nUnderstanding Natural Language Processing\\n\\nNatural Language Processing encompasses a wide range of computational techniques designed to analyze and understand human language. The ultimate goal of NLP is to enable machines to comprehend and communicate in natural language as effectively as humans do. This field combines elements of linguistics, computer science, and artificial intelligence to tackle the complexities of human language.\\n\\nKey components of NLP include:\\n\\n1. [BLANK_3]: The process of breaking down text into individual words or subwords, which serves as the foundation for further analysis.\\n\\n2. [BLANK_4]: Assigning grammatical categories (such as noun, verb, or adjective) to each word in a text, providing crucial information about the word's function and meaning in context.\\n\\n3. [BLANK_5]: Identifying and classifying named entities within text, such as person names, locations, and organizations. This capability is essential for information extraction and text understanding.\\n\\n4. Semantic analysis: Determining the meaning of words and sentences, often by considering context and relationships between words.\\n\\nThe Power of Word Embeddings\\n\\nWord embeddings represent a significant advancement in NLP, offering a way to capture semantic relationships between words in a dense [BLANK_6]. Unlike traditional methods that treat words as discrete symbols, word embeddings represent each word as a continuous vector of real numbers. This approach allows machines to understand the semantic and syntactic similarities between words, enabling more sophisticated language processing tasks.\\n\\nThe concept of word embeddings is based on the distributional hypothesis, which states that words that appear in similar contexts tend to have similar meanings. Popular word embedding models, such as Word2Vec and GloVe, use neural networks to learn these vector representations from large corpora of text.\\n\\nKey advantages of word embeddings include:\\n\\n1. Capturing [BLANK_7]: Words with similar meanings cluster together in the vector space, allowing machines to understand synonyms, antonyms, and analogies.\\n\\n2. Dimensionality reduction: Complex language information is compressed into dense vectors, typically of a few hundred dimensions, making computations more efficient.\\n\\n3. Transfer learning: Pre-trained word embeddings can be used as a starting point for various NLP tasks, improving performance on tasks with limited training data.\\n\\nApplications and Implications\\n\\nThe combination of NLP techniques and word embeddings has led to significant advancements in various language-related tasks:\\n\\n1. Machine Translation: Word embeddings help in aligning words across languages, improving the quality of translations.\\n\\n2. [BLANK_8]: By capturing the nuanced meanings of words, embeddings enable more accurate detection of sentiment in text.\\n\\n3. Text Summarization: Understanding semantic relationships between words aids in generating concise and meaningful summaries.\\n\\n4. Question Answering Systems: Word embeddings facilitate better comprehension of questions and the extraction of relevant information from large text corpora.\\n\\nIn the context of languages like Tetum and Portuguese, which are spoken in Timor-Leste, NLP and word embeddings offer both opportunities and challenges. While these technologies can help in language preservation and education, the limited digital resources in these languages pose difficulties in developing robust NLP models.\\n\\nConclusion\\n\\nNatural Language Processing and word embeddings represent a significant leap forward in bridging the gap between human and machine language understanding. By enabling computers to grasp the nuances and relationships within language, these technologies are paving the way for more sophisticated AI applications across various domains. As research in this field continues to advance, we can expect even more powerful and nuanced language processing capabilities, potentially revolutionizing how we interact with machines and process information in the digital age.",
  "vocabulary": {
    "[BLANK_1]": "[BLANK_3]: The process of breaking down text into individual words or subwords, which serves as the foundation for further analysis.",
    "[BLANK_2]": "[BLANK_4]: Assigning grammatical categories (such as noun, verb, or adjective) to each word in a text, providing crucial information about the word's function and meaning in context.",
    "[BLANK_3]": "[BLANK_5]: Identifying and classifying named entities within text, such as person names, locations, and organizations. This capability is essential for information extraction and text understanding.",
    "[BLANK_4]": "Semantic analysis: Determining the meaning of words and sentences, often by considering context and relationships between words.",
    "[BLANK_5]": "Capturing [BLANK_7]: Words with similar meanings cluster together in the vector space, allowing machines to understand synonyms, antonyms, and analogies.",
    "[BLANK_6]": "Dimensionality reduction: Complex language information is compressed into dense vectors, typically of a few hundred dimensions, making computations more efficient.",
    "[BLANK_7]": "Transfer learning: Pre-trained word embeddings can be used as a starting point for various NLP tasks, improving performance on tasks with limited training data.",
    "[BLANK_8]": "Machine Translation: Word embeddings help in aligning words across languages, improving the quality of translations.",
    "[BLANK_9]": "[BLANK_8]: By capturing the nuanced meanings of words, embeddings enable more accurate detection of sentiment in text.",
    "[BLANK_10]": "Text Summarization: Understanding semantic relationships between words aids in generating concise and meaningful summaries.",
    "[BLANK_11]": "Question Answering Systems: Word embeddings facilitate better comprehension of questions and the extraction of relevant information from large text corpora.",
    "[BLANK_12]": "Natural Language Processing (NLP)",
    "[BLANK_13]": "word embeddings",
    "[BLANK_14]": "Tokenization",
    "[BLANK_15]": "Part-of-speech tagging",
    "[BLANK_16]": "Named Entity Recognition (NER)",
    "[BLANK_17]": "vector space",
    "[BLANK_18]": "semantic similarity",
    "[BLANK_19]": "Sentiment analysis",
    "[BLANK_20]": "corpus",
    "[BLANK_21]": "lemmatization"
  }
}