{
  "reading": "Reiki Hand Positions: Channeling Healing Energy\\n\\nIntroduction\\n\\nReiki, a Japanese healing technique, has gained popularity worldwide as a complementary therapy for promoting relaxation and overall well-being. At the heart of Reiki practice are the [BLANK_1], which serve as conduits for channeling healing energy. This article explores the significance of Reiki hand positions, their connection to the body's energy centers, and their role in both [BLANK_2] and healing others.\\n\\nThe Importance of Hand Positions in Reiki\\n\\nIn Reiki, practitioners believe that life force energy flows through all living things. The hands are considered powerful tools for directing this energy to areas of the body that need healing. By placing hands in specific positions, Reiki practitioners aim to remove energy blockages, balance the body's energy centers ([BLANK_3]), and promote physical, emotional, and spiritual healing.\\n\\nThe 12 Standard Reiki Hand Positions\\n\\nReiki typically involves a set of 12 standard hand positions used for self-treatment and treating others. These positions correspond to major organs, energy centers, and areas of the body commonly associated with stress or tension. The standard positions include:\\n\\n1. [BLANK_4] of the head: Associated with spiritual connection and overall well-being\\n2. Eyes: Linked to vision, both physical and intuitive\\n3. Sides of the head: Connected to mental processes and brain function\\n4. Throat: Related to communication and self-expression\\n5. Heart: Tied to emotions, love, and compassion\\n6. [BLANK_5]: Associated with personal power and digestion\\n7. Lower abdomen: Connected to creativity and reproductive organs\\n8. Hip area: Linked to stability and grounding\\n9. Shoulders: Related to burden-bearing and responsibility\\n10. Upper back: Associated with will and self-control\\n11. Mid back: Connected to emotional processing\\n12. Lower back: Linked to support and vitality\\n\\nEach position is typically held for 3-5 minutes, allowing the [BLANK_6] to flow and balance the area being treated.\\n\\nConnection to Chakras\\n\\nMany of the Reiki hand positions align with the body's seven main chakras, or energy centers. For example, the crown position corresponds to the crown chakra, while the heart position aligns with the heart chakra. This connection underscores the holistic nature of Reiki, addressing both physical and energetic aspects of healing.\\n\\nAdapting Hand Positions\\n\\nWhile the 12 standard positions provide a comprehensive framework, Reiki practitioners often adapt these positions based on individual needs. For instance, when treating others, practitioners may focus on areas of reported pain or discomfort. The flexibility of Reiki allows for intuitive adjustments to best serve the recipient's healing process.\\n\\nSelf-Treatment vs. Treating Others\\n\\nReiki hand positions can be used for both self-treatment and healing others. Self-treatment involves placing hands on oneself, following the standard positions or focusing on areas of personal concern. When treating others, practitioners may need to modify their approach, ensuring comfort for both themselves and the recipient. Proper [BLANK_7] become crucial to prevent strain during longer treatment sessions.\\n\\nDeveloping Sensitivity to Energy Flow\\n\\nAs practitioners gain experience with Reiki hand positions, they often report increased sensitivity to energy flow. This may manifest as sensations of heat, tingling, or pulsing in the hands. Some practitioners describe feeling drawn to certain areas of the body, indicating where energy work is most needed. This growing awareness enhances the effectiveness of treatments over time.\\n\\nBenefits of Reiki Hand Positions\\n\\nRegular practice of Reiki hand positions is believed to offer numerous benefits, including:\\n- Stress reduction and deep relaxation\\n- Improved sleep quality\\n- Enhanced emotional balance\\n- Accelerated physical healing\\n- Increased energy and vitality\\n- Greater sense of overall well-being\\n\\nWhile scientific research on Reiki is ongoing, many recipients report positive experiences and improvements in their health and wellness.\\n\\nConclusion\\n\\nReiki hand positions form the foundation of this gentle yet powerful healing practice. By understanding and applying these positions, practitioners can channel healing energy to promote balance and well-being in themselves and others. Whether used for self-care or in professional healing sessions, Reiki hand positions offer a structured approach to energy work that can be adapted to individual needs. As interest in complementary therapies continues to grow, Reiki's hand positions remain a valuable tool for those seeking natural methods of healing and stress relief.",
  "vocabulary": {
    "[BLANK_1]": "[BLANK_4] of the head: Associated with spiritual connection and overall well-being",
    "[BLANK_2]": "Eyes: Linked to vision, both physical and intuitive",
    "[BLANK_3]": "Sides of the head: Connected to mental processes and brain function",
    "[BLANK_4]": "Throat: Related to communication and self-expression",
    "[BLANK_5]": "Heart: Tied to emotions, love, and compassion",
    "[BLANK_6]": "[BLANK_5]: Associated with personal power and digestion",
    "[BLANK_7]": "Lower abdomen: Connected to creativity and reproductive organs",
    "[BLANK_8]": "Hip area: Linked to stability and grounding",
    "[BLANK_9]": "Shoulders: Related to burden-bearing and responsibility",
    "[BLANK_10]": "Upper back: Associated with will and self-control",
    "[BLANK_11]": "Mid back: Connected to emotional processing",
    "[BLANK_12]": "Lower back: Linked to support and vitality",
    "[BLANK_13]": "hand positions",
    "[BLANK_14]": "self-treatment",
    "[BLANK_15]": "chakras",
    "[BLANK_16]": "Crown",
    "[BLANK_17]": "solar plexus",
    "[BLANK_18]": "energy flow",
    "[BLANK_19]": "body mechanics",
    "[BLANK_20]": "attunement",
    "[BLANK_21]": "energy centers",
    "[BLANK_22]": "self-reflection"
  }
}