{
  "reading": "The Human Energy System: Understanding Our Vital Life Force\\n\\nIntroduction\\n\\nThe human energy system is a complex and fascinating aspect of our existence that has been recognized and studied in various cultures for thousands of years. This system, which encompasses the flow of [BLANK_1] energy through our bodies, is believed to play a crucial role in our physical, emotional, and spiritual well-being. In this article, we will explore the key components of the human energy system, including [BLANK_2], [BLANK_3], and the [BLANK_4], and discuss how understanding and working with this system can contribute to overall health and vitality.\\n\\nThe Concept of Life Force Energy\\n\\nAt the core of the human energy system is the concept of life force energy, known by various names across different cultures. In traditional Chinese medicine, it is called \\\"chi,\\\" while in Japanese practices like Reiki, it is referred to as \\\"[BLANK_3].\\\" This vital energy is believed to flow through all living things, sustaining life and promoting health when in balance.\\n\\nThe life force energy is thought to circulate through the body via a network of pathways, similar to the meridians described in acupuncture. When this energy flows freely and is balanced, we experience good health and a sense of well-being. Conversely, blockages or imbalances in the energy flow are believed to contribute to physical, emotional, and spiritual ailments.\\n\\nThe Seven Main Chakras\\n\\nOne of the most well-known aspects of the human energy system is the concept of chakras. Originating from ancient Indian traditions, chakras are [BLANK_5] within the body that act as focal points for the reception, assimilation, and transmission of life force energy. While there are numerous minor chakras throughout the body, seven main chakras are typically recognized:\\n\\n1. [BLANK_6] (Muladhara): Located at the base of the spine, this chakra is associated with grounding, stability, and basic survival needs.\\n\\n2. [BLANK_7] (Svadhisthana): Situated in the lower abdomen, this chakra relates to creativity, sexuality, and emotional balance.\\n\\n3. [BLANK_8] (Manipura): Found in the upper abdomen, this chakra governs personal power, confidence, and self-esteem.\\n\\n4. [BLANK_9] (Anahata): Centered in the chest, this chakra is linked to love, compassion, and relationships.\\n\\n5. [BLANK_10] (Vishuddha): Located in the throat area, this chakra is associated with communication, self-expression, and truth.\\n\\n6. Third Eye Chakra (Ajna): Positioned between the eyebrows, this chakra relates to intuition, wisdom, and spiritual insight.\\n\\n7. Crown Chakra (Sahasrara): Found at the top of the head, this chakra represents spiritual connection, enlightenment, and higher consciousness.\\n\\nEach chakra is associated with specific colors, elements, and physical and emotional attributes. When these energy centers are open and balanced, energy is believed to flow freely through the body, promoting overall health and well-being.",
  "vocabulary": {
    "[BLANK_1]": "[BLANK_6] (Muladhara): Located at the base of the spine, this chakra is associated with grounding, stability, and basic survival needs.",
    "[BLANK_2]": "[BLANK_7] (Svadhisthana): Situated in the lower abdomen, this chakra relates to creativity, sexuality, and emotional balance.",
    "[BLANK_3]": "[BLANK_8] (Manipura): Found in the upper abdomen, this chakra governs personal power, confidence, and self-esteem.",
    "[BLANK_4]": "[BLANK_9] (Anahata): Centered in the chest, this chakra is linked to love, compassion, and relationships.",
    "[BLANK_5]": "[BLANK_10] (Vishuddha): Located in the throat area, this chakra is associated with communication, self-expression, and truth.",
    "[BLANK_6]": "Third Eye Chakra (Ajna): Positioned between the eyebrows, this chakra relates to intuition, wisdom, and spiritual insight.",
    "[BLANK_7]": "Crown Chakra (Sahasrara): Found at the top of the head, this chakra represents spiritual connection, enlightenment, and higher consciousness.",
    "[BLANK_8]": "life force",
    "[BLANK_9]": "chakras",
    "[BLANK_10]": "ki",
    "[BLANK_11]": "aura",
    "[BLANK_12]": "energy centers",
    "[BLANK_13]": "Root chakra",
    "[BLANK_14]": "Sacral chakra",
    "[BLANK_15]": "Solar plexus chakra",
    "[BLANK_16]": "Heart chakra",
    "[BLANK_17]": "Throat chakra"
  }
}