{
  "reading": "Foundations of Reiki in Timor-Leste\\n\\nIntroduction\\n\\n[BLANK_1], a Japanese healing technique that promotes relaxation and stress reduction, has found its way to the shores of Timor-Leste, blending with the rich tapestry of traditional [BLANK_2] practices in this young Southeast Asian nation. This article explores the foundations of Reiki in Timor-Leste, examining its origins, core principles, and how it compares to and complements local healing traditions.\\n\\nOrigins and Spread of Reiki\\n\\nReiki was developed in the early 20th century by [BLANK_3], a Japanese Buddhist. During a meditation retreat on Mount Kurama, Usui reportedly experienced a spiritual awakening that led to the development of Reiki as a healing practice. The technique is based on the idea that an unseen \\\"[BLANK_4]\\\" flows through us and is what causes us to be alive. If one's life force energy is low, then we are more likely to get sick or feel stress, and if it is high, we are more capable of being happy and healthy.\\n\\nFrom Japan, Reiki spread to the West in the mid-20th century, primarily through the efforts of Mrs. Hawayo Takata, who brought the practice to Hawaii. Over the decades, Reiki has gained popularity worldwide, eventually reaching Timor-Leste in the post-independence era as the country opened up to global influences.\\n\\nThe Five Reiki Principles\\n\\nCentral to the practice of Reiki are five principles, which serve as both spiritual and ethical guidelines. In Timor-Leste, these principles are taught in both Tetum (the national language) and English:\\n\\n1. Just for today, I will not be angry.\\n2. Just for today, I will not worry.\\n3. Just for today, I will be grateful.\\n4. Just for today, I will do my work honestly.\\n5. Just for today, I will be kind to every living thing.\\n\\nThese principles resonate strongly with Timorese cultural values, particularly the emphasis on gratitude, honesty, and kindness. In a society that has experienced significant conflict and hardship, the focus on living in the present moment and cultivating positive attitudes has been particularly welcomed.\\n\\nReiki in the Context of Timorese Healing Traditions\\n\\nTimor-Leste has a rich heritage of traditional healing practices, many of which are based on animistic beliefs and the use of medicinal plants. These practices often involve rituals performed by local healers known as \\\"matan-dook\\\" or \\\"lia-na'in\\\". The introduction of Reiki to Timor-Leste has not been seen as a replacement for these traditional methods, but rather as a complementary practice.\\n\\nThere are several similarities between Reiki and traditional Timorese healing:\\n\\n1. Holistic approach: Both Reiki and traditional Timorese healing view health as a balance of physical, emotional, and spiritual well-being.\\n\\n2. [BLANK_5]: While the concepts may differ, both systems recognize the role of unseen energies in health and healing.\\n\\n3. Importance of intention: In both practices, the healer's intention and focus are considered crucial to the [BLANK_6] process.\\n\\nHowever, there are also notable differences:\\n\\n1. Origin: Reiki is a relatively modern, imported practice, while Timorese healing traditions have been passed down through generations.\\n\\n2. Technique: Reiki involves the laying on of hands and does not typically use physical substances, whereas traditional Timorese healing often incorporates herbal remedies and ritualistic objects.\\n\\n3. Training: Reiki practitioners undergo specific training and [BLANK_7], while traditional healers often inherit their role and learn through apprenticeship.\\n\\nThe Integration of Reiki in Timor-Leste\\n\\nAs Reiki has been introduced to Timor-Leste, it has been adapted to fit within the local cultural context. Many Timorese have found that the practice complements their existing beliefs and practices. For example, the Reiki principle of gratitude aligns well with the strong sense of community and reciprocity in Timorese culture.\\n\\nReiki classes in Timor-Leste often incorporate local elements, such as using traditional Tais cloth during attunements or practicing Reiki in sacred locations. This cultural adaptation has helped make Reiki more accessible and relevant to the Timorese population.\\n\\nConclusion\\n\\nThe foundations of Reiki in Timor-Leste represent a fascinating blend of Eastern healing philosophy and Timorese cultural traditions. As this young nation continues to develop and engage with global influences, practices like Reiki offer new tools for healing and personal growth. While respecting and preserving traditional healing methods, many Timorese are finding value in the principles and practices of Reiki, integrating them into their daily lives and healthcare practices. This integration demonstrates the adaptability of both Reiki and Timorese culture, pointing towards a holistic approach to health and well-being that draws from both ancient wisdom and modern practices.",
  "vocabulary": {
    "[BLANK_1]": "Just for today, I will not be angry.",
    "[BLANK_2]": "Just for today, I will not worry.",
    "[BLANK_3]": "Just for today, I will be grateful.",
    "[BLANK_4]": "Just for today, I will do my work honestly.",
    "[BLANK_5]": "Just for today, I will be kind to every living thing.",
    "[BLANK_6]": "Holistic approach: Both Reiki and traditional Timorese healing view health as a balance of physical, emotional, and spiritual well-being.",
    "[BLANK_7]": "[BLANK_5]: While the concepts may differ, both systems recognize the role of unseen energies in health and healing.",
    "[BLANK_8]": "Importance of intention: In both practices, the healer's intention and focus are considered crucial to the [BLANK_6] process.",
    "[BLANK_9]": "Origin: Reiki is a relatively modern, imported practice, while Timorese healing traditions have been passed down through generations.",
    "[BLANK_10]": "Technique: Reiki involves the laying on of hands and does not typically use physical substances, whereas traditional Timorese healing often incorporates herbal remedies and ritualistic objects.",
    "[BLANK_11]": "Training: Reiki practitioners undergo specific training and [BLANK_7], while traditional healers often inherit their role and learn through apprenticeship.",
    "[BLANK_12]": "Reiki",
    "[BLANK_13]": "healing",
    "[BLANK_14]": "Mikao Usui",
    "[BLANK_15]": "life force energy",
    "[BLANK_16]": "Energy-based",
    "[BLANK_17]": "healing",
    "[BLANK_18]": "attunements",
    "[BLANK_19]": "meditation",
    "[BLANK_20]": "chakra",
    "[BLANK_21]": "traditional medicine"
  }
}