{
  "reading": "Practical Applications of Kabbalah and Tarot\\n\\nIntroduction\\n\\nThe ancient wisdom traditions of Kabbalah and Tarot have endured for centuries, offering seekers profound insights into the nature of existence and the human psyche. While often shrouded in mystery, these esoteric systems have practical applications that can enrich one's spiritual journey and foster personal growth. This article explores how Kabbalah and Tarot can be utilized as tools for [BLANK_1], [BLANK_2], and ethical living in the modern world.\\n\\nKabbalistic Meditation\\n\\nAt its core, Kabbalah is a mystical tradition aimed at understanding the nature of the divine and humanity's relationship to it. One of the most accessible ways to engage with Kabbalistic wisdom is through [BLANK_2], particularly [BLANK_3] techniques centered on the [BLANK_4]. This symbolic diagram represents the interconnected attributes of God that form the structure of all creation.\\n\\nIn Kabbalistic meditation, practitioners visualize themselves ascending the Tree of Life, starting from the physical realm (Malkuth) and progressing through higher states of consciousness. Each sphere, or Sephirah, on the Tree corresponds to different divine attributes and aspects of human experience. By contemplating these energies, one can gain deeper insights into the self and cultivate spiritual awareness.\\n\\nFor example, meditating on Yesod, the sphere associated with the subconscious mind and dreams, can help uncover hidden motivations and patterns in one's life. Similarly, focusing on Tiphareth, the sphere of harmony and beauty, can foster a sense of inner balance and connection to the divine.\\n\\nTarot for Self-Reflection\\n\\nWhile often associated with fortune-telling, the Tarot is a powerful system for self-reflection and personal growth. The 78 cards of the Tarot deck contain a wealth of symbolic imagery that speaks to universal human experiences and archetypes. By engaging with these symbols, individuals can gain new perspectives on their lives and tap into their intuition.\\n\\nOne simple yet effective way to use Tarot for self-reflection is the three-card [BLANK_5]. In this technique, three cards are drawn to represent the past, present, and future of a situation or question. For instance, someone contemplating a career change might draw:\\n\\n1. The Tower (past) - indicating a period of upheaval or sudden change\\n2. The Hermit (present) - suggesting a time of introspection and soul-searching\\n3. The Sun (future) - pointing towards clarity, success, and fulfillment\\n\\nBy reflecting on the meanings and interactions of these cards, the individual can gain insights into their journey and potential paths forward. It's important to note that Tarot readings are not meant to predict a fixed future, but rather to illuminate possibilities and stimulate self-reflection.\\n\\nEthical Considerations\\n\\nAs with any spiritual or divinatory practice, it's crucial to approach Kabbalah and Tarot with [BLANK_6] consideration and respect. These traditions are not meant to replace professional advice or to be used manipulatively. Instead, they should be viewed as tools for personal growth and understanding.\\n\\nWhen using Tarot, it's important to maintain boundaries and respect the free will of others. Readings should focus on empowering individuals to make their own decisions rather than creating dependency or making absolute predictions. Similarly, Kabbalistic practices should be approached with humility and a recognition of their sacred nature.\\n\\nIntegrating with Other Spiritual Traditions\\n\\nWhile Kabbalah and Tarot have their roots in Western esoteric traditions, their principles can often find resonance with other spiritual practices. For example, the emphasis on self-reflection and ethical living in Kabbalah shares commonalities with Buddhist mindfulness practices. The archetypal imagery of the Tarot can be related to the symbolic systems found in many indigenous spiritual traditions.\\n\\nIn Timor-Leste, for instance, traditional animist beliefs emphasize the interconnectedness of all things and the importance of maintaining harmony with the natural and spiritual worlds. This holistic worldview aligns well with Kabbalistic concepts of divine emanation and the interconnected nature of the Tree of Life.\\n\\nConclusion\\n\\nThe practical applications of Kabbalah and Tarot offer modern seekers valuable tools for self-discovery, spiritual growth, and ethical living. Through Kabbalistic meditation, individuals can explore the depths of their consciousness and connect with divine energies. Tarot provides a mirror for self-reflection and intuitive insight. When approached with respect and ethical consideration, these ancient wisdom traditions can provide profound guidance for navigating the complexities of contemporary life.\\n\\nAs with any spiritual practice, the true value of Kabbalah and Tarot lies not in their mystique, but in their ability to foster personal transformation and a deeper understanding of oneself and the world. By integrating these tools into one's spiritual repertoire, individuals can embark on a rich journey of self-discovery and growth.",
  "vocabulary": {
    "[BLANK_1]": "The Tower (past) - indicating a period of upheaval or sudden change",
    "[BLANK_2]": "The Hermit (present) - suggesting a time of introspection and soul-searching",
    "[BLANK_3]": "The Sun (future) - pointing towards clarity, success, and fulfillment",
    "[BLANK_4]": "self-reflection",
    "[BLANK_5]": "meditation",
    "[BLANK_6]": "visualization",
    "[BLANK_7]": "Tree of Life",
    "[BLANK_8]": "spread",
    "[BLANK_9]": "ethical",
    "[BLANK_10]": "Kabbalah",
    "[BLANK_11]": "Tarot",
    "[BLANK_12]": "interpretation",
    "[BLANK_13]": "Major Arcana"
  }
}