{
  "reading": "The Major Arcana of Tarot\\n\\nIntroduction\\n\\nThe Tarot is a deck of 78 cards that has been used for centuries for [BLANK_1], self-reflection, and spiritual insight. At the heart of the Tarot lies the Major Arcana, a set of 22 cards that represent universal [BLANK_2] and the journey of human experience. This paper will explore the significance, [BLANK_3], and [BLANK_4] of the Major Arcana, shedding light on why these cards continue to captivate and inspire people around the world.\\n\\nThe Structure and Significance of the Major Arcana\\n\\nThe Major Arcana, also known as the trump cards, form the foundation of the Tarot deck. Each card is numbered from 0 to 21 and depicts a specific archetype or life experience. These cards are considered to hold deeper, more profound meanings than the [BLANK_5], which deal with day-to-day events and emotions.\\n\\nThe sequence of the Major Arcana is often referred to as the \\\"Fool's Journey,\\\" symbolizing the path of human spiritual development and self-discovery. This journey begins with The Fool (0) and concludes with The World (21), representing the completion of a cycle and the attainment of wholeness.\\n\\nKey Cards and Their Symbolism\\n\\nTo understand the depth and complexity of the Major Arcana, let's examine five pivotal cards:\\n\\n1. The Fool (0): Often depicted as a young man about to step off a cliff, The Fool represents new beginnings, innocence, and potential. This card encourages taking risks and embracing the unknown.\\n\\n2. The Magician (1): Symbolizing willpower, skill, and manifestation, The Magician stands before a table with the four suits of the Tarot, indicating mastery over the elements and the ability to turn ideas into reality.\\n\\n3. The High Priestess (2): Representing [BLANK_6], mystery, and the subconscious mind, The High Priestess sits between two pillars, embodying the balance between the seen and unseen worlds.\\n\\n4. The Empress (3): A symbol of fertility, nurturing, and abundance, The Empress connects with the natural world and represents the creative power of the feminine.\\n\\n5. The Emperor (4): Depicting authority, structure, and worldly power, The Emperor sits on a throne adorned with ram's heads, symbolizing leadership and the establishment of order.\\n\\nInterpretations and Cultural Significance\\n\\nThe interpretations of the Major Arcana cards can vary depending on the context, the reader's intuition, and the specific Tarot tradition being followed. However, these cards generally offer profound insights into human nature, personal growth, and the cycles of life.\\n\\nIn many cultures, the archetypes represented in the Major Arcana find parallels in local myths, legends, and spiritual traditions. For example, The Fool's journey can be compared to the hero's journey in mythology, a concept popularized by Joseph Campbell. Similarly, cards like The Empress and The Emperor may resonate with creation myths and divine figures from various religions.\\n\\nThe flexibility of Tarot symbolism allows for adaptation and reinterpretation across different cultural contexts. For instance, a Timorese interpretation of the Major Arcana might incorporate local symbols, deities, or cultural values, making the Tarot more relevant and meaningful to that specific community.\\n\\nModern Applications and Relevance\\n\\nWhile traditionally associated with divination, the Major Arcana has found applications beyond fortune-telling in the modern world. Many psychologists and therapists use Tarot archetypes as tools for self-reflection and personal growth. The rich symbolism of the cards can serve as a mirror for the subconscious mind, helping individuals gain insights into their thoughts, emotions, and behaviors.\\n\\nArtists and writers often draw inspiration from the Major Arcana, using its archetypes and symbolism to create compelling narratives and visual art. The cards' universal themes continue to resonate in contemporary storytelling, from literature to film and television.\\n\\nConclusion\\n\\nThe Major Arcana of Tarot represents a profound exploration of the human experience, offering a symbolic language for understanding life's journey and the complexities of the human psyche. Whether used for divination, self-reflection, or artistic inspiration, these 22 cards continue to offer valuable insights and spark meaningful conversations across cultures and generations. As we navigate the challenges and opportunities of the modern world, the timeless wisdom encoded in the Major Arcana remains a valuable tool for personal growth and understanding.",
  "vocabulary": {
    "[BLANK_1]": "The Fool (0): Often depicted as a young man about to step off a cliff, The Fool represents new beginnings, innocence, and potential. This card encourages taking risks and embracing the unknown.",
    "[BLANK_2]": "The Magician (1): Symbolizing willpower, skill, and manifestation, The Magician stands before a table with the four suits of the Tarot, indicating mastery over the elements and the ability to turn ideas into reality.",
    "[BLANK_3]": "The High Priestess (2): Representing [BLANK_6], mystery, and the subconscious mind, The High Priestess sits between two pillars, embodying the balance between the seen and unseen worlds.",
    "[BLANK_4]": "The Empress (3): A symbol of fertility, nurturing, and abundance, The Empress connects with the natural world and represents the creative power of the feminine.",
    "[BLANK_5]": "The Emperor (4): Depicting authority, structure, and worldly power, The Emperor sits on a throne adorned with ram's heads, symbolizing leadership and the establishment of order.",
    "[BLANK_6]": "divination",
    "[BLANK_7]": "archetypes",
    "[BLANK_8]": "symbolism",
    "[BLANK_9]": "interpretations",
    "[BLANK_10]": "Minor Arcana",
    "[BLANK_11]": "intuition",
    "[BLANK_12]": "Rider-Waite",
    "[BLANK_13]": "Major Arcana",
    "[BLANK_14]": "Arcana",
    "[BLANK_15]": "Tarot"
  }
}