{
  "reading": "Clean cooking is a critical global issue that impacts billions of people worldwide, particularly in developing countries. This paper provides an introduction to clean cooking, exploring its importance, the challenges associated with traditional cooking methods, and the potential solutions offered by clean cooking technologies.\\n\\nTraditional cooking practices in many parts of the world involve the use of open fires or rudimentary stoves that burn [BLANK_1] fuels inefficiently. This inefficiency leads to several pressing issues:\\n\\n1. Health Risks: [BLANK_2] resulting from traditional cooking methods is a major health concern. The smoke and [BLANK_3] released during cooking can lead to severe [BLANK_4], eye problems, and burns. Women and children, who often spend the most time near cooking areas, are disproportionately affected by these health risks.\\n\\n2. Environmental Impact: The reliance on biomass fuels for cooking contributes significantly to [BLANK_5] and land degradation. As trees are cut down for fuel, ecosystems are disrupted, leading to loss of biodiversity. Moreover, the incomplete combustion of biomass fuels releases greenhouse gases, contributing to climate change.\\n\\n3. Socioeconomic Burden: The time and effort required to collect firewood or other biomass fuels can be substantial, particularly in rural areas. This burden often falls on women and children, limiting their opportunities for education, income generation, and other productive activities.\\n\\n[BLANK_6] offer promising solutions to address the challenges posed by traditional cooking methods. These technologies aim to reduce harmful emissions, improve [BLANK_7], and provide safer cooking environments. Some examples include:\\n\\n1. [BLANK_8]: These stoves are designed to burn biomass fuels more efficiently, reducing fuel consumption and emissions. They often include features like chimneys or smoke hoods to direct smoke away from the cooking area.\\n\\n2. LPG (Liquefied Petroleum Gas) Stoves: LPG is a cleaner-burning fuel that produces significantly less indoor air pollution compared to biomass fuels. However, the cost and availability of LPG can be barriers to adoption in some areas.\\n\\n3. Electric Stoves: In areas with reliable electricity access, electric stoves offer a clean cooking solution. They produce no direct emissions in the household, though the overall environmental impact depends on the source of electricity generation.\\n\\n4. Solar Cookers: These devices use sunlight to cook food, eliminating the need for fuel and producing no emissions. However, they are limited by weather conditions and cooking time constraints.\\n\\nPromoting clean cooking technologies has far-reaching benefits:\\n\\n1. Health Improvements: By reducing indoor air pollution, clean cooking solutions can significantly decrease the incidence of respiratory diseases, eye problems, and burns associated with traditional cooking methods.\\n\\n2. Environmental Conservation: Efficient cookstoves and alternative fuels can help reduce deforestation rates and greenhouse gas emissions, contributing to climate change mitigation efforts.\\n\\n3. Women's Empowerment: Clean cooking technologies can free up time for women and girls, allowing them to pursue education, income-generating activities, and other opportunities.\\n\\n4. Economic Benefits: Reduced fuel consumption can lead to cost savings for households, while the production and distribution of clean cooking technologies can create new economic opportunities.\\n\\nClean cooking is a critical issue at the intersection of public health, environmental conservation, and sustainable development. While traditional cooking methods continue to pose significant challenges in many parts of the world, clean cooking technologies offer promising solutions. However, widespread adoption of these technologies requires addressing barriers such as cost, cultural preferences, and infrastructure limitations. As global awareness of the importance of clean cooking grows, continued research, investment, and policy support will be crucial in transitioning towards cleaner, safer, and more sustainable cooking practices worldwide.",
  "vocabulary": {
    "[BLANK_1]": "Health Risks: [BLANK_2] resulting from traditional cooking methods is a major health concern. The smoke and [BLANK_3] released during cooking can lead to severe [BLANK_4], eye problems, and burns. Women and children, who often spend the most time near cooking areas, are disproportionately affected by these health risks.",
    "[BLANK_2]": "Environmental Impact: The reliance on biomass fuels for cooking contributes significantly to [BLANK_5] and land degradation. As trees are cut down for fuel, ecosystems are disrupted, leading to loss of biodiversity. Moreover, the incomplete combustion of biomass fuels releases greenhouse gases, contributing to climate change.",
    "[BLANK_3]": "Socioeconomic Burden: The time and effort required to collect firewood or other biomass fuels can be substantial, particularly in rural areas. This burden often falls on women and children, limiting their opportunities for education, income generation, and other productive activities.",
    "[BLANK_4]": "[BLANK_8]: These stoves are designed to burn biomass fuels more efficiently, reducing fuel consumption and emissions. They often include features like chimneys or smoke hoods to direct smoke away from the cooking area.",
    "[BLANK_5]": "LPG (Liquefied Petroleum Gas) Stoves: LPG is a cleaner-burning fuel that produces significantly less indoor air pollution compared to biomass fuels. However, the cost and availability of LPG can be barriers to adoption in some areas.",
    "[BLANK_6]": "Electric Stoves: In areas with reliable electricity access, electric stoves offer a clean cooking solution. They produce no direct emissions in the household, though the overall environmental impact depends on the source of electricity generation.",
    "[BLANK_7]": "Solar Cookers: These devices use sunlight to cook food, eliminating the need for fuel and producing no emissions. However, they are limited by weather conditions and cooking time constraints.",
    "[BLANK_8]": "Health Improvements: By reducing indoor air pollution, clean cooking solutions can significantly decrease the incidence of respiratory diseases, eye problems, and burns associated with traditional cooking methods.",
    "[BLANK_9]": "Environmental Conservation: Efficient cookstoves and alternative fuels can help reduce deforestation rates and greenhouse gas emissions, contributing to climate change mitigation efforts.",
    "[BLANK_10]": "Women's Empowerment: Clean cooking technologies can free up time for women and girls, allowing them to pursue education, income-generating activities, and other opportunities.",
    "[BLANK_11]": "Economic Benefits: Reduced fuel consumption can lead to cost savings for households, while the production and distribution of clean cooking technologies can create new economic opportunities.",
    "[BLANK_12]": "biomass",
    "[BLANK_13]": "Indoor air pollution",
    "[BLANK_14]": "particulate matter",
    "[BLANK_15]": "respiratory diseases",
    "[BLANK_16]": "deforestation",
    "[BLANK_17]": "Clean cooking technologies",
    "[BLANK_18]": "fuel efficiency",
    "[BLANK_19]": "Improved cookstoves",
    "[BLANK_20]": "Three-stone fire",
    "[BLANK_21]": "Carbon monoxide"
  }
}