{
  "reading": "Improved Biomass Cookstoves: A Step Towards Sustainable Cooking\\n\\nIntroduction\\n\\nCooking is a fundamental human activity, but for millions of people worldwide, it comes with significant health and environmental costs. Traditional biomass cookstoves, which rely on burning wood, crop residues, or animal dung, are widely used in developing countries. However, these stoves are often inefficient and produce harmful emissions. Improved biomass cookstoves offer a promising solution to these challenges, providing a more efficient and cleaner way to cook using locally available fuels.\\n\\nTypes of Improved Biomass Cookstoves\\n\\nThere are several types of improved biomass cookstoves, each designed to address specific cooking needs and environmental conditions. Three common types are:\\n\\n1. [BLANK_1] stoves: These stoves feature an L-shaped [BLANK_2] that promotes efficient burning and directs heat to the cooking pot. The design allows for better air flow, resulting in more complete [BLANK_3] and reduced smoke emissions.\\n\\n2. [BLANK_4] stoves: These advanced stoves convert solid biomass into a combustible gas before burning it. This two-stage process results in very clean combustion and high [BLANK_5]. Gasifier stoves can achieve near-complete fuel burning, significantly reducing emissions.\\n\\n3. [BLANK_6] stoves: Popular in Central America, these stoves feature a large flat cooking surface (plancha) and a [BLANK_7] to vent smoke outside the home. They are particularly suitable for cooking tortillas and other flatbreads while reducing indoor air pollution.\\n\\nPrinciples of Efficient Combustion\\n\\nImproved biomass cookstoves are designed based on several key principles of efficient combustion:\\n\\n1. Complete fuel burning: By ensuring adequate air supply and maintaining high temperatures in the combustion chamber, improved stoves can achieve more complete fuel burning. This reduces the production of harmful emissions such as carbon monoxide and particulate matter.\\n\\n2. Effective heat transfer: The stove design focuses on directing heat to the cooking pot efficiently. This is often achieved through careful shaping of the combustion chamber and minimizing the distance between the flame and the pot.\\n\\n3. [BLANK_8]: Many improved stoves incorporate insulative materials to retain heat within the stove body. This helps maintain high combustion temperatures and reduces heat loss to the environment, improving overall efficiency.\\n\\nMaterials and Construction\\n\\nImproved biomass cookstoves can be constructed using a variety of locally available materials, making them adaptable to different regions and resources. Common materials include:\\n\\n1. Clay and ceramic: These materials are often used to create the combustion chamber liner due to their heat-resistant properties and ability to be molded into specific shapes.\\n\\n2. Metal: Sheet metal is frequently used for the outer body of the stove and sometimes for the combustion chamber in more industrialized designs.\\n\\n3. Insulative bricks: Special bricks made from materials like vermiculite or perlite are used to insulate the stove, improving efficiency and reducing external surface temperatures.\\n\\nThe construction techniques vary depending on the stove design and available materials, but often involve a combination of molding, casting, and assembly processes.\\n\\nMaintenance and Troubleshooting\\n\\nTo ensure long-term performance, improved cookstoves require regular maintenance:\\n\\n1. Cleaning: Regular removal of ash and soot from the combustion chamber and chimney (if present) is essential for maintaining efficiency and preventing blockages.\\n\\n2. Replacing worn parts: Components such as grates or pot supports may need periodic replacement due to wear from high temperatures and use.\\n\\n3. Addressing common issues: Users may need to [BLANK_9] problems like excessive smoke production (often due to wet fuel or poor air flow) or inefficient burning (which may indicate a need for cleaning or repair).\\n\\nBenefits and Impact\\n\\nImproved biomass cookstoves offer numerous benefits over traditional cooking methods:\\n\\n1. Reduced fuel consumption: Many improved stoves can reduce fuel use by 30-60%, saving time and money for users and reducing pressure on local forests.\\n\\n2. Decreased emissions: By burning fuel more completely and efficiently, these stoves significantly reduce harmful emissions, improving indoor air quality and reducing health risks associated with smoke exposure.\\n\\n3. Time savings: Less time spent collecting fuel and faster cooking times free up users (often women and girls) for other activities, including education and income generation.\\n\\n4. Environmental protection: Reduced fuel consumption and more complete combustion help mitigate deforestation and climate change impacts associated with traditional biomass burning.\\n\\nConclusion\\n\\nImproved biomass cookstoves represent a significant advancement in cooking technology for developing regions. By applying principles of efficient combustion and utilizing locally available materials, these stoves offer a practical solution to the health and environmental challenges posed by traditional cooking methods. As awareness grows and technology continues to improve, the widespread adoption of improved cookstoves has the potential to dramatically impact the lives of millions, contributing to better health outcomes, environmental sustainability, and economic development in communities around the world.",
  "vocabulary": {
    "[BLANK_1]": "[BLANK_1] stoves: These stoves feature an L-shaped [BLANK_2] that promotes efficient burning and directs heat to the cooking pot. The design allows for better air flow, resulting in more complete [BLANK_3] and reduced smoke emissions.",
    "[BLANK_2]": "[BLANK_4] stoves: These advanced stoves convert solid biomass into a combustible gas before burning it. This two-stage process results in very clean combustion and high [BLANK_5]. Gasifier stoves can achieve near-complete fuel burning, significantly reducing emissions.",
    "[BLANK_3]": "[BLANK_6] stoves: Popular in Central America, these stoves feature a large flat cooking surface (plancha) and a [BLANK_7] to vent smoke outside the home. They are particularly suitable for cooking tortillas and other flatbreads while reducing indoor air pollution.",
    "[BLANK_4]": "Complete fuel burning: By ensuring adequate air supply and maintaining high temperatures in the combustion chamber, improved stoves can achieve more complete fuel burning. This reduces the production of harmful emissions such as carbon monoxide and particulate matter.",
    "[BLANK_5]": "Effective heat transfer: The stove design focuses on directing heat to the cooking pot efficiently. This is often achieved through careful shaping of the combustion chamber and minimizing the distance between the flame and the pot.",
    "[BLANK_6]": "[BLANK_8]: Many improved stoves incorporate insulative materials to retain heat within the stove body. This helps maintain high combustion temperatures and reduces heat loss to the environment, improving overall efficiency.",
    "[BLANK_7]": "Clay and ceramic: These materials are often used to create the combustion chamber liner due to their heat-resistant properties and ability to be molded into specific shapes.",
    "[BLANK_8]": "Metal: Sheet metal is frequently used for the outer body of the stove and sometimes for the combustion chamber in more industrialized designs.",
    "[BLANK_9]": "Insulative bricks: Special bricks made from materials like vermiculite or perlite are used to insulate the stove, improving efficiency and reducing external surface temperatures.",
    "[BLANK_10]": "Cleaning: Regular removal of ash and soot from the combustion chamber and chimney (if present) is essential for maintaining efficiency and preventing blockages.",
    "[BLANK_11]": "Replacing worn parts: Components such as grates or pot supports may need periodic replacement due to wear from high temperatures and use.",
    "[BLANK_12]": "Addressing common issues: Users may need to [BLANK_9] problems like excessive smoke production (often due to wet fuel or poor air flow) or inefficient burning (which may indicate a need for cleaning or repair).",
    "[BLANK_13]": "Reduced fuel consumption: Many improved stoves can reduce fuel use by 30-60%, saving time and money for users and reducing pressure on local forests.",
    "[BLANK_14]": "Decreased emissions: By burning fuel more completely and efficiently, these stoves significantly reduce harmful emissions, improving indoor air quality and reducing health risks associated with smoke exposure.",
    "[BLANK_15]": "Time savings: Less time spent collecting fuel and faster cooking times free up users (often women and girls) for other activities, including education and income generation.",
    "[BLANK_16]": "Environmental protection: Reduced fuel consumption and more complete combustion help mitigate deforestation and climate change impacts associated with traditional biomass burning.",
    "[BLANK_17]": "Rocket",
    "[BLANK_18]": "combustion chamber",
    "[BLANK_19]": "combustion",
    "[BLANK_20]": "Gasifier",
    "[BLANK_21]": "efficiency",
    "[BLANK_22]": "Plancha",
    "[BLANK_23]": "chimney",
    "[BLANK_24]": "Insulation",
    "[BLANK_25]": "troubleshoot",
    "[BLANK_26]": "thermal mass"
  }
}